PBB022;#1062248;doc#134;2023;https://search.corpuskiparla.it/corpus/player/player.cgi?code=PBB022&begin=2203730&end=2212840;2203730;2212840;BOI086;PBB022;00:58:37;fisso;https://search.corpuskiparla.it/corpus/conversations/PBB022.html;https://search.corpuskiparla.it/corpus/conversations/PBB022_jefferson.html;56-60;F;BO;artig;sì;asimmetrico;emilia-romagna;dip_tec_prof;3;intervista semistrutturata;proiettato un un film porno no // oddio che ridere è vero è vero // e io l''ho trovata una cosa ma spiritosissima nel senso eh;sai;proprio la la voglia ancora di fare una goliardata una cretinata hai capito una // sì // l''ho trovata una cosa veramente;1;1;;;;;;;;;;;;;;;;;;;;;;;;;;;;;;;;
PBB022;#1062460;doc#134;2023;https://search.corpuskiparla.it/corpus/player/player.cgi?code=PBB022&begin=2263560&end=2269590;2263560;2269590;BOI086;PBB022;00:58:37;fisso;https://search.corpuskiparla.it/corpus/conversations/PBB022.html;https://search.corpuskiparla.it/corpus/conversations/PBB022_jefferson.html;56-60;F;BO;artig;sì;asimmetrico;emilia-romagna;dip_tec_prof;3;intervista semistrutturata;in cortili di palazzi // che normalmente sono chiusi // che normalmente sono chiusi che tu magari puoi sbirciare;sai;quando si apre un cancello esce una macchina così vuoi un po'' sbirciare però // mh // bello // la possibilità di entrare di;;;;;1;;;;;;;;1;;;;;;;;1;;;;;;;;;1;;;Interazionale & Metatestuale;Marcatura della conoscenza condivisa & Esemplificazione
PBB022;#1064556;doc#134;2023;https://search.corpuskiparla.it/corpus/player/player.cgi?code=PBB022&begin=2833240&end=2839400;2833240;2839400;BOI086;PBB022;00:58:37;fisso;https://search.corpuskiparla.it/corpus/conversations/PBB022.html;https://search.corpuskiparla.it/corpus/conversations/PBB022_jefferson.html;56-60;F;BO;artig;sì;asimmetrico;emilia-romagna;dip_tec_prof;3;intervista semistrutturata;sono gli alberi ovviamente quindi è molto ombreggiato // mh // eh dove fanno la la festa dell''unità dove fanno eh mh eh //;sai;che fanno anche un''altra eh un''altra manifestazione ti ricordi che ci siamo andati anche che mh avete scalato l''albero;1;;1;;;;;;;;;;;;;;;;;;;;;;;;;;;;;;;
PBB022;#1065097;doc#134;2023;https://search.corpuskiparla.it/corpus/player/player.cgi?code=PBB022&begin=2983810&end=2991190;2983810;2991190;BOI086;PBB022;00:58:37;fisso;https://search.corpuskiparla.it/corpus/conversations/PBB022.html;https://search.corpuskiparla.it/corpus/conversations/PBB022_jefferson.html;56-60;F;BO;artig;sì;asimmetrico;emilia-romagna;dip_tec_prof;3;intervista semistrutturata;di aratura? // sì sì sì sì // sì // morta // oppure per dire i magi fanno per la befana bruciano il vecchione hai presente? x;sai;che non mi ricordo se // bruciano la befana ah ecco anche la cosa del del fatto che bruciano il vecchione // eh // ne avevamo;1;;1;;;;;;;;;;;;;;;;;;;;;;;;;;;;;;;
PBB022;#1066174;doc#134;2023;https://search.corpuskiparla.it/corpus/player/player.cgi?code=PBB022&begin=3274150&end=3275430;3274150;3275430;BOR025;PBB022;00:58:37;fisso;https://search.corpuskiparla.it/corpus/conversations/PBB022.html;https://search.corpuskiparla.it/corpus/conversations/PBB022_jefferson.html;21-25;F;BO;stud;sì;asimmetrico;emilia-romagna;laurea in corso;3;intervista semistrutturata;con lo spillo vuol dire molto eh // eh no quello sì eh // è una forza nel senso che eh ci sono delle eh mh // forse non sa;sai;cos''è lo spillo? // no // è // bisogna insegnargli tutto a questa gente io non lo so // ma no ma da noi carnevale // non esiste;1;;1;;;;;;;;;;;;;;;;;;;;;;;;;;;;;;;
KPC002;#1069838;doc#135;2020;https://search.corpuskiparla.it/corpus/player/player.cgi?code=KPC002&begin=776726&end=782020;776726;782020;PKP094;KPC002;00:49:39;libero;https://search.corpuskiparla.it/corpus/conversations/KPC002.html;https://search.corpuskiparla.it/corpus/conversations/KPC002_jefferson.html;51-55;M;AR;intell;no;simmetrico;toscana;phd;3;pasto;// tramite loro // no l''unico potrebbe essere jakob ~ste cose si fa difficili ho pensato subito guarda chiamo jakob e;sai;cosa gli dico // eh infatti // ma scusa eh gli chiedi mi mi dai mi dai l''indirizzo della posta a parte no se c''è già ma chi se ne;1;;1;;;;;;;;;;;;;;;;;;;;;;;;;;;;;;;
KPC002;#1072551;doc#135;2020;https://search.corpuskiparla.it/corpus/player/player.cgi?code=KPC002&begin=1427123&end=1428205;1427123;1428205;PKP056;KPC002;00:49:39;libero;https://search.corpuskiparla.it/corpus/conversations/KPC002.html;https://search.corpuskiparla.it/corpus/conversations/KPC002_jefferson.html;51-55;F;AR;intell;no;simmetrico;toscana;laurea;3;pasto;// io l''ho mangiato // tra l''altro di quelle cose che ho portato è f~ è l''u~ uhm è v~ c''è c''è rimasto solo questo no? // sì // lo;sai;cosa? // occhio ti tagli un dito ora però // no vabbè dai questo mangialo tu // // oddio stasera avrei bisogno di un film;1;;;1;;;;;;;;;;;;;;;;;;;;;;;;;;;;;;
KPC002;#1073358;doc#135;2020;https://search.corpuskiparla.it/corpus/player/player.cgi?code=KPC002&begin=1671330&end=1676083;1671330;1676083;PKP056;KPC002;00:49:39;libero;https://search.corpuskiparla.it/corpus/conversations/KPC002.html;https://search.corpuskiparla.it/corpus/conversations/KPC002_jefferson.html;51-55;F;AR;intell;no;simmetrico;toscana;laurea;3;pasto;che la pallavolo è anche pericolosa // esatto // per il fatto che toccano tutte la stessa palla // bravo ecco // sì ma;sai;teoricamente basta che basterebbe che non si toccassero la barba // xx // basterebbe che tra tra un palleggio e;;;;;1;;;1;;;;;;;;1;;;;;;;;;;;;;;1;;;Interazionale & Metatestuale;Richiesta di accordo/conferma & Gestione del topic: introduzione o ripresa di topic
KPC002;#1073477;doc#135;2020;https://search.corpuskiparla.it/corpus/player/player.cgi?code=KPC002&begin=1707194&end=1712538;1707194;1712538;PKP056;KPC002;00:49:39;libero;https://search.corpuskiparla.it/corpus/conversations/KPC002.html;https://search.corpuskiparla.it/corpus/conversations/KPC002_jefferson.html;51-55;F;AR;intell;no;simmetrico;toscana;laurea;3;pasto;male // // vieni vieni // quindi però dopo si lavano però è vero cioè // mh dice anche la serie a anche di pallavolo così;sai;come fanno a andare avanti? // come la mh il calcio // cioè gli fanno un tampone // no un sierologico cinque giorni prima e;1;;1;;;;;;;;;;;;;;;;;;;;;;;;;;;;;;;
KPC002;#1074430;doc#135;2020;https://search.corpuskiparla.it/corpus/player/player.cgi?code=KPC002&begin=1995630&end=1999972;1995630;1999972;PKP093;KPC002;00:49:39;libero;https://search.corpuskiparla.it/corpus/conversations/KPC002.html;https://search.corpuskiparla.it/corpus/conversations/KPC002_jefferson.html;21-25;M;AR;stud;no;simmetrico;toscana;laurea in corso;3;pasto;// e stanno facendo didattica a distanza integrata // ma la gente in quarantena sta a casa? // stan~ eh eh oh ma scherzi //;sai;tipo lorenzo ros~ no perché lorenzo rossini l''hanno mandato in un hotel a siena // sì lui è andato in un ehm covid hotel // e;;;;;1;;;;;;1;;;;;1;;;;;;;;;;;;;;1;;;Interazionale & Metatestuale;Interruzione & Gestione del topic: introduzione o ripresa di topic
KPC002;#1074524;doc#135;2020;https://search.corpuskiparla.it/corpus/player/player.cgi?code=KPC002&begin=2017768&end=2018851;2017768;2018851;PKP093;KPC002;00:49:39;libero;https://search.corpuskiparla.it/corpus/conversations/KPC002.html;https://search.corpuskiparla.it/corpus/conversations/KPC002_jefferson.html;21-25;M;AR;stud;no;simmetrico;toscana;laurea in corso;3;pasto;// era l''hanno mandato da solo in questo albergo // anche perché lui qualche sintomo l''ha avuto eh // ma te cosa ne;sai;// eh me l''ha detto la madre // ma la xxxx // eh ve~ eh // eh eh eh se lo sa // eh magari // voi che non lo sappia // eh // mah // lui;1;1;;;;;;;;;;;;;;;;;;;;;;;;;;;;;;;;
KPC002;#1076074;doc#135;2020;https://search.corpuskiparla.it/corpus/player/player.cgi?code=KPC002&begin=2475328&end=2477652;2475328;2477652;PKP093;KPC002;00:49:39;libero;https://search.corpuskiparla.it/corpus/conversations/KPC002.html;https://search.corpuskiparla.it/corpus/conversations/KPC002_jefferson.html;21-25;M;AR;stud;no;simmetrico;toscana;laurea in corso;3;pasto;invece secondo me sì beh è una di quelle cose // che proprio con l''età ti viene x te // no no // un giorno ti trovi lì non;sai;perché ma // a lui le cose pratiche non sono mai piaciute // no ma no perché un giorno ti tro~ // ecco // // no ma m~ // xx quello;1;1;;;;;;;;;;;;;;;;;;;;;;;;;;;;;;;;
KPC002;#1076184;doc#135;2020;https://search.corpuskiparla.it/corpus/player/player.cgi?code=KPC002&begin=2500607&end=2503797;2500607;2503797;PKP093;KPC002;00:49:39;libero;https://search.corpuskiparla.it/corpus/conversations/KPC002.html;https://search.corpuskiparla.it/corpus/conversations/KPC002_jefferson.html;21-25;M;AR;stud;no;simmetrico;toscana;laurea in corso;3;pasto;vedi un cantiere // manca poco eh // vede ve~ sessantacinque settanta insomma // // vedi vedi questo cantiere // e non;sai;perché ma senti una una certa attrazione dici // no // no quello guarda // no // per non si sa quale motivo dici ma perché;1;1;;;;;;;;;;;;;;;;;;;;;;;;;;;;;;;;
KPC002;#1077105;doc#135;2020;https://search.corpuskiparla.it/corpus/player/player.cgi?code=KPC002&begin=2735065&end=2737991;2735065;2737991;PKP056;KPC002;00:49:39;libero;https://search.corpuskiparla.it/corpus/conversations/KPC002.html;https://search.corpuskiparla.it/corpus/conversations/KPC002_jefferson.html;51-55;F;AR;intell;no;simmetrico;toscana;laurea;3;pasto;// questa questa è grande eh bisogna ammettere // // il grande gianni togni // unico inimitabile // mamma mia // // ma // lo;sai;quando facevo il cantiere c''avevo il cantiere lì de mh // del mh gazebo insomma del // in che senso c''avevo il cantiere //;1;;1;;;;;;;;;;;;;;;;;;;;;;;;;;;;;;;
PTA001;#1085947;doc#136;2019;https://search.corpuskiparla.it/corpus/player/player.cgi?code=PTA001&begin=2513500&end=2516601;2513500;2516601;TOR002;PTA001;01:32:30;fisso;https://search.corpuskiparla.it/corpus/conversations/PTA001.html;https://search.corpuskiparla.it/corpus/conversations/PTA001_jefferson.html;26-30;M;TO;intell;sì;asimmetrico;piemonte;phd;3;intervista semistrutturata;che // che cacchio ne so che ha l''autoscuola che mette qualcosa // mhmh // eh però // poca roba // no // eh // anche perchè;sai;cosa? il discorso delle sponsorizzazioni è che // molto spesso una volta // c''era un rientro in nero sostanzialmente //;1;;1;;;;;;;;;;;;;;;;;;;;;;;;;;;;;;;
PTA001;#1088517;doc#136;2019;https://search.corpuskiparla.it/corpus/player/player.cgi?code=PTA001&begin=3340110&end=3343702;3340110;3343702;TOR001;PTA001;01:32:30;fisso;https://search.corpuskiparla.it/corpus/conversations/PTA001.html;https://search.corpuskiparla.it/corpus/conversations/PTA001_jefferson.html;26-30;F;TO;intell;sì;asimmetrico;lombardia;phd;3;intervista semistrutturata;// ho visto uno spicchio atipico allora // mah può essere cioè anche perchè noi eravamo veramente quattro gatti quindi;sai;// mah // vai // sìsì // cioè // e // ce n''è sei da fuori e sembra che sono tutti da fuori invece sei veramente due sfigati // xx;;;;;1;1;;;;;;;;;;;;;;;;1;;;;;;;;;;;Metatestuale;Filler, riempimento dei tempi di formulazione
PTA001;#1088702;doc#136;2019;https://search.corpuskiparla.it/corpus/player/player.cgi?code=PTA001&begin=3427510&end=3432707;3427510;3432707;TOR001;PTA001;01:32:30;fisso;https://search.corpuskiparla.it/corpus/conversations/PTA001.html;https://search.corpuskiparla.it/corpus/conversations/PTA001_jefferson.html;26-30;F;TO;intell;sì;asimmetrico;lombardia;phd;3;intervista semistrutturata;come fai a farle così male // quello che cos''è? a che bello sìsìsìsìsìsì // vai // vai // ehi // cosa vuoi? ehi // vai // ma;sai;poi torino comunque anche solo il fatto che la vita costi molto di meno riesci a godertela anche un po'' di più // sì sì sì //;;;;;1;1;1;;;;;;1;;;1;;;;;;;;;;;;;;1;;;Interazionale & Metatestuale;Presa di turno & Marcatura della conoscenza condivisa & Gestione del topic: introduzione o ripresa di topic
PTA001;#1092807;doc#136;2019;https://search.corpuskiparla.it/corpus/player/player.cgi?code=PTA001&begin=5379110&end=5380301;5379110;5380301;TOR002;PTA001;01:32:30;fisso;https://search.corpuskiparla.it/corpus/conversations/PTA001.html;https://search.corpuskiparla.it/corpus/conversations/PTA001_jefferson.html;26-30;M;TO;intell;sì;asimmetrico;piemonte;phd;3;intervista semistrutturata;te ne avanza una // eh // ehsì che ne avanza una xxx // eh // // ma a te quante ne avanzano adesso? // una // mh // è quella che //;sai;cosa faccio? // nel gioco mancano un paio di car~ // io vado sulla giocata monocarta // che sei xxx eh ho capito ho capito ho;1;1;;;;;;;;;;;;;;;;;;;;;;;;;;;;;;;;
KPS002;#1100938;doc#138;2023;https://search.corpuskiparla.it/corpus/player/player.cgi?code=KPS002&begin=698635&end=700173;698635;700173;PKP103;KPS002;00:37:23;libero;https://search.corpuskiparla.it/corpus/conversations/KPS002.html;https://search.corpuskiparla.it/corpus/conversations/KPS002_jefferson.html;21-25;F;CZ;stud;no;simmetrico;calabria;laurea in corso;3;pasto;marracash non non c''è // // io penso // la trippa // eh la trippa sì // non è morzello sono mh // la preferisco al morzello // e;sai;che non sono mai andata alla // come si chiama? sempre da pepe? // da beppe // beppe // no come si chiama? // i fratelli che;1;;1;;;;;;;;;;;;;;;;;;;;;;;;;;;;;;;
KPS002;#1101578;doc#138;2023;https://search.corpuskiparla.it/corpus/player/player.cgi?code=KPS002&begin=864296&end=868210;864296;868210;PKP105;KPS002;00:37:23;libero;https://search.corpuskiparla.it/corpus/conversations/KPS002.html;https://search.corpuskiparla.it/corpus/conversations/KPS002_jefferson.html;51-55;F;CZ;intell;no;simmetrico;calabria;phd;3;pasto;advisor // con cinquecento commenti positivi // perchè quello che interessa sono quelle negative quelle positive eh;sai;no // si possono essere tutte positive // si ma su cinquecentotre recensioni // si // vabbè vedi che sono tre negative può;;;;;1;1;;1;;;;;1;;;;;;;;;;;;;;;;;;;;Interazionale;Richiesta di accordo/conferma & Marcatura della conoscenza condivisa
KPS002;#1105993;doc#138;2023;https://search.corpuskiparla.it/corpus/player/player.cgi?code=KPS002&begin=1989686&end=1993991;1989686;1993991;PKP105;KPS002;00:37:23;libero;https://search.corpuskiparla.it/corpus/conversations/KPS002.html;https://search.corpuskiparla.it/corpus/conversations/KPS002_jefferson.html;51-55;F;CZ;intell;no;simmetrico;calabria;phd;3;pasto;po'' il me~ maestrino a volte // sì sì sì sì // però // insomma quindi dico magari non è tutta colpa mia insomma // vabbè però;sai;la cina non è un paese è quasi un continente // se non mi hanno dato delle basi buone // ammazza sì si // capito // percui mh;;;;;1;1;;;;;;;1;;;;;;;;;;;;;;;;;;;;Interazionale;Marcatura della conoscenza condivisa
KPN019;#1118509;doc#141;2020;https://search.corpuskiparla.it/corpus/player/player.cgi?code=KPN019&begin=514605&end=517905;514605;517905;PKP009;KPN019;00:30:06;libero;https://search.corpuskiparla.it/corpus/conversations/KPN019.html;https://search.corpuskiparla.it/corpus/conversations/KPN019_jefferson.html;56-60;F;VE;intell;no;simmetrico;veneto;laurea;4;pasto;basta un''insalatina? // #un pochetìn de bacaeà bacaeà co l''insalatina in umido // no // tong // xx // eh? // prenditelo tu;sai;dove l''hai messo // #ti more cossa ti vol? // # al fio ghe domando e a ti no ti se in dieta // quello che c''è // #po'' a se mette;1;;;1;;;;;;;;;;;;;;;;;;;;;;;;;;;;;;
KPN019;#1120771;doc#141;2020;https://search.corpuskiparla.it/corpus/player/player.cgi?code=KPN019&begin=1517045&end=1522335;1517045;1522335;PKP030;KPN019;00:30:06;libero;https://search.corpuskiparla.it/corpus/conversations/KPN019.html;https://search.corpuskiparla.it/corpus/conversations/KPN019_jefferson.html;21-25;M;VE;stud;no;simmetrico;veneto;laurea in corso;4;pasto;a casa // l''ho preso alla fine il regalo comunque // #cossa ti ga tolto? // un orologino da xx non una roba esagerata perché;sai;che gli orologi costano però // #ah beo // per chi? // la ale // ah per la ale? // per l''alessia sì no pensavi per la stella? no;1;;1;;;;;;;;;;;;;;;;;;;;;;;;;;;;;;;
TOA3006;#1123557;doc#142;2017/18;https://search.corpuskiparla.it/corpus/player/player.cgi?code=TOA3006&begin=570945&end=580260;570945;580260;TO030;TOA3006;00:21:21;libero;https://search.corpuskiparla.it/corpus/conversations/TOA3006.html;https://search.corpuskiparla.it/corpus/conversations/TOA3006_jefferson.html;21-25;F;TO;stud;no;simmetrico;liguria;laurea in corso;2;conversazione libera;prova scritta // mhmh // a novembre // e poi se passi questa cosa qua non sei entrato fai il corso propedeutico e ad aprile;sai;se sei entrato ad aprile // cioè quindi tu nell'' ipotetico caso che passi la prima selezione devi andare a vivere a roma //;1;1;;;;;;;;;;;;;;;;;;;;;;;;;;;;;;;;
TOA3006;#1123596;doc#142;2017/18;https://search.corpuskiparla.it/corpus/player/player.cgi?code=TOA3006&begin=588409&end=599600;588409;599600;TO030;TOA3006;00:21:21;libero;https://search.corpuskiparla.it/corpus/conversations/TOA3006.html;https://search.corpuskiparla.it/corpus/conversations/TOA3006_jefferson.html;21-25;F;TO;stud;no;simmetrico;liguria;laurea in corso;2;conversazione libera;la prima selezione devi andare a vivere a roma // fare fino ad aprile che comunque cioè tu fai proprio ogni giorno che non;sai;se se ti hanno preso se non ti hanno preso quindi secondo me proprio la vivi malissimo e io sono una persona ansiosa quindi;1;1;;;;;;;;;;;;;;;;;;;;;;;;;;;;;;;;
TOA3006;#1124353;doc#142;2017/18;https://search.corpuskiparla.it/corpus/player/player.cgi?code=TOA3006&begin=780746&end=795781;780746;795781;TO030;TOA3006;00:21:21;libero;https://search.corpuskiparla.it/corpus/conversations/TOA3006.html;https://search.corpuskiparla.it/corpus/conversations/TOA3006_jefferson.html;21-25;F;TO;stud;no;simmetrico;liguria;laurea in corso;2;conversazione libera;mi guardo tutti i film che non ho visto mi leggo tutti i libri che non ho letto mi guardo tutte le serie che non ho guardato;sai;faccio un po'' di no? // sì sì sì sì // un po'' di ripiglio e e poi capisco cosa fare cioè poi ho visto anche che ci sono dei;;;;;1;;;1;;;;;;;;;;;;;;;;;;;;;;;;;Interazionale;Richiesta di accordo/conferma
TOA3006;#1125959;doc#142;2017/18;https://search.corpuskiparla.it/corpus/player/player.cgi?code=TOA3006&begin=1243340&end=1251972;1243340;1251972;TO054;TOA3006;00:21:21;libero;https://search.corpuskiparla.it/corpus/conversations/TOA3006.html;https://search.corpuskiparla.it/corpus/conversations/TOA3006_jefferson.html;;F;TO;stud;no;simmetrico;;laurea in corso;2;conversazione libera;sto e gli insegnanti e // mi faceva un po'' paura perché sapendo che era una scuola molto bro~ buona temevo che ci fossero;sai;piena di gente con la puzza sotto il naso // presuntuosetti eh eh // sia gli insegnanti chei gli allievi // e invece no //;;;;;1;;;;;;;;1;;;;;;;;;;;;;;;1;;1;;;Interazionale & Cognitiva;Marcatura della conoscenza condivisa & Attenuazione
BOA3015;#1135833;doc#145;2017/18;https://search.corpuskiparla.it/corpus/player/player.cgi?code=BOA3015&begin=387723&end=391330;387723;391330;BO086;BOA3015;00:23:11;libero;https://search.corpuskiparla.it/corpus/conversations/BOA3015.html;https://search.corpuskiparla.it/corpus/conversations/BOA3015_jefferson.html;21-25;F;BO;stud;no;simmetrico;estero;laurea in corso;2;conversazione libera;ancora un bel po'' per cui // no // ah okay okay // vabbè // no non importa // e no chi mi ha stufata di bologna un po'' forse sono;sai;// eh cioè non è che mi ha stufata di bologna però le le compagnie no? con cui io uscivo tanto l'' anno scorso i miei amici;;;;;1;;;;;;;;;;;;;;;;;1;;;;;;;;;;;Metatestuale;Filler, riempimento dei tempi di formulazione
BOA3015;#1136490;doc#145;2017/18;https://search.corpuskiparla.it/corpus/player/player.cgi?code=BOA3015&begin=610366&end=612645;610366;612645;BO086;BOA3015;00:23:11;libero;https://search.corpuskiparla.it/corpus/conversations/BOA3015.html;https://search.corpuskiparla.it/corpus/conversations/BOA3015_jefferson.html;21-25;F;BO;stud;no;simmetrico;estero;laurea in corso;2;conversazione libera;lavorare con con persone che magari non // prendi l'' artee ciao ciao belli // si // dev~ non lo so poi ci sono persone che;sai;// le persone che sono veramente appassionate lo fanno e è bellissimo io non non so se sono appassionata così tanto da;;;;;1;;;;;;;;1;;;;;;1;;;;;;;;;;;1;;;Interazionale & Metatestuale;Marcatura della conoscenza condivisa & Riformulazione
BOA3015;#1138054;doc#145;2017/18;https://search.corpuskiparla.it/corpus/player/player.cgi?code=BOA3015&begin=1125981&end=1129066;1125981;1129066;BO086;BOA3015;00:23:11;libero;https://search.corpuskiparla.it/corpus/conversations/BOA3015.html;https://search.corpuskiparla.it/corpus/conversations/BOA3015_jefferson.html;21-25;F;BO;stud;no;simmetrico;estero;laurea in corso;2;conversazione libera;// e poi super coinvolgente presa bene // sì sì sì gi~ ti fa un sacco di domande // eh si che ridere // tra l'' altro adesso lo;sai;no l~ dopo loro m vanno andranno in francia // sì // vicino a montpellier // mh mh // o vicino a dove si sono conosciuti // si;1;1;;;;;;;;;;;;;;;;;;;;;;;;;;;;;;;;
BOA3015;#1138698;doc#145;2017/18;https://search.corpuskiparla.it/corpus/player/player.cgi?code=BOA3015&begin=1293106&end=1296064;1293106;1296064;BO086;BOA3015;00:23:11;libero;https://search.corpuskiparla.it/corpus/conversations/BOA3015.html;https://search.corpuskiparla.it/corpus/conversations/BOA3015_jefferson.html;21-25;F;BO;stud;no;simmetrico;estero;laurea in corso;2;conversazione libera;anno e ti giuro mi ha fatto impressione perchè non non era in s~ ma proprio non era in sè // cioè non che dici vabbè era un po'';sai;in aria no? // ed era con un altro ragazzo che mi sembrava tutto tatuato non so // e mi ha mi ha fermata in via zamboni // e mi;;;;;1;;;;;;;;;;;;;;;;;;;;;1;;;;;;;Cognitiva;Approssimazione
BOA3021;#1139628;doc#146;2019;https://search.corpuskiparla.it/corpus/player/player.cgi?code=BOA3021&begin=311710&end=313147;311710;313147;BO158;BOA3021;01:11:38;libero;https://search.corpuskiparla.it/corpus/conversations/BOA3021.html;https://search.corpuskiparla.it/corpus/conversations/BOA3021_jefferson.html;21-25;M;BO;stud;no;simmetrico;emilia-romagna;laurea in corso;4;conversazione libera;m'' ha detto ah io vorrei imparare il mh il linguaggio dei segni // mh mh // aveva avuto a che fare con queste cose // vabbè già;sai;questo // non era così è così // no eh è così // configurazione ics della mano eh così // il linguaggio tecnico per mandare a;1;1;;;;;;;;;;;;;;;;;;;;;;;;;;;;;;;;
BOA3021;#1143053;doc#146;2019;https://search.corpuskiparla.it/corpus/player/player.cgi?code=BOA3021&begin=1377712&end=1383532;1377712;1383532;BO156;BOA3021;01:11:38;libero;https://search.corpuskiparla.it/corpus/conversations/BOA3021.html;https://search.corpuskiparla.it/corpus/conversations/BOA3021_jefferson.html;21-25;M;BO;stud;no;simmetrico;emilia-romagna;laurea in corso;4;conversazione libera;// x // di auto elettriche // di auto elettriche // e fa da quello che s~ da da quello che scrivi mi pare di capire che non ne;sai;un cazzo di di // // // // // x // // no ma poi io ho iniziato a usare la locuzione vecchi di merda // // // e mi sta x mi sta dando un;1;1;;;;;;;;;;;;;;;;;;;;;;;;;;;;;;;;
BOA3021;#1150779;doc#146;2019;https://search.corpuskiparla.it/corpus/player/player.cgi?code=BOA3021&begin=3817658&end=3821050;3817658;3821050;BO157;BOA3021;01:11:38;libero;https://search.corpuskiparla.it/corpus/conversations/BOA3021.html;https://search.corpuskiparla.it/corpus/conversations/BOA3021_jefferson.html;21-25;M;BO;stud;no;simmetrico;emilia-romagna;laurea in corso;4;conversazione libera;// // ma poi dopo che dopo mi tocca badarlo mi tocca badarlo x // ti scandalizzi // madonna tuo cugino puttana eva // ma;sai;che mio cugino si è trovato la ragazza? anche carina // sì me l'' hai detto ma son contentissimo per lui così non rompe più i;1;;1;;;;;;;;;;;;;;;;;;;;;;;;;;;;;;;
PBC017;#1193291;doc#153;2022;https://search.corpuskiparla.it/corpus/player/player.cgi?code=PBC017&begin=2618210&end=2621949;2618210;2621949;BOI042;PBC017;00:51:26;fisso;https://search.corpuskiparla.it/corpus/conversations/PBC017.html;https://search.corpuskiparla.it/corpus/conversations/PBC017_jefferson.html;71-75;M;BO;pens;sì;asimmetrico;emilia-romagna;med;2;intervista semistrutturata;hanno la f~ sanno che ci sei te dietro che spingi e che fai paura all''azienda // ma in tre persone solo a andar là l''azienda;sai;quando dici che paura ha? niente // eh // e questo è in d~ così in d~ dappertutto in tutte le cose non solo in azienda // sì sì;1;1;;;;;;;;;;;;;;;;;;;;;;;;;;;;;;;;
PBC017;#1194260;doc#153;2022;https://search.corpuskiparla.it/corpus/player/player.cgi?code=PBC017&begin=2917370&end=2920732;2917370;2920732;BOI042;PBC017;00:51:26;fisso;https://search.corpuskiparla.it/corpus/conversations/PBC017.html;https://search.corpuskiparla.it/corpus/conversations/PBC017_jefferson.html;71-75;M;BO;pens;sì;asimmetrico;emilia-romagna;med;2;intervista semistrutturata;scelto fra // non dico comandare ma dirigere qualcosa perché questi non lo sanno fare // prima che arrivino quello che;sai;fare tu qui ci mettono del tempo quindi // hanno in mano un avvenire i giovani che è molto grande solo che non lo sanno;1;;;;;;;;;;;;;;;;;;;;;;;;;;;;;;;;;
PBB030;#1197841;doc#154;2024;https://search.corpuskiparla.it/corpus/player/player.cgi?code=PBB030&begin=894549&end=899607;894549;899607;BOI102;PBB030;01:00:51;fisso;https://search.corpuskiparla.it/corpus/conversations/PBB030.html;https://search.corpuskiparla.it/corpus/conversations/PBB030_jefferson.html;31-35;F;BO;intell;sì;asimmetrico;emilia-romagna;laurea;3;intervista semistrutturata;delle grappe quelle buone fatte magari // mezze in casa alcune proprio da ba~ da bassano // e // cosa dire // // // e // però;sai;cioè che fai tipo l''assaggino quelle cose un po'' un po'' strambe rega // mhmh // mhmh mh mhmh // però dai // m~ e ed era buono;;;;;1;;;;;;;;1;;;;;;;;;;;;;;;;;;;;Interazionale;Marcatura della conoscenza condivisa
