Reference;Token number;Document number;Anno di raccolta;annotation.audio_file;annotation.begin;annotation.end;annotation.participant_code;conversation.code;conversation.duration;conversation.topic;doc.full_conversation;doc.full_jefferson;Età;Genere;Luogo di raccolta;Occupazione;Presenza di moderatore;Rapporto tra i partecipanti;Regione di provenienza;Titolo di studio;Numero di partecipanti;Tipo di interazione;Left;KWIC;Right;Non SD;"Omissione: omettendo ""sai"" cambia il senso della predicazione";"Sintassi: ""sai"" regge una subordinata secondaria (es. sai che…)";"Prosodia: ""sai"" non costituisce un'unità prosodica indipendente";SD;Cumulo;Presa di turno;Richiesta di accordo/conferma;Manifestazione di accordo;Conferma dell'attenzione;Interruzione;Cessione del turno;Marcatura della conoscenza condivisa;Richiesta di attenzione;Strategie di cortesia;Gestione del topic: introduzione o ripresa di topic;Chiusura di un topic;Prolettico, marca di formulazione: ecco;Riformulazione;Marcatura di citazione/discorso riportato;Esemplificazione;Filler, riempimento dei tempi di formulazione;General extenders e marche di generalizzazione;Marcatura dell'inferenza;Modulazione del grado di confidenza del parlante;Approssimazione;Specificazione;Attenuazione;Intensificazione;Polifunzionalità;Dubbî;Commenti;Macrofunzioni;Microfunzioni
PTB009;#6385;doc#0;2019;https://search.corpuskiparla.it/corpus/player/player.cgi?code=PTB009&begin=2027669&end=2031054;2027669;2031054;TOI035;PTB009;00:47:05;fisso;https://search.corpuskiparla.it/corpus/conversations/PTB009.html;https://search.corpuskiparla.it/corpus/conversations/PTB009_jefferson.html;over 85;F;TO;pens;sì;asimmetrico;piemonte;dip_lic;4;intervista semistrutturata;ambienti piccoli ci sono tante cose che non vanno bene // per cui io no // non ti piaceva? // no // troppo chiuso? // c''era;sai;c''è sempre una cricca che comanda in tutte le // in tutte le comunità chiuse // eh che si fa un po'' gli affari suoi eh // okay;;;;;1;;;;;;;;1;;;;;;1;;;;;;;;;;;1;;;Interazionale & Metatestuale;Marcatura della conoscenza condivisa & Riformulazione
PTB009;#6536;doc#0;2019;https://search.corpuskiparla.it/corpus/player/player.cgi?code=PTB009&begin=2073858&end=2077753;2073858;2077753;TOI035;PTB009;00:47:05;fisso;https://search.corpuskiparla.it/corpus/conversations/PTB009.html;https://search.corpuskiparla.it/corpus/conversations/PTB009_jefferson.html;over 85;F;TO;pens;sì;asimmetrico;piemonte;dip_lic;4;intervista semistrutturata;// // ha f~ fatto un po'' la turista adesso // eh sì eh sì siamo andati al parco san vito che è bellissimo // vabbè // forse non;sai;neanche che esiste è sotto la chiesetta di san vito // xxx no beh // su per la collina dai è vicino qui si sale su dalla strada;1;1;;;;;;;;;;;;;;;;;;;;;;;;;;;;;;;;
PTB009;#8767;doc#0;2019;https://search.corpuskiparla.it/corpus/player/player.cgi?code=PTB009&begin=2799369&end=2803502;2799369;2803502;TOI035;PTB009;00:47:05;fisso;https://search.corpuskiparla.it/corpus/conversations/PTB009.html;https://search.corpuskiparla.it/corpus/conversations/PTB009_jefferson.html;over 85;F;TO;pens;sì;asimmetrico;piemonte;dip_lic;4;intervista semistrutturata;l''altro giorno // va bene io ti ringrazio tantissimo per il tempo // grazie mille davvero // a me è piaciuto raccontare;sai;ai vecchi piace raccontare la propria vita // ah perfetto a me anche quindi siamo a posto // // // grazie ancora // ed è;;;;;1;;;;;;;;1;;;;;;;;;;;;;;;;;;;;Interazionale;Marcatura della conoscenza condivisa
TOA3012;#9557;doc#1;2019;https://search.corpuskiparla.it/corpus/player/player.cgi?code=TOA3012&begin=200488&end=202036;200488;202036;TO090;TOA3012;18:02:00;libero;https://search.corpuskiparla.it/corpus/conversations/TOA3012.html;https://search.corpuskiparla.it/corpus/conversations/TOA3012_jefferson.html;21-25;F;TO;stud;no;simmetrico;piemonte;laurea in corso;4;conversazione libera;classico? // solo il luogo // liceo giacomo leopardi // no la città la città // torino // torino // vabbè adesso;sai;anche il mio liceo // vabbè va bene // ben venga // anch'' io scriverà il mio liceo xxx // vai così non mi fai sembrare stupid;1;1;;;;;;;;;;;;;;;;;;;;;;;;;;;;;;;;
PBB023;#18284;doc#2;2023;https://search.corpuskiparla.it/corpus/player/player.cgi?code=PBB023&begin=1510907&end=1516620;1510907;1516620;BOI087;PBB023;00:33:46;fisso;https://search.corpuskiparla.it/corpus/conversations/PBB023.html;https://search.corpuskiparla.it/corpus/conversations/PBB023_jefferson.html;51-55;M;BO;uff;sì;asimmetrico;emilia-romagna;dip_tec_prof;4;intervista semistrutturata;la preparazione invernale a san luca e dovevamo fare i portici entro i quattordici minuti // io no // mamma mia // tu non;sai;quante volte ho vomitato io arrivato su perchè ti assicuro quattordici minuti son pochissimi // // son veramente;1;1;;;;;;;;;;;;;;;;;;;;;;;;;;;;;;;;
PBB023;#18380;doc#2;2023;https://search.corpuskiparla.it/corpus/player/player.cgi?code=PBB023&begin=1536540&end=1541140;1536540;1541140;BOR026;PBB023;00:33:46;fisso;https://search.corpuskiparla.it/corpus/conversations/PBB023.html;https://search.corpuskiparla.it/corpus/conversations/PBB023_jefferson.html;21-25;M;BO;stud;sì;asimmetrico;sardegna;laurea in corso;4;intervista semistrutturata;è che io a san luca ci fossi andato per altri motivi se non quelli ecco // no certo certo sì anch''io mi riferivo al panorama;sai;al // io al panorama e poi io ho anche mangiato su a san luca // sì? // sì ogni tanto andavo anche io andavo su da vito da vito //;;;;;1;;;;;;;;1;;;;;;;;;;1;;;;;;;1;;;Interazionale & Metatestuale;Marcatura della conoscenza condivisa & General extenders e marche di generalizzazione
PBB023;#18560;doc#2;2023;https://search.corpuskiparla.it/corpus/player/player.cgi?code=PBB023&begin=1576300&end=1579710;1576300;1579710;BOI087;PBB023;00:33:46;fisso;https://search.corpuskiparla.it/corpus/conversations/PBB023.html;https://search.corpuskiparla.it/corpus/conversations/PBB023_jefferson.html;51-55;M;BO;uff;sì;asimmetrico;emilia-romagna;dip_tec_prof;4;intervista semistrutturata;altre zone d''italia non lo so // o è una cosa generazionale un po'' secondo voi // sai che è una bella domanda e non // non lo so;sai;che non lo so sinceramente no // non // sai che non ti saprei dare una risposta // non lo so // non lo so di sicuro noi ad;1;;1;;;;;;;;;;;;;;;;;;;;;;;;;;;;;;;
PBB023;#18570;doc#2;2023;https://search.corpuskiparla.it/corpus/player/player.cgi?code=PBB023&begin=1580540&end=1582094;1580540;1582094;BOI088;PBB023;00:33:46;fisso;https://search.corpuskiparla.it/corpus/conversations/PBB023.html;https://search.corpuskiparla.it/corpus/conversations/PBB023_jefferson.html;51-55;F;BO;uff;sì;asimmetrico;emilia-romagna;med;4;intervista semistrutturata;generazionale un po'' secondo voi // sai che è una bella domanda e non // non lo so sai che non lo so sinceramente no // non //;sai;che non ti saprei dare una risposta // non lo so // non lo so di sicuro noi ad esempio ci siamo sposati in comune ma per scelta;1;;1;;;;;;;;;;;;;;;;;;;;;;;;;;;;;;;
PTA012;#20922;doc#3;2019;https://search.corpuskiparla.it/corpus/player/player.cgi?code=PTA012&begin=215300&end=217270;215300;217270;TOI014;PTA012;00:30:28;fisso;https://search.corpuskiparla.it/corpus/conversations/PTA012.html;https://search.corpuskiparla.it/corpus/conversations/PTA012_jefferson.html;16-20;M;TO;disocc;sì;asimmetrico;piemonte;dip_tec_prof;3;intervista semistrutturata;meglio? // sarebbe più semplice? // mh // sicuramente il turismo aiuta molto // perché quando tu hai un negozio // e;sai;gestirlo bene // mh molt~ mh diciamo che ci sono molte più possibilità // che la gente entri dia un''occhiata che si;1;1;;;;;;;;;;;;;;;;;;;;;;;;;;;;;;;;
PBB012;#35277;doc#5;2022;https://search.corpuskiparla.it/corpus/player/player.cgi?code=PBB012&begin=1794965&end=1797665;1794965;1797665;BOI039;PBB012;00:49:50;fisso;https://search.corpuskiparla.it/corpus/conversations/PBB012.html;https://search.corpuskiparla.it/corpus/conversations/PBB012_jefferson.html;51-55;M;BO;comm;sì;asimmetrico;emilia-romagna;laurea;3;intervista semistrutturata;per esempio delle elementari bombicci // su queste vicende così all''inizio era un po'' titubante poi invece // dopo;sai;trovandosi davanti ai bambini // mh // e i bambini aveva era uscivano entusiasti // // // eh lorenzo lorenzo // e allora;;;;;1;;;;;;;;1;;;;;;;;;;;;;;;;;;;;Interazionale;Marcatura della conoscenza condivisa
TOD2016;#44833;doc#8;2019;https://search.corpuskiparla.it/corpus/player/player.cgi?code=TOD2016&begin=385783&end=389689;385783;389689;TO080;TOD2016;00:30:39;fisso;https://search.corpuskiparla.it/corpus/conversations/TOD2016.html;https://search.corpuskiparla.it/corpus/conversations/TOD2016_jefferson.html;21-25;F;TO;stud;sì;simmetrico;lombardia;laurea in corso;2;intervista semistrutturata;più o meno piccole paesini // confinanti uno con l'' altro // ogni // attaccati proprio // attaccate // okay // e quindi non;sai;dove inizia uno e finisce un altro a meno che non vedi un cartello // certo // quindi noi effettivamente siamo in;1;;;1;;;;;;;;;;;;;;;;;;;;;;;;;;;;;;
PTB019;#57504;doc#9;2019;https://search.corpuskiparla.it/corpus/player/player.cgi?code=PTB019&begin=2417887&end=2421585;2417887;2421585;TOI071;PTB019;00:43:39;fisso;https://search.corpuskiparla.it/corpus/conversations/PTB019.html;https://search.corpuskiparla.it/corpus/conversations/PTB019_jefferson.html;66-70;F;TO;pens;sì;asimmetrico;puglia;dip_lic;3;intervista semistrutturata;// devi andare fuori torino per esem~ c''è il mio consuocero che ogni tanto parla // e qualcu~ uno lo senti parlare ma poi;sai;// noneh // se poi parlano stretto non lo capisco proprio // se parlano stretto non lo capisco // e i vostri figli lo;;;;;1;;;;;;;;1;;;;;;;;;1;;;;;;;;1;;;Interazionale & Metatestuale;Marcatura della conoscenza condivisa & Filler, riempimento dei tempi di formulazione
PBA004;#60806;doc#10;2022;https://search.corpuskiparla.it/corpus/player/player.cgi?code=PBA004&begin=852760&end=855400;852760;855400;BOR018;PBA004;00:57:15;fisso;https://search.corpuskiparla.it/corpus/conversations/PBA004.html;https://search.corpuskiparla.it/corpus/conversations/PBA004_jefferson.html;21-25;F;BO;stud;sì;asimmetrico;calabria;laurea in corso;4;intervista semistrutturata;io non lo so anche il fatto ci sono alcuni che puliscono dopo e non lo sopporto pulisci subito // eh // oppure eh però che ne;sai;alcuni // non so si seccano non puoi neanche tanto insistere // con alcuni // ma p~ poi cioè dipende // e anche // dipende;1;;;1;;;;;;;;;;;;;;;;;;;;;;;;;;;;;;
PBA004;#65487;doc#10;2022;https://search.corpuskiparla.it/corpus/player/player.cgi?code=PBA004&begin=2358220&end=2359230;2358220;2359230;BOI060;PBA004;00:57:15;fisso;https://search.corpuskiparla.it/corpus/conversations/PBA004.html;https://search.corpuskiparla.it/corpus/conversations/PBA004_jefferson.html;21-25;M;BO;oper;sì;asimmetrico;emilia-romagna;dip_tec_prof;4;intervista semistrutturata;dietro casa nella parte di dietro che è in discesa // e // a forza di girare girare girare girare ovviamente // dopo un po'';sai;// prendi il ritmo ed inizi ad andar // mh // e niente vado giù per questa discesa ehm sinceramente non ricordo il motivo;;;;;1;;;;;;;;1;;;;;;;;;;;;;;;;;;;;Interazionale;Marcatura della conoscenza condivisa
KPS008;#79325;doc#12;2020;https://search.corpuskiparla.it/corpus/player/player.cgi?code=KPS008&begin=265665&end=268395;265665;268395;PKP040;KPS008;00:29:53;libero;https://search.corpuskiparla.it/corpus/conversations/KPS008.html;https://search.corpuskiparla.it/corpus/conversations/KPS008_jefferson.html;51-55;F;BR;uff;no;simmetrico;estero;laurea;3;pasto;un un pino una cosa del genere // # ho detto ad antonello antonè mo che nasce tua nipote na foresta chiantu // // ieri;sai;perchè li ho riconosciuti alla conad? // mh // perchè ho visto uno che guardava un cane che era entrato alla conad stava;1;1;;;;;;;;;;;;;;;;;;;;;;;;;;;;;;;;
KPS008;#81219;doc#12;2020;https://search.corpuskiparla.it/corpus/player/player.cgi?code=KPS008&begin=1447719&end=1449369;1447719;1449369;PKP040;KPS008;00:29:53;libero;https://search.corpuskiparla.it/corpus/conversations/KPS008.html;https://search.corpuskiparla.it/corpus/conversations/KPS008_jefferson.html;51-55;F;BR;uff;no;simmetrico;estero;laurea;3;pasto;// di tasse? // vuoi? // no // mo stanno quelli là // xx xx // che assumeranno // e metteranno in cassa integrazione lo;sai;no? // be non credo che si possa fare // be eppure molte // mo col centro dell''impiego si vede subito eh // alcuni li hanno;1;;;1;;;;;;;;;;;;;;;;;;;;;;;;;;;;;;
PTB002;#84323;doc#13;2019;https://search.corpuskiparla.it/corpus/player/player.cgi?code=PTB002&begin=971219&end=976063;971219;976063;TOI017;PTB002;01:27:40;fisso;https://search.corpuskiparla.it/corpus/conversations/PTB002.html;https://search.corpuskiparla.it/corpus/conversations/PTB002_jefferson.html;over 85;M;TO;pens;sì;asimmetrico;puglia;elem;3;intervista semistrutturata;una ragazza // ti metteva no per carità // non si poteva // eh chi è che ti diceva ma magari // se non // oh ma quella eh quella;sai;è uscita con quello là questa ragazza perdeva tutto // eh sì poverina certo // eh niente allora niente // volevo ballare;;;;;1;;;;;;;;1;;;;;;;;;;;;;;;;;;;;Interazionale;Marcatura della conoscenza condivisa
TOA3005;#96868;doc#14;2017/18;https://search.corpuskiparla.it/corpus/player/player.cgi?code=TOA3005&begin=185748&end=190573;185748;190573;T0032;TOA3005;00:31:26;libero;https://search.corpuskiparla.it/corpus/conversations/TOA3005.html;https://search.corpuskiparla.it/corpus/conversations/TOA3005_jefferson.html;21-25;M;TO;stud;no;simmetrico;piemonte;laurea in corso;2;conversazione libera;// ha detto che era venuta male perché l'' uovo si era rappreso // quindi // no va bene ma è anche gusto personale eh // sì ma;sai;come sono i romani pretendono di sapere loro come si fa tutto quindi // mi fido anche // lei poi fa una pasta eccezionale //;1;1;;;;;;;;;;;;;;;;;;;;;;;;;;;;;;;;
TOA3005;#97544;doc#14;2017/18;https://search.corpuskiparla.it/corpus/player/player.cgi?code=TOA3005&begin=471513&end=474393;471513;474393;T0032;TOA3005;00:31:26;libero;https://search.corpuskiparla.it/corpus/conversations/TOA3005.html;https://search.corpuskiparla.it/corpus/conversations/TOA3005_jefferson.html;21-25;M;TO;stud;no;simmetrico;piemonte;laurea in corso;2;conversazione libera;ieri non è stata apprezzata abbastanza // perché? // che mondo di xxx // solo venti likes // un mondo di ingoranza sarà che;sai;come xxx // no eh allora posso dirti una cosa? dipende anche all'' ora in cui lo metti l'' ho messa ieri alle tre e tre non è un'';1;;;;;;;;;;;;;;;;;;;;;;;;;;;;;;;;;
TOA3005;#97981;doc#14;2017/18;https://search.corpuskiparla.it/corpus/player/player.cgi?code=TOA3005&begin=723494&end=724844;723494;724844;T0032;TOA3005;00:31:26;libero;https://search.corpuskiparla.it/corpus/conversations/TOA3005.html;https://search.corpuskiparla.it/corpus/conversations/TOA3005_jefferson.html;21-25;M;TO;stud;no;simmetrico;piemonte;laurea in corso;2;conversazione libera;un cesso a pedali così? // no // se no sarei innamorato della xxx // cesso a pedali // a fattona // brutto cesso a pedali //;sai;di cosa sto parlando? // no // è un video bellissimo // uma thurman e donatella versace // e niente ha vinto la lega è troppo;1;1;;;;;;;;;;;;;;;;;;;;;;;;;;;;;;;;
TOA3005;#99654;doc#14;2017/18;https://search.corpuskiparla.it/corpus/player/player.cgi?code=TOA3005&begin=1387581&end=1392308;1387581;1392308;TO030;TOA3005;00:31:26;libero;https://search.corpuskiparla.it/corpus/conversations/TOA3005.html;https://search.corpuskiparla.it/corpus/conversations/TOA3005_jefferson.html;21-25;F;TO;stud;no;simmetrico;liguria;laurea in corso;2;conversazione libera;è una roba che io non sopporto // cioè questa è gente che non ha niente di meglio da fare // e sai che ha ragione mia madre;sai;cosa dice mia madre dice che ''sti qua allo stadio probabilmente vanno // non stanno neanche a guardar la partita passan;1;1;;;;;;;;;;;;;;;;;;;;;;;;;;;;;;;;
PBC005;#103883;doc#15;2021;https://search.corpuskiparla.it/corpus/player/player.cgi?code=PBC005&begin=1085140&end=1092560;1085140;1092560;BOI014;PBC005;01:01:27;fisso;https://search.corpuskiparla.it/corpus/conversations/PBC005.html;https://search.corpuskiparla.it/corpus/conversations/PBC005_jefferson.html;76-80;F;BO;pens;sì;asimmetrico;emilia-romagna;dip_lic;2;intervista semistrutturata;// da usare come // eh // mh laboratorio // per fare le riparazioni // a a a alle ai ai mobili delle persone che abitavano lì;sai;nessuno aveva soldi aveva quelle poche cose // e mio padre si è inventato il mestiere di falegname // perchè non e poi;;;;;1;;;;;;;;1;;;;;;;;;;;;;;;;;;;;Interazionale;Marcatura della conoscenza condivisa
PBC005;#108935;doc#15;2021;https://search.corpuskiparla.it/corpus/player/player.cgi?code=PBC005&begin=2925835&end=2929205;2925835;2929205;BOI014;PBC005;01:01:27;fisso;https://search.corpuskiparla.it/corpus/conversations/PBC005.html;https://search.corpuskiparla.it/corpus/conversations/PBC005_jefferson.html;76-80;F;BO;pens;sì;asimmetrico;emilia-romagna;dip_lic;2;intervista semistrutturata;// ma va là // sì // anche avevano // tante poi avevano una scala mobile anomala // anomala // la scala mobile lo;sai;che è quel meccanismo che // eh // permette a agli stipendi di adeguarsi al costo della vita // adesso e'' tale che è;1;;1;;;;;;;;;;;;;;;;;;;;;;;;;;;;;;;
PTA002;#111743;doc#16;2019;https://search.corpuskiparla.it/corpus/player/player.cgi?code=PTA002&begin=248320&end=254960;248320;254960;TOI003;PTA002;00:05:39;fisso;https://search.corpuskiparla.it/corpus/conversations/PTA002.html;https://search.corpuskiparla.it/corpus/conversations/PTA002_jefferson.html;26-30;M;TO;oper;sì;asimmetrico;piemonte;dip_tec_prof;5;intervista semistrutturata;o bocciarla // okay // okay va bene // però non sei di quelli che fanno le perizie per l''assicurazione // mh magari //;sai;quanta corruzione sai quanti soldi no purtroppo no hanno provato a corrompermi anche lì però // // // // // avevi era più;1;1;;;;;;;;;;;;;;;;;;;;;;;;;;;;;;;;
PTA002;#111746;doc#16;2019;https://search.corpuskiparla.it/corpus/player/player.cgi?code=PTA002&begin=248320&end=254960;248320;254960;TOI003;PTA002;00:05:39;fisso;https://search.corpuskiparla.it/corpus/conversations/PTA002.html;https://search.corpuskiparla.it/corpus/conversations/PTA002_jefferson.html;26-30;M;TO;oper;sì;asimmetrico;piemonte;dip_tec_prof;5;intervista semistrutturata;// okay va bene // però non sei di quelli che fanno le perizie per l''assicurazione // mh magari // sai quanta corruzione;sai;quanti soldi no purtroppo no hanno provato a corrompermi anche lì però // // // // // avevi era più quello che che perdevi;1;1;;;;;;;;;;;;;;;;;;;;;;;;;;;;;;;;
PBB033;#112166;doc#17;2024;https://search.corpuskiparla.it/corpus/player/player.cgi?code=PBB033&begin=51330&end=59006;51330;59006;BOI119;PBB033;00:48:35;fisso;https://search.corpuskiparla.it/corpus/conversations/PBB033.html;https://search.corpuskiparla.it/corpus/conversations/PBB033_jefferson.html;71-75;M;BO;intell;sì;asimmetrico;emilia-romagna;laurea;2;intervista semistrutturata;è un p~ quartiere molto popoloso // mhmh // e invece come persone come si è trovato con gli abitanti di borgo panigale // ma;sai;io poi abitavo mh a casteldebole esattamente che era praticamente un paesino di borgo panigale e faceva // mhmh // ah sì;;;;;1;1;;1;;;;;1;;;;;;;;;;;;;;;;;1;;;Interazionale;Richiesta di accordo/conferma & Marcatura della conoscenza condivisa
PBB033;#113646;doc#17;2024;https://search.corpuskiparla.it/corpus/player/player.cgi?code=PBB033&begin=536459&end=538308;536459;538308;BOR037;PBB033;00:48:35;fisso;https://search.corpuskiparla.it/corpus/conversations/PBB033.html;https://search.corpuskiparla.it/corpus/conversations/PBB033_jefferson.html;21-25;F;BO;stud;sì;asimmetrico;emilia-romagna;laurea in corso;2;intervista semistrutturata;i sette segreti di bologna ne hai sentito parlare // i sette segreti di bologna? ah beh certo io li conosco // cono~;sai;quali sono // sì certo i sette segreti di bologna sono vabbè per me sono alcuni particolari // sì // uno sono // le misure;1;1;;;;;;;;;;;;;;;;;;;;;;;;;;;;;;;;
PBB033;#115057;doc#17;2024;https://search.corpuskiparla.it/corpus/player/player.cgi?code=PBB033&begin=974939&end=979573;974939;979573;BOI119;PBB033;00:48:35;fisso;https://search.corpuskiparla.it/corpus/conversations/PBB033.html;https://search.corpuskiparla.it/corpus/conversations/PBB033_jefferson.html;71-75;M;BO;intell;sì;asimmetrico;emilia-romagna;laurea;2;intervista semistrutturata;tantissimi trenini effettivamente o bus eh // sì sì ce n''è uno che va anche a san luca // mh // e me l''han detto alcuni tu li;sai;oddio? ospiti stranieri anche // m''hanno detto che // sì // eh sono stati a san luca col trenino // no sicuramente è una;1;1;;;;;;;;;;;;;;;;;;;;;;;;;;;;;;;;
PBB033;#115187;doc#17;2024;https://search.corpuskiparla.it/corpus/player/player.cgi?code=PBB033&begin=1029134&end=1032246;1029134;1032246;BOI119;PBB033;00:48:35;fisso;https://search.corpuskiparla.it/corpus/conversations/PBB033.html;https://search.corpuskiparla.it/corpus/conversations/PBB033_jefferson.html;71-75;M;BO;intell;sì;asimmetrico;emilia-romagna;laurea;2;intervista semistrutturata;fatti in casa // mhmh // essere fatti sul dito mignolo dovrebbero essere piccolissimi // perché il dito mignolo? // sì //;sai;che sono stati inventati sull''ombelico di venere // mh xi tortellini dicono no? // sì // c''è chi dice che l''hanno;1;;1;;;;;;;;;;;;;;;;;;;;;;;;;;;;;;;
PBB033;#115925;doc#17;2024;https://search.corpuskiparla.it/corpus/player/player.cgi?code=PBB033&begin=1275371&end=1283413;1275371;1283413;BOI119;PBB033;00:48:35;fisso;https://search.corpuskiparla.it/corpus/conversations/PBB033.html;https://search.corpuskiparla.it/corpus/conversations/PBB033_jefferson.html;71-75;M;BO;intell;sì;asimmetrico;emilia-romagna;laurea;2;intervista semistrutturata;// presepe // l''andavamo a vedere in chiesa andavam~ lo facciamo anche noi lo facevamo l''abbiam fatto anche il presepe;sai;con muschio queste cose qui c''era un po'' di partecipazione però // sì // presepe mi ricordo che l''andavamo sempre a;;;;;1;;;;;;;;1;;;;;;;;1;;;;;;;1;;1;;;Interazionale & Metatestuale & Cognitiva;Marcatura della conoscenza condivisa & Esemplificazione & Attenuazione
PBB033;#116504;doc#17;2024;https://search.corpuskiparla.it/corpus/player/player.cgi?code=PBB033&begin=1471313&end=1471578;1471313;1471578;BOI119;PBB033;00:48:35;fisso;https://search.corpuskiparla.it/corpus/conversations/PBB033.html;https://search.corpuskiparla.it/corpus/conversations/PBB033_jefferson.html;71-75;M;BO;intell;sì;asimmetrico;emilia-romagna;laurea;2;intervista semistrutturata;// ah sì sì no // ehm a bologna è più sentito pasqua natale il carneva~ ah che esa~ tipo il carnevale com''è festeggiato? //;sai;// se è festeggiato // il carnevale sì ma i carnevali poi più famosi sono quelli della periferia quello di san giovanni in;1;1;;;;;;;;;;;1;;;;;;;;;;;;;;;;;1;;;;
PBB033;#116716;doc#17;2024;https://search.corpuskiparla.it/corpus/player/player.cgi?code=PBB033&begin=1531880&end=1535540;1531880;1535540;BOI119;PBB033;00:48:35;fisso;https://search.corpuskiparla.it/corpus/conversations/PBB033.html;https://search.corpuskiparla.it/corpus/conversations/PBB033_jefferson.html;71-75;M;BO;intell;sì;asimmetrico;emilia-romagna;laurea;2;intervista semistrutturata;per il resto era più sentito natale natale era la festa più grande che c''era a bologna // mhmh // sì // più grande che dicevo;sai;natale con i tuoi e pasqua con con chi vuoi // // per cui pasqua potevi anche andare via decidere di fare delle cose insomma;;;;;1;;;;;;;;1;;;;;;;1;;;;;;;;;;1;;;Interazionale & Metatestuale;Marcatura della conoscenza condivisa & Marcatura di citazione/discorso riportato
PBB033;#118101;doc#17;2024;https://search.corpuskiparla.it/corpus/player/player.cgi?code=PBB033&begin=1984767&end=1986558;1984767;1986558;BOI119;PBB033;00:48:35;fisso;https://search.corpuskiparla.it/corpus/conversations/PBB033.html;https://search.corpuskiparla.it/corpus/conversations/PBB033_jefferson.html;71-75;M;BO;intell;sì;asimmetrico;emilia-romagna;laurea;2;intervista semistrutturata;ce ne sono tu li conoscerai // sì sì sì // e il tuo locale preferito dove mangiare a bologna qual è? // quello che più mh // ma;sai;io // preferisci // una volta mangiavo volentieri da vito perché poi sai lì si si giocava a carte poi c''era sempre musica;;;;;1;1;;;;;;;;;;;;;;;;1;;;;;;1;;1;;;Metatestuale & Cognitiva;Filler, riempimento dei tempi di formulazione & Attenuazione
PBB033;#118114;doc#17;2024;https://search.corpuskiparla.it/corpus/player/player.cgi?code=PBB033&begin=1987756&end=1993594;1987756;1993594;BOI119;PBB033;00:48:35;fisso;https://search.corpuskiparla.it/corpus/conversations/PBB033.html;https://search.corpuskiparla.it/corpus/conversations/PBB033_jefferson.html;71-75;M;BO;intell;sì;asimmetrico;emilia-romagna;laurea;2;intervista semistrutturata;a bologna qual è? // quello che più mh // ma sai io // preferisci // una volta mangiavo volentieri da vito perché poi;sai;lì si si giocava a carte poi c''era sempre musica sai // andavi lì a mezzanotte perché io // ho lavorato sai che facevo il;;;;;1;;;;;;;;1;;;;;;;;;;;;;;;;;;;;Interazionale;Marcatura della conoscenza condivisa
