PBC013;#483193;doc#61;2022;https://search.corpuskiparla.it/corpus/player/player.cgi?code=PBC013&begin=2219181&end=2227381;2219181;2227381;BOI035;PBC013;01:08:09;fisso;https://search.corpuskiparla.it/corpus/conversations/PBC013.html;https://search.corpuskiparla.it/corpus/conversations/PBC013_jefferson.html;76-80;F;BO;pens;sì;asimmetrico;emilia-romagna;dip_tec_prof;2;intervista semistrutturata;lì mh trenta e rotti anni // ehm // eh e anche lì oggi non è più così ma neanche lontanamente l'' @nomeazienda non so se lo;sai;// è nata a bologna è stata acquistata coi soldi del movimento cooperativo stava fallendo una piccola assicurazione e e;1;1;;;;;;;;;;;;;;;;;;;;;;;;;;;;;;;;
PBC013;#483799;doc#61;2022;https://search.corpuskiparla.it/corpus/player/player.cgi?code=PBC013&begin=2491510&end=2497191;2491510;2497191;BOI035;PBC013;01:08:09;fisso;https://search.corpuskiparla.it/corpus/conversations/PBC013.html;https://search.corpuskiparla.it/corpus/conversations/PBC013_jefferson.html;76-80;F;BO;pens;sì;asimmetrico;emilia-romagna;dip_tec_prof;2;intervista semistrutturata;uno può dire ma forse è lei // ma invece sono tanti che mi dicono guarda scordati l'' @nomeazienda che hai conosciuto tu;sai;// mica è più così eh ma neanche lontanamente // qualcuno lo considera anche un evoluzione positiva perché come dire sei;;;;;1;;;;;;;;1;;;;;;;;;;;;;;;;;;;;Interazionale;Marcatura della conoscenza condivisa
PBC013;#483958;doc#61;2022;https://search.corpuskiparla.it/corpus/player/player.cgi?code=PBC013&begin=2555120&end=2558152;2555120;2558152;BOI035;PBC013;01:08:09;fisso;https://search.corpuskiparla.it/corpus/conversations/PBC013.html;https://search.corpuskiparla.it/corpus/conversations/PBC013_jefferson.html;76-80;F;BO;pens;sì;asimmetrico;emilia-romagna;dip_tec_prof;2;intervista semistrutturata;// bologna? la vita a bologna? // per lei nella sua esperienza // no bologna secondo me tutto sommato eh diciamo che //;sai;che mi ha fatto una domanda complicata ragazza mia? // // eh perché rispetto a certe cose ehm // sicuramente si vive;1;1;;;;;;;;;;;;;;;;;;;;;;;;;;;;;;;;
PTD012;#504789;doc#63;2019;https://search.corpuskiparla.it/corpus/player/player.cgi?code=PTD012&begin=2007054&end=2009644;2007054;2009644;TOI068;PTD012;01:55:04;fisso;https://search.corpuskiparla.it/corpus/conversations/PTD012.html;https://search.corpuskiparla.it/corpus/conversations/PTD012_jefferson.html;46-50;M;TO;intell;sì;asimmetrico;lazio;laurea;2;intervista semistrutturata;// certo // poi quelli no ma non mi puoi portare a vedere la neve // eh andiamo a vedè la neve // // per cui c''è lì che ar~ sì;sai;devono far le riprese per cui // e lì portavi fino a pian del colle che è tre chilometri dopo bardonecchia dove finisce la;;;;;1;;;;;;;;;;;;;;1;;;;;;;;;;;;;;Metatestuale;Riformulazione
PTD012;#505200;doc#63;2019;https://search.corpuskiparla.it/corpus/player/player.cgi?code=PTD012&begin=2102323&end=2106528;2102323;2106528;TOI068;PTD012;01:55:04;fisso;https://search.corpuskiparla.it/corpus/conversations/PTD012.html;https://search.corpuskiparla.it/corpus/conversations/PTD012_jefferson.html;46-50;M;TO;intell;sì;asimmetrico;lazio;laurea;2;intervista semistrutturata;perchè c''è casino altrove // e ormai si sono x // cioè questo ti dà anche x ti dà la misura si come la gente si abitua per cui;sai;// se quella roba lì non fa più notizia // non la racconti più // in realtà non è che a // quindi questo è andato avanti così da;;;;;1;;;;;;;;1;;;;;;;;;;;1;;;;;;1;;;Interazionale & Cognitiva;Marcatura della conoscenza condivisa & Marcatura dell'inferenza
PTD012;#506775;doc#63;2019;https://search.corpuskiparla.it/corpus/player/player.cgi?code=PTD012&begin=2512419&end=2513419;2512419;2513419;TOI068;PTD012;01:55:04;fisso;https://search.corpuskiparla.it/corpus/conversations/PTD012.html;https://search.corpuskiparla.it/corpus/conversations/PTD012_jefferson.html;46-50;M;TO;intell;sì;asimmetrico;lazio;laurea;2;intervista semistrutturata;ci sono i capi dobbiamo fare tutte le cose fatte bene // tira dritto che cazzo ce ne fotte andiamo a riportarli in italia //;sai;da là dal conf~ // da dove c''è la gardiola a claviere sono un chilometro // s~ questi sono andati poi a claviere tu hai la;;;;;1;;;;;;;;1;;;;;;;;;;;;;;;;;;;;Interazionale;Marcatura della conoscenza condivisa
PTD012;#510466;doc#63;2019;https://search.corpuskiparla.it/corpus/player/player.cgi?code=PTD012&begin=3482743&end=3484239;3482743;3484239;TOI068;PTD012;01:55:04;fisso;https://search.corpuskiparla.it/corpus/conversations/PTD012.html;https://search.corpuskiparla.it/corpus/conversations/PTD012_jefferson.html;46-50;M;TO;intell;sì;asimmetrico;lazio;laurea;2;intervista semistrutturata;comunque in una valle // soprattutto l''alta valle tendenzialmente culturalmente di destra // ovviamente però //;sai;li vedi poco non te ne frega un cazzo // poi in realtà questi qua che sono passati // anche questi non è che li vedi così tanto;;;;;1;;;;;;;;1;;;;;;;;;;;;;;;;;;;;Interazionale;Marcatura della conoscenza condivisa
TOA3001;#512559;doc#64;2017/18;https://search.corpuskiparla.it/corpus/player/player.cgi?code=TOA3001&begin=172201&end=178341;172201;178341;TO033;TOA3001;00:31:46;libero;https://search.corpuskiparla.it/corpus/conversations/TOA3001.html;https://search.corpuskiparla.it/corpus/conversations/TOA3001_jefferson.html;21-25;F;TO;stud;no;simmetrico;piemonte;laurea in corso;3;conversazione libera;che ovviamente appunto ha detto // ah ma lo stesso abbiamo preso ah // mh // e ha detto ah io ritornerò in sudafrica e poi lo;sai;ha fatto anche finta di pensare tipo ah ma // chi potrebbe essere ah sì verdi verdi sì // tanto che poi mh // io boh // si è;1;1;;;;;;;;;;;;;;;;;;;;;;;;;;;;;;;;
TOA3001;#514197;doc#64;2017/18;https://search.corpuskiparla.it/corpus/player/player.cgi?code=TOA3001&begin=699026&end=699723;699026;699723;TO033;TOA3001;00:31:46;libero;https://search.corpuskiparla.it/corpus/conversations/TOA3001.html;https://search.corpuskiparla.it/corpus/conversations/TOA3001_jefferson.html;21-25;F;TO;stud;no;simmetrico;piemonte;laurea in corso;3;conversazione libera;// no perché non ci sono gli zucchini // li hai tolti? // cosa dice? // per disiscriversi da un esame come si fa capito? // lo;sai;perché? // perché ieri è arrivata una mail dalla prof di storia che diceva che chi ha passato l'' esame // o chi l'' ha già dato;1;;1;;;;;;;;;;;;;;;;;;;;;;;;;;;;;;;
TOA3001;#517393;doc#64;2017/18;https://search.corpuskiparla.it/corpus/player/player.cgi?code=TOA3001&begin=1584206&end=1589193;1584206;1589193;TO033;TOA3001;00:31:46;libero;https://search.corpuskiparla.it/corpus/conversations/TOA3001.html;https://search.corpuskiparla.it/corpus/conversations/TOA3001_jefferson.html;21-25;F;TO;stud;no;simmetrico;piemonte;laurea in corso;3;conversazione libera;abbiamo fatto il corso di arabo scusate // eh // altro che francese l'' hanno dato per scontato il francese cazzo // no ma;sai;cosa sai che corso sai che corso fanno appunto loro adesso? // di italiano in funzione di // italiano // del del mondo del;1;1;;;;;;;;;;;;;;;;;;;;;;;;;;;;;;;;
TOA3001;#518264;doc#64;2017/18;https://search.corpuskiparla.it/corpus/player/player.cgi?code=TOA3001&begin=1841821&end=1845332;1841821;1845332;TO033;TOA3001;00:31:46;libero;https://search.corpuskiparla.it/corpus/conversations/TOA3001.html;https://search.corpuskiparla.it/corpus/conversations/TOA3001_jefferson.html;21-25;F;TO;stud;no;simmetrico;piemonte;laurea in corso;3;conversazione libera;hanno chiesto // ma voi quanti paper avevate? io gli ho fatto tipo dieci dodici // ah // e e e come avete fatto a finirli? ma;sai;cioè // per disperazione // ti fai il culo come avete fatto cioè // a loro invece hanno fatto xxx // piangendo ogni giorno;;;;;1;;;;;;;;1;;;;;;;;;;;;;;;;;;;;Interazionale;Marcatura della conoscenza condivisa
PBB007;#526189;doc#66;2022;https://search.corpuskiparla.it/corpus/player/player.cgi?code=PBB007&begin=1760509&end=1761870;1760509;1761870;BOR005;PBB007;00:37:32;fisso;https://search.corpuskiparla.it/corpus/conversations/PBB007.html;https://search.corpuskiparla.it/corpus/conversations/PBB007_jefferson.html;21-25;M;BO;stud;sì;asimmetrico;marche;laurea in corso;3;intervista semistrutturata;aiutami che sono messo male // // questo in via ugo bassi // c''era la controlla // c''era la donna dei fiori // xxx // lo;sai;che la controlla è in carcere? // perchè? // come è in carcere // l''hanno arrestata // ah esiste ancora quindi // ma chi è?;1;;1;;;;;;;;;;;;;;;;;;;;;;;;;;;;;;;
PBC009;#537744;doc#67;2022;https://search.corpuskiparla.it/corpus/player/player.cgi?code=PBC009&begin=4254720&end=4258300;4254720;4258300;BOI022;PBC009;01:36:37;fisso;https://search.corpuskiparla.it/corpus/conversations/PBC009.html;https://search.corpuskiparla.it/corpus/conversations/PBC009_jefferson.html;71-75;M;BO;pens;sì;asimmetrico;emilia-romagna;laurea;3;intervista semistrutturata;rimane // nel senso che le crisi epilettiche gli rimangono però ha potuto fare una vita sostanzialmente normale // no;sai;perchè lì se guardi l''indice // grazie // ci sono delle cose proprio grazie per esempio a rossi non so se sei arrivata a;1;;;;;;;;;;;;;;;;;;;;;;;;;;;;;;;;;
PBC018;#555156;doc#70;2022;https://search.corpuskiparla.it/corpus/player/player.cgi?code=PBC018&begin=1693494&end=1698547;1693494;1698547;BOI043;PBC018;00:37:48;fisso;https://search.corpuskiparla.it/corpus/conversations/PBC018.html;https://search.corpuskiparla.it/corpus/conversations/PBC018_jefferson.html;71-75;M;BO;pens;sì;asimmetrico;emilia-romagna;med;2;intervista semistrutturata;una stima per tutti gli autisti cioè vedo proprio // no ci vuol~ come ti dico ci vuole // ci vuole pazienza santa pazienza;sai;che devi fare il lavoro e // perché se ti agiti poi se see ti incominci a agitare dopo fai fai più fatica a svolgere il lavoro;1;;1;;;;;;;;;;;;;;;;;;;;;;;;;;;;;;;
PBC018;#556287;doc#70;2022;https://search.corpuskiparla.it/corpus/player/player.cgi?code=PBC018&begin=2056747&end=2059973;2056747;2059973;BOI043;PBC018;00:37:48;fisso;https://search.corpuskiparla.it/corpus/conversations/PBC018.html;https://search.corpuskiparla.it/corpus/conversations/PBC018_jefferson.html;71-75;M;BO;pens;sì;asimmetrico;emilia-romagna;med;2;intervista semistrutturata;dovevo far dopo // per eh memorizzare i punti perché dopo cosa succede tu memorizzi // il percorso memorizzi i punti tu;sai;che fino lì // e dopo devi voltar~ cioè // devi essere // come dicevamo prima // devi essere // concentrato perché sai si;1;;1;;;;;;;;;;;;;;;;;;;;;;;;;;;;;;;
PBC018;#556310;doc#70;2022;https://search.corpuskiparla.it/corpus/player/player.cgi?code=PBC018&begin=2067233&end=2069693;2067233;2069693;BOI043;PBC018;00:37:48;fisso;https://search.corpuskiparla.it/corpus/conversations/PBC018.html;https://search.corpuskiparla.it/corpus/conversations/PBC018_jefferson.html;71-75;M;BO;pens;sì;asimmetrico;emilia-romagna;med;2;intervista semistrutturata;tu sai che fino lì // e dopo devi voltar~ cioè // devi essere // come dicevamo prima // devi essere // concentrato perché;sai;si può // per dire come adesso prendiamo l''esempio del quattordici dalla parte di là // van tutti al giovanni;;;;;1;;;;;;;;1;;;;;;;;;;;;;;;;;;;;Interazionale;Marcatura della conoscenza condivisa
PBC018;#556646;doc#70;2022;https://search.corpuskiparla.it/corpus/player/player.cgi?code=PBC018&begin=2176880&end=2179187;2176880;2179187;BOI043;PBC018;00:37:48;fisso;https://search.corpuskiparla.it/corpus/conversations/PBC018.html;https://search.corpuskiparla.it/corpus/conversations/PBC018_jefferson.html;71-75;M;BO;pens;sì;asimmetrico;emilia-romagna;med;2;intervista semistrutturata;// mi sento in colpa per tutte le volte che l''ho fatto // no ma ma uno qualcuno puoi chiedere // un''informazione;sai;viene della gente han fatto // so che han fatto dei corsi anche di inglese agli autisti perché sai quando vengon gli;;;;;1;;;;;;;;1;;;;;;;;1;;;;;;;;;1;;;Interazionale & Metatestuale;Marcatura della conoscenza condivisa & Esemplificazione
PBC018;#556743;doc#70;2022;https://search.corpuskiparla.it/corpus/player/player.cgi?code=PBC018&begin=2204687&end=2206554;2204687;2206554;BOI043;PBC018;00:37:48;fisso;https://search.corpuskiparla.it/corpus/conversations/PBC018.html;https://search.corpuskiparla.it/corpus/conversations/PBC018_jefferson.html;71-75;M;BO;pens;sì;asimmetrico;emilia-romagna;med;2;intervista semistrutturata;stato veramente interessante devo dire // adesso lì puoi chiudere perché tanto hai già // l''unica cosa che non chiedono;sai;qual è? // è delle due torri lo sai che io ho sessantasette anni non sono ancora andato sulle due torri? // no davvero? // no;1;;;1;;;;;;;;;;;;;;;;;;;;;;;;;;;;;;
PBC018;#556752;doc#70;2022;https://search.corpuskiparla.it/corpus/player/player.cgi?code=PBC018&begin=2207280&end=2211474;2207280;2211474;BOI043;PBC018;00:37:48;fisso;https://search.corpuskiparla.it/corpus/conversations/PBC018.html;https://search.corpuskiparla.it/corpus/conversations/PBC018_jefferson.html;71-75;M;BO;pens;sì;asimmetrico;emilia-romagna;med;2;intervista semistrutturata;dire // adesso lì puoi chiudere perché tanto hai già // l''unica cosa che non chiedono sai qual è? // è delle due torri lo;sai;che io ho sessantasette anni non sono ancora andato sulle due torri? // no davvero? // no // ma no // ho sempre detto che ci;1;1;1;1;;;;;;;;;;;;;;;;;;;;;;;;;;;;;;
PBB027;#565571;doc#71;2024;https://search.corpuskiparla.it/corpus/player/player.cgi?code=PBB027&begin=2231562&end=2236167;2231562;2236167;BOI097;PBB027;00:44:49;fisso;https://search.corpuskiparla.it/corpus/conversations/PBB027.html;https://search.corpuskiparla.it/corpus/conversations/PBB027_jefferson.html;31-35;M;BO;uff;sì;asimmetrico;emilia-romagna;laurea;3;intervista semistrutturata;parlando // eh eh mi viene in mente delle parole mi viene in mente // vabbè già che stia~ già che è venuto in fuori // sì sì //;sai;uno slang bolognese che magari dà a me anche anche // con con altri fuori da da bologna // lo dico così come se fosse normale;;;;;1;;1;;;;;;;;;1;;;;;;;;;;;;;;1;;;Interazionale & Metatestuale;Presa di turno & Gestione del topic: introduzione o ripresa di topic
BOA3016;#574170;doc#73;2019;https://search.corpuskiparla.it/corpus/player/player.cgi?code=BOA3016&begin=609651&end=611380;609651;611380;BO148;BOA3016;00:14:38;libero;https://search.corpuskiparla.it/corpus/conversations/BOA3016.html;https://search.corpuskiparla.it/corpus/conversations/BOA3016_jefferson.html;21-25;F;BO;stud;no;simmetrico;lombardia;laurea in corso;2;conversazione libera;// // due si lasciano a quel punto credo // mh // però se è per un tempo molto determinato tipo tot mesi // si può fare perché;sai;che finirà // mh // mh mh // cioè sai okay devo avere pazienza tre mesi quattro mesi sei mesi // che magari ci vediamo una;1;;1;;;;;;;;;;;;;;;;;;;;;;;;;;;;;;;
BOA3016;#574180;doc#73;2019;https://search.corpuskiparla.it/corpus/player/player.cgi?code=BOA3016&begin=611567&end=614943;611567;614943;BO148;BOA3016;00:14:38;libero;https://search.corpuskiparla.it/corpus/conversations/BOA3016.html;https://search.corpuskiparla.it/corpus/conversations/BOA3016_jefferson.html;21-25;F;BO;stud;no;simmetrico;lombardia;laurea in corso;2;conversazione libera;credo // mh // però se è per un tempo molto determinato tipo tot mesi // si può fare perché sai che finirà // mh // mh mh // cioè;sai;okay devo avere pazienza tre mesi quattro mesi sei mesi // che magari ci vediamo una volta al mese // però poi è finita lì //;1;;;1;;;;;;;;;;;;;;;;;;;;;;;;;;;;;;
PTB015;#576306;doc#74;2019;https://search.corpuskiparla.it/corpus/player/player.cgi?code=PTB015&begin=266588&end=269115;266588;269115;TOI052;PTB015;00:50:58;fisso;https://search.corpuskiparla.it/corpus/conversations/PTB015.html;https://search.corpuskiparla.it/corpus/conversations/PTB015_jefferson.html;16-20;F;TO;stud;sì;asimmetrico;piemonte;dip_lic;3;intervista semistrutturata;ehm // disegnate così e? // sì ma sono strane come storie cioè nel senso // ah sì? // sì perché // c''è sempre sti coniglietti;sai;che sono // eh sì sì // eh // che combinano sempre qualcosa e vengono sgridati cose un po'' strane // // no ma senti è come i;1;;1;;;;;;;;;;;;;;;;;;;;;;;;;;;;;;;
PTB015;#577404;doc#74;2019;https://search.corpuskiparla.it/corpus/player/player.cgi?code=PTB015&begin=534135&end=536800;534135;536800;TOI051;PTB015;00:50:58;fisso;https://search.corpuskiparla.it/corpus/conversations/PTB015.html;https://search.corpuskiparla.it/corpus/conversations/PTB015_jefferson.html;81-85;F;TO;pens;sì;asimmetrico;piemonte;med;3;intervista semistrutturata;// eh beh certo // // sono qualcuno // senti domenica faceva sessantadue anni di matrimonio // io qua e lui là // eh eh // //;sai;cosa mi ha detto che l''ho telefonato mi fa // non è che non ti sei ricordata dell''anniversario ho detto io sì // // // che mi;1;1;;;;;;;;;;;;;;;;;;;;;;;;;;;;;;;;
PTB015;#577713;doc#74;2019;https://search.corpuskiparla.it/corpus/player/player.cgi?code=PTB015&begin=604652&end=608820;604652;608820;TOI051;PTB015;00:50:58;fisso;https://search.corpuskiparla.it/corpus/conversations/PTB015.html;https://search.corpuskiparla.it/corpus/conversations/PTB015_jefferson.html;81-85;F;TO;pens;sì;asimmetrico;piemonte;med;3;intervista semistrutturata;chiamato // sì eravamo lì eh // eh // non le ha fatto alla zia anna // ah no? // non le ha cantato // non si è più ricordato e;sai;che zia anna xxxx è fumina eh // eh ci tiene // // ah ah // eh la fe~ x il giorno dopo mi dice ma papà non mi ha telefonato non mi;1;;1;;;;;;;;;;;;;;;;;;;;;;;;;;;;;;;
PTB015;#579639;doc#74;2019;https://search.corpuskiparla.it/corpus/player/player.cgi?code=PTB015&begin=1064447&end=1071620;1064447;1071620;TOI052;PTB015;00:50:58;fisso;https://search.corpuskiparla.it/corpus/conversations/PTB015.html;https://search.corpuskiparla.it/corpus/conversations/PTB015_jefferson.html;16-20;F;TO;stud;sì;asimmetrico;piemonte;dip_lic;3;intervista semistrutturata;lei piangeva dietro la porta mamma non mi lasciano entrare perché stanno combinando per il regalo // mah // // // // e;sai;invece chi è così? luna solamente che luna è la più grande però è sempre stata così pure lei non è capace a tenere i segreti x;1;;;1;;;;;;;;;;;;;;;;;;;;;;;;;;;;;;
PTB015;#580681;doc#74;2019;https://search.corpuskiparla.it/corpus/player/player.cgi?code=PTB015&begin=1345653&end=1346913;1345653;1346913;TOI051;PTB015;00:50:58;fisso;https://search.corpuskiparla.it/corpus/conversations/PTB015.html;https://search.corpuskiparla.it/corpus/conversations/PTB015_jefferson.html;81-85;F;TO;pens;sì;asimmetrico;piemonte;med;3;intervista semistrutturata;si ehm // è tagliato la pelle? // eh non so come ho fatto // però // ma lei è una sarta? // ma va figurati // ma va figurati non;sai;// lei cuo~ cuce? // certo lei ha fatto dei vestiti bellissimi // sei una sarta? // ah sì? // davvero? // ti piace fare i;1;;;;;;;;;;;;;;;;;;;;;;;;;;;;;;;;;
PTB015;#583508;doc#74;2019;https://search.corpuskiparla.it/corpus/player/player.cgi?code=PTB015&begin=2063500&end=2065230;2063500;2065230;TOI052;PTB015;00:50:58;fisso;https://search.corpuskiparla.it/corpus/conversations/PTB015.html;https://search.corpuskiparla.it/corpus/conversations/PTB015_jefferson.html;16-20;F;TO;stud;sì;asimmetrico;piemonte;dip_lic;3;intervista semistrutturata;di politica // discutete // si discute come dei pazzi // ma più che altro perché // ehm // abbiamo iniziato a parlare //;sai;che c''è st~ ha fatto il cominzio? // salvini ha fatto il comizio a settimo // ah sì // sì sì sì // eh sono andati dei ragazzi a;1;;1;;;;;;;;;;;;;;;;;;;;;;;;;;;;;;;
PTB015;#586749;doc#74;2019;https://search.corpuskiparla.it/corpus/player/player.cgi?code=PTB015&begin=2959415&end=2963125;2959415;2963125;TOI051;PTB015;00:50:58;fisso;https://search.corpuskiparla.it/corpus/conversations/PTB015.html;https://search.corpuskiparla.it/corpus/conversations/PTB015_jefferson.html;81-85;F;TO;pens;sì;asimmetrico;piemonte;med;3;intervista semistrutturata;// guarda l''altro giorno a casel borgone come ha grandinato // ah momento // non farmi fare tante cose perché altrimenti;sai;una per volta // sì scusa // // // sì scusa scusa // che bella xxx // non ho messo neanche gli occhiali // grazie mille // più o;;;;;1;;;;;;;;1;;;;;;;;;;;;;;;;;;;;Interazionale;Marcatura della conoscenza condivisa
BOA3020;#588226;doc#75;2019;https://search.corpuskiparla.it/corpus/player/player.cgi?code=BOA3020&begin=338995&end=340835;338995;340835;BO153;BOA3020;00:22:52;libero;https://search.corpuskiparla.it/corpus/conversations/BOA3020.html;https://search.corpuskiparla.it/corpus/conversations/BOA3020_jefferson.html;21-25;F;BO;stud;no;simmetrico;emilia-romagna;laurea in corso;1;conversazione libera;eh beh effettivamente non essendoci le lezioni e nulla // così // cavolo // non ho niente da fare // eh // a parte la tesi //;sai;che ti laurei a marzo // mh mh // no non voglio // non mi laureo allora // ma io mi chiedo scusate come fa uno a laurearsi tipo a;1;;1;;;;;;;;;;;;;;;;;;;;;;;;;;;;;;;
BOA3020;#591981;doc#75;2019;https://search.corpuskiparla.it/corpus/player/player.cgi?code=BOA3020&begin=1271970&end=1273190;1271970;1273190;BO153;BOA3020;00:22:52;libero;https://search.corpuskiparla.it/corpus/conversations/BOA3020.html;https://search.corpuskiparla.it/corpus/conversations/BOA3020_jefferson.html;21-25;F;BO;stud;no;simmetrico;emilia-romagna;laurea in corso;1;conversazione libera;// grazie greg // ti iscrivi? // a? // a che cosa? // // a questo // uno è // crossing me~ medi~ oh io non so l'' inglese // // non;sai;l'' inglese? // sì // e poi l'' altro è lingue e letterature europee americane post coloniali // che è doppio diploma in // è;1;1;;;;;;;;;;;;;;;;;;;;;;;;;;;;;;;;
KPS016;#598786;doc#76;2022;https://search.corpuskiparla.it/corpus/player/player.cgi?code=KPS016&begin=1988778&end=1991753;1988778;1991753;PKP084;KPS016;00:35:06;libero;https://search.corpuskiparla.it/corpus/conversations/KPS016.html;https://search.corpuskiparla.it/corpus/conversations/KPS016_jefferson.html;51-55;M;CA;tec;no;simmetrico;sardegna;phd;3;pasto;// dall''adria~ però o anche pa~ possono arrivare anche dalla // dal mare // dal mare del nord da altri dalla spagna non lo;sai;cioè n // dal po // te lo dicono // c''è scritto // quelle che compri qua // sono ovviamente x di pescatori // se al bennet v~;1;1;;;;;;;;;;;;;;;;;;;;;;;;;;;;;;;;
PTA016;#623435;doc#78;2019;https://search.corpuskiparla.it/corpus/player/player.cgi?code=PTA016&begin=1347810&end=1352510;1347810;1352510;TOI033;PTA016;00:40:23;fisso;https://search.corpuskiparla.it/corpus/conversations/PTA016.html;https://search.corpuskiparla.it/corpus/conversations/PTA016_jefferson.html;21-25;M;TO;oper;sì;asimmetrico;piemonte;dip_tec_prof;2;intervista semistrutturata;a fine serata poi vanno pagate // e io sai rimani un attimo // cioè erano delle escort? // cosa? eran delle sì // e io // però;sai;io giustamente faccio no no vediamo come va a finire dai che ridere che scasso // che scasso e infatti poi siamo // siamo;;;;;1;1;;;;;;;1;;;;;;;;;;;;;;;;;;;;Interazionale;Marcatura della conoscenza condivisa
PTA016;#626724;doc#78;2019;https://search.corpuskiparla.it/corpus/player/player.cgi?code=PTA016&begin=2268890&end=2272320;2268890;2272320;TOI033;PTA016;00:40:23;fisso;https://search.corpuskiparla.it/corpus/conversations/PTA016.html;https://search.corpuskiparla.it/corpus/conversations/PTA016_jefferson.html;21-25;M;TO;oper;sì;asimmetrico;piemonte;dip_tec_prof;2;intervista semistrutturata;bambino col signore degli anelli // mhmh // avevo anche letto il libro // mh // un mattone // mia mamma era incredula fa ah;sai;leggere quindi sì mamma x xx // // però in realtà vado a vedere un po'' tutti i generi // mhmh // appassionati deleh genere;1;1;;;;;;;;;;;;;;;;;;;;;;;;;;;;;;;;
KPN004;#630507;doc#79;2020;https://search.corpuskiparla.it/corpus/player/player.cgi?code=KPN004&begin=1173647&end=1175127;1173647;1175127;PKP016;KPN004;00:33:46;libero;https://search.corpuskiparla.it/corpus/conversations/KPN004.html;https://search.corpuskiparla.it/corpus/conversations/KPN004_jefferson.html;51-55;F;BO;uff;no;simmetrico;emilia-romagna;dip_tec_prof;3;pasto;che ce li fa fare prima invece c''era qualcuno che // non lo riteneva // necessario // ma uno non è che una volta che fa // poi;sai;le cose cambiano // eh // in realtà a qualche con convention a qualche congresso ci sia~ ci sono andata // alla camera di;;;;;1;;;;;;;;1;;;;;;;;;;;;;;;;;;;;Interazionale;Marcatura della conoscenza condivisa
KPN004;#630535;doc#79;2020;https://search.corpuskiparla.it/corpus/player/player.cgi?code=KPN004&begin=1186732&end=1188704;1186732;1188704;PKP016;KPN004;00:33:46;libero;https://search.corpuskiparla.it/corpus/conversations/KPN004.html;https://search.corpuskiparla.it/corpus/conversations/KPN004_jefferson.html;51-55;F;BO;uff;no;simmetrico;emilia-romagna;dip_tec_prof;3;pasto;// eh // in realtà a qualche con convention a qualche congresso ci sia~ ci sono andata // alla camera di commercio // poi;sai;nel tempo le cose diventano xx // comunque nessun lavoro // i corsi di formazione diventano sempre più frequenti //;;;;;1;;;;;;;;1;;;;;;;;;;;;;1;;;;1;;;Interazionale & Cognitiva;Marcatura della conoscenza condivisa & Approssimazione
KPN004;#632859;doc#79;2020;https://search.corpuskiparla.it/corpus/player/player.cgi?code=KPN004&begin=1961620&end=1969341;1961620;1969341;PKP016;KPN004;00:33:46;libero;https://search.corpuskiparla.it/corpus/conversations/KPN004.html;https://search.corpuskiparla.it/corpus/conversations/KPN004_jefferson.html;51-55;F;BO;uff;no;simmetrico;emilia-romagna;dip_tec_prof;3;pasto;// no beh vabbè uno lo imbastisce però sa già che deve tenere a riferimento quella cosa lì // masticare certe cose // e;sai;per esempio dei contra~ per esempio lui ha detto adesso abbiamo parlato di queste cose prendete i vostri contratti;1;1;;;;;;;;;;;;;;;;;;;;;;;;;;;;;;;;
