KPS021;#1667562;doc#221;2020;https://search.corpuskiparla.it/corpus/player/player.cgi?code=KPS021&begin=1528372&end=1531738;1528372;1531738;PKP126;KPS021;00:54:20;libero;https://search.corpuskiparla.it/corpus/conversations/KPS021.html;https://search.corpuskiparla.it/corpus/conversations/KPS021_jefferson.html;26-30;M;CE;disocc;no;simmetrico;campania;laurea;3;pasto;però praticamente xxx messo // cioè tutt~ tutto il fondo della padella era pieno d''olio // io volevo mettere un filo;sai;per farli venire mezzi tra // cioè cotti nella padella unta invece // i primi sono venuti un po'' deep fried quasi // fritti;;;;;1;;;;;;;;1;;;;;;;;;;;;;;;;;;;;Interazionale;Marcatura della conoscenza condivisa
KPS021;#1668331;doc#221;2020;https://search.corpuskiparla.it/corpus/player/player.cgi?code=KPS021&begin=1733778&end=1735496;1733778;1735496;PKP126;KPS021;00:54:20;libero;https://search.corpuskiparla.it/corpus/conversations/KPS021.html;https://search.corpuskiparla.it/corpus/conversations/KPS021_jefferson.html;26-30;M;CE;disocc;no;simmetrico;campania;laurea;3;pasto;se vuoi possiamo anche non litigare più se vuoi me ne posso tornare a casa mia // è già l''ennesima volta che lo dici ja // lo;sai;che non è quello che voglio quindi // beh forse mi sono scocciato di stare qua? // bra forse se se tu ti sei scocciato ti;1;;1;;;;;;;;;;;;;;;;;;;;;;;;;;;;;;;
KPS021;#1668877;doc#221;2020;https://search.corpuskiparla.it/corpus/player/player.cgi?code=KPS021&begin=1884758&end=1888033;1884758;1888033;PKP126;KPS021;00:54:20;libero;https://search.corpuskiparla.it/corpus/conversations/KPS021.html;https://search.corpuskiparla.it/corpus/conversations/KPS021_jefferson.html;26-30;M;CE;disocc;no;simmetrico;campania;laurea;3;pasto;della figlia no // ma erano cose che poi alla fine // erano diverte~ // divertenti sì però essere chiuso in un manicomio;sai;com''è non so // cioè erano // no vabbè quella là // // no quella infatti è sconvolgente mamma mia // l''elettroshock ha;1;;;1;;;;;;;;;;;;;;;;;;;;;;;;;;;;;;
KPS021;#1670212;doc#221;2020;https://search.corpuskiparla.it/corpus/player/player.cgi?code=KPS021&begin=2260917&end=2268515;2260917;2268515;PKP125;KPS021;00:54:20;libero;https://search.corpuskiparla.it/corpus/conversations/KPS021.html;https://search.corpuskiparla.it/corpus/conversations/KPS021_jefferson.html;26-30;M;CE;stud;no;simmetrico;campania;laurea in corso;3;pasto;ah perché insiste // la coccarda robe mo per la nascita del figlio // ah è vero marò quante co~ // sì ma // ma le ha chiesto lo;sai;fare ma una cosa che sinceramente molto industriale cioè era proprio un pu~ pu un peluche // sì // cioè come fai a farlo //;1;1;;;;;;;;;;;;;;;;;;;;;;;;;;;;;;;;
KPS021;#1671625;doc#221;2020;https://search.corpuskiparla.it/corpus/player/player.cgi?code=KPS021&begin=2700526&end=2704213;2700526;2704213;PKP127;KPS021;00:54:20;libero;https://search.corpuskiparla.it/corpus/conversations/KPS021.html;https://search.corpuskiparla.it/corpus/conversations/KPS021_jefferson.html;26-30;F;CE;stud;no;simmetrico;campania;laurea in corso;3;pasto;// mamma mia io avrei iniziato a piangere // mamma mia che brutto // ma entrando un po'' più nel privato magari non lo;sai;nemmeno // ma mh // come cioè tuo padre e tuo zio ne hanno risentito di sto fatto della morte della sorella non solo dico a;1;1;;;;;;;;;;;;;;;;;;;;;;;;;;;;;;;;
KPS021;#1672624;doc#221;2020;https://search.corpuskiparla.it/corpus/player/player.cgi?code=KPS021&begin=2992760&end=2997607;2992760;2997607;PKP127;KPS021;00:54:20;libero;https://search.corpuskiparla.it/corpus/conversations/KPS021.html;https://search.corpuskiparla.it/corpus/conversations/KPS021_jefferson.html;26-30;F;CE;stud;no;simmetrico;campania;laurea in corso;3;pasto;a farlo // beh era comunque un imprendito~ // vabbè scusa tuo zio non l''abbiamo mai visto all''opera quindi magari che ne;sai;// #amo'' mio zio è nu cas perz però // è veramente difficile credere che lui riesca con le donne // // cioè // lui la maggior;1;1;;;;;;;;;;;;;;;;;;;;;;;;;;;;;;;;
PTD021;#1674145;doc#222;2019;https://search.corpuskiparla.it/corpus/player/player.cgi?code=PTD021&begin=178438&end=184069;178438;184069;TOI012;PTD021;01:31:29;fisso;https://search.corpuskiparla.it/corpus/conversations/PTD021.html;https://search.corpuskiparla.it/corpus/conversations/PTD021_jefferson.html;31-35;M;TO;oper;sì;asimmetrico;piemonte;dip_tec_prof;5;intervista semistrutturata;o meno è quello poi diciamo che un po'' devi esser predisposto // e poie le fai una volta le fa due alla terza le sai a memoria;sai;anche le buche ormai dopo tre anni so le buche per strada // mh mh // è vero quello capita anche a me // sì // eh quando lo fai;1;1;;;;;;;;;;;;;;;;;;;;;;;;;;;;;;;;
PTD021;#1682033;doc#222;2019;https://search.corpuskiparla.it/corpus/player/player.cgi?code=PTD021&begin=2455650&end=2458899;2455650;2458899;TOI012;PTD021;01:31:29;fisso;https://search.corpuskiparla.it/corpus/conversations/PTD021.html;https://search.corpuskiparla.it/corpus/conversations/PTD021_jefferson.html;31-35;M;TO;oper;sì;asimmetrico;piemonte;dip_tec_prof;5;intervista semistrutturata;xxx // mh mh mh // tipo amsterdam // tipo amsterdam esatto quindi // biciclette // la macchina la prendi la sera perchè;sai;che i mezzi pubblici non ci sono // e la la ficchi in quei parcheggi a siloseh cari come il fuoco però dici almeno la u~ ce;1;;1;;;;;;;;;;;;;;;;;;;;;;;;;;;;;;;
PTD021;#1684678;doc#222;2019;https://search.corpuskiparla.it/corpus/player/player.cgi?code=PTD021&begin=3235902&end=3237724;3235902;3237724;===NONE===;PTD021;01:31:29;fisso;https://search.corpuskiparla.it/corpus/conversations/PTD021.html;https://search.corpuskiparla.it/corpus/conversations/PTD021_jefferson.html;===NONE===;===NONE===;TO;===NONE===;sì;asimmetrico;===NONE===;===NONE===;5;intervista semistrutturata;deleh nove // eh // via reis romoli? // ah ho capito sì sì sì sì sì // ah dove abita dove abita giulia // dove abita giulia //;sai;dove c''è l''auchan di venaria? // sì // sì // noi siamo dietro // dietro l''auchan di venaria // ah dietro ho ca~ ho capito //;1;;;1;;;;;;;;;;;;;;;;;;;;;;;;;;;;;;
PTD021;#1688944;doc#222;2019;https://search.corpuskiparla.it/corpus/player/player.cgi?code=PTD021&begin=4417553&end=4421239;4417553;4421239;TOR002;PTD021;01:31:29;fisso;https://search.corpuskiparla.it/corpus/conversations/PTD021.html;https://search.corpuskiparla.it/corpus/conversations/PTD021_jefferson.html;26-30;M;TO;intell;sì;asimmetrico;piemonte;phd;5;intervista semistrutturata;ovvio no? // sì // xxx // teste // no okay // feti // feti? // sì // okay // sì lui studiava qualsiasi cosa // sull''anatomia //;sai;che volevano anche chiuderlo a una certo punto per un incendio // eh è vero avevo letto // sì // sì // però grande xxx perchè;1;;1;;;;;;;;;;;;;;;;;;;;;;;;;;;;;;;
BOA3012;#1698200;doc#224;2017/18;https://search.corpuskiparla.it/corpus/player/player.cgi?code=BOA3012&begin=400526&end=403475;400526;403475;BO097;BOA3012;00:17:26;libero;https://search.corpuskiparla.it/corpus/conversations/BOA3012.html;https://search.corpuskiparla.it/corpus/conversations/BOA3012_jefferson.html;21-25;F;BO;stud;no;simmetrico;lombardia;laurea in corso;2;conversazione libera;freddo fa // xxxx // okay // non voglio sconvolgerti // xxx // sì sì // io spero che non si metta a nevicare di nuovo // ma lo;sai;che neanche io? perché in città non mi piace tanto // diventa subito paciugo // la neve // allora a me da guardare piace te;1;;1;;;;;;;;;;;;;;;;;;;;;;;;;;;;;;;
PBB009;#1717462;doc#229;2022;https://search.corpuskiparla.it/corpus/player/player.cgi?code=PBB009&begin=2865527&end=2870501;2865527;2870501;BOI028;PBB009;01:12:38;fisso;https://search.corpuskiparla.it/corpus/conversations/PBB009.html;https://search.corpuskiparla.it/corpus/conversations/PBB009_jefferson.html;71-75;F;BO;intell;sì;asimmetrico;molise;laurea;3;intervista semistrutturata;delle cifre // mh // esagerate però più o meno intorno // sì // ottantamila ecco bolo~ // poi c''e tutto l''indotto per cui;sai;la città cambia in misura // mh // e e poi è una città accogliente // ma fino a un certo punto // mh // // // e per quale motivo?;;;;;1;;;;;;;;1;;;;;;;;;;;1;;;;;;1;;;Interazionale & Cognitiva;Marcatura della conoscenza condivisa & Marcatura dell'inferenza
PBB009;#1718532;doc#229;2022;https://search.corpuskiparla.it/corpus/player/player.cgi?code=PBB009&begin=3235956&end=3243457;3235956;3243457;BOI028;PBB009;01:12:38;fisso;https://search.corpuskiparla.it/corpus/conversations/PBB009.html;https://search.corpuskiparla.it/corpus/conversations/PBB009_jefferson.html;71-75;F;BO;intell;sì;asimmetrico;molise;laurea;3;intervista semistrutturata;a bologna eh // sì // non è che adesso bologna ha un''offerta culturale adesso che è variegata in tantissimo cioè non;sai;dove arrivar prima poi // mh // mol~ tantissime cose gratuite quindi ben~ molto // però ecco quello che manca ad esempio;1;1;;;;;;;;;;;;;;;;;;;;;;;;;;;1;;;;;
PBB009;#1720251;doc#229;2022;https://search.corpuskiparla.it/corpus/player/player.cgi?code=PBB009&begin=3807214&end=3811980;3807214;3811980;BOI027;PBB009;01:12:38;fisso;https://search.corpuskiparla.it/corpus/conversations/PBB009.html;https://search.corpuskiparla.it/corpus/conversations/PBB009_jefferson.html;31-35;M;BO;intell;sì;asimmetrico;calabria;laurea;3;intervista semistrutturata;neanche tanto per una questione fisica // anche per una questione fisica // ma proprio per una questione di // ehm //;sai;di di devozione non dico neanche di fioretto nea~ mh proprio // per dare una senso al fatto che stavo lì // sì // dico io in;;;;;1;;;;;;;;;;;;;;;;;;;;;;;;;;;;;
PBB009;#1720506;doc#229;2022;https://search.corpuskiparla.it/corpus/player/player.cgi?code=PBB009&begin=3883193&end=3892391;3883193;3892391;BOI028;PBB009;01:12:38;fisso;https://search.corpuskiparla.it/corpus/conversations/PBB009.html;https://search.corpuskiparla.it/corpus/conversations/PBB009_jefferson.html;71-75;F;BO;intell;sì;asimmetrico;molise;laurea;3;intervista semistrutturata;per scontato devo dire no? perchè // sì // ci son sempre stati per me no? // e molto comodi soprattutto quando piove perchè;sai;quando sei a roma se piove ragazzo arrivi a casa che sei bagnato fradicio // sì // // sì // sì sì // è un bel un bel riparo no? ti;;;;;1;;;1;;;;;1;;;;;;;;;;;;;;;;;1;;;Interazionale;Richiesta di accordo/conferma & Marcatura della conoscenza condivisa
PBB009;#1720690;doc#229;2022;https://search.corpuskiparla.it/corpus/player/player.cgi?code=PBB009&begin=3954224&end=3958945;3954224;3958945;BOI028;PBB009;01:12:38;fisso;https://search.corpuskiparla.it/corpus/conversations/PBB009.html;https://search.corpuskiparla.it/corpus/conversations/PBB009_jefferson.html;71-75;F;BO;intell;sì;asimmetrico;molise;laurea;3;intervista semistrutturata;// fa il cielo non si vede // è vero // è vero // tu quando vai sotto il portico il cielo non lo vedi // sì // infatti ho detto ma;sai;che ha ragione perchè io quando voglio vedere i tramonti // se tu ti metti su via rizzoli // e vai dritto fino in fondo a san;1;1;1;;;;;;;;;;;;;;;;;;;;;;;;;;;;;;;
PBC002;#1722882;doc#230;2021;https://search.corpuskiparla.it/corpus/player/player.cgi?code=PBC002&begin=340370&end=341860;340370;341860;BOI007;PBC002;00:32:19;fisso;https://search.corpuskiparla.it/corpus/conversations/PBC002.html;https://search.corpuskiparla.it/corpus/conversations/PBC002_jefferson.html;71-75;F;BO;tec;sì;asimmetrico;emilia-romagna;med;3;intervista semistrutturata;quartiere // mhmh // e com''è cambiato negli anni // anche a livello // di città proprio in sè di persone che la vivono //;sai;adesso tutte le città // beh ci sono // ci sono tanti stranieri a dir la verità eh stranieri // mhmh // in visita due tre;;;;;1;;1;;;;;;;;;;;;;;;;;;;;;;;;;;Interazionale;Presa di turno
PBC002;#1725253;doc#230;2021;https://search.corpuskiparla.it/corpus/player/player.cgi?code=PBC002&begin=1207610&end=1211840;1207610;1211840;BOI007;PBC002;00:32:19;fisso;https://search.corpuskiparla.it/corpus/conversations/PBC002.html;https://search.corpuskiparla.it/corpus/conversations/PBC002_jefferson.html;71-75;F;BO;tec;sì;asimmetrico;emilia-romagna;med;3;intervista semistrutturata;da un po'' di tempo ehm vicino ai teatri vicino ai cinema // su indipendenza è la strada principale che va alla stazione lo;sai;// sì // è sempre poi piena di gente // è vero è vero // perché non passano neanche le // le macchine // mh // di~ di le m~ le;1;1;;;;;;;;;;;;;;;;;;;;;;;;;;;;;;;;
PBB004;#1728192;doc#231;2021;https://search.corpuskiparla.it/corpus/player/player.cgi?code=PBB004&begin=314815&end=315685;314815;315685;BOI013;PBB004;00:35:54;fisso;https://search.corpuskiparla.it/corpus/conversations/PBB004.html;https://search.corpuskiparla.it/corpus/conversations/PBB004_jefferson.html;56-60;F;BO;tec;sì;asimmetrico;calabria;dip_tec_prof;3;intervista semistrutturata;// mh // cioè e si notano // le sige~ le persone proprio che // e a~ dedite allo spaccio ma anche qui in piazza dell''unità //;sai;quante volte // mh // vediamo bottigliate // mh // di persone che se le danno in testa // cioè oh // tu non le noti queste;1;;;1;;;;;;;;;;;;;;;;;;;;;;;;;;;;;;
PBB004;#1728636;doc#231;2021;https://search.corpuskiparla.it/corpus/player/player.cgi?code=PBB004&begin=434960&end=439460;434960;439460;BOI012;PBB004;00:35:54;fisso;https://search.corpuskiparla.it/corpus/conversations/PBB004.html;https://search.corpuskiparla.it/corpus/conversations/PBB004_jefferson.html;56-60;M;BO;oper;sì;asimmetrico;emilia-romagna;dip_tec_prof;3;intervista semistrutturata;i giovani di oggi vivano la città // nello stesso modo in cui lo vivevate voi da giovani? // ah io questo non lo so // non lo so;sai;i giovani io coi giovani non ho dei gran contatti molto // non non non lo so // non mh lo so cosa fanno i giovani adesso // xx //;;;;;1;;;;;;;;;;;;;;;;;1;;;;;;;;;;;Metatestuale;Filler, riempimento dei tempi di formulazione
KPS022;#1738059;doc#232;2020;https://search.corpuskiparla.it/corpus/player/player.cgi?code=KPS022&begin=1338870&end=1346450;1338870;1346450;PKP128;KPS022;00:47:01;libero;https://search.corpuskiparla.it/corpus/conversations/KPS022.html;https://search.corpuskiparla.it/corpus/conversations/KPS022_jefferson.html;26-30;F;CE;comm;no;simmetrico;campania;dip_tec_prof;3;pasto;mio padre questo non lo fa andare oltre l''italia // ed è sbagliatissimo perché tu ti metti un sacco di limiti se non vai non;sai;cioè alla fine devi stare una settimana c''hai il camper c''hai tutti i fatti tuoi // quindi se hai pure il problema della;1;1;;;;;;;;;;;;;;;;;;;;;;;;;;;;;;;;
KPS022;#1738623;doc#232;2020;https://search.corpuskiparla.it/corpus/player/player.cgi?code=KPS022&begin=1534105&end=1542170;1534105;1542170;PKP128;KPS022;00:47:01;libero;https://search.corpuskiparla.it/corpus/conversations/KPS022.html;https://search.corpuskiparla.it/corpus/conversations/KPS022_jefferson.html;26-30;F;CE;comm;no;simmetrico;campania;dip_tec_prof;3;pasto;però // più meno me la cavicchio // ho imparato // // imparato bro // penso che già lo sapevi money // già lo sapevo però;sai;a volte ti vergogni anche almeno questo è il mio caso mi vergogno un po'' anche perché non è che ne sono poi così sicura io non;;;;;1;;;1;;;;;1;;;1;;;;;;;;;;;;;;1;;;Interazionale & Metatestuale;Richiesta di accordo/conferma & Marcatura della conoscenza condivisa & Gestione del topic: introduzione o ripresa di topic
KPS022;#1739352;doc#232;2020;https://search.corpuskiparla.it/corpus/player/player.cgi?code=KPS022&begin=1794510&end=1797540;1794510;1797540;PKP129;KPS022;00:47:01;libero;https://search.corpuskiparla.it/corpus/conversations/KPS022.html;https://search.corpuskiparla.it/corpus/conversations/KPS022_jefferson.html;26-30;F;CE;comm;no;simmetrico;campania;dip_tec_prof;3;pasto;// no no sono solo sconvolto // perché? // da come si comportano questi mh // no ma per loro è tutto normale eh // per loro tu;sai;come rispondi a lei e il padre? // allora la mamma no // perché la ma~ // è una persona falsa pure la mamma eh perché non sono;1;;;1;;;;;;;;;;;;;;;;;;;;;;;;;;;;;;
KPS022;#1739443;doc#232;2020;https://search.corpuskiparla.it/corpus/player/player.cgi?code=KPS022&begin=1817221&end=1820810;1817221;1820810;PKP129;KPS022;00:47:01;libero;https://search.corpuskiparla.it/corpus/conversations/KPS022.html;https://search.corpuskiparla.it/corpus/conversations/KPS022_jefferson.html;26-30;F;CE;comm;no;simmetrico;campania;dip_tec_prof;3;pasto;// entrano non dicono nemmeno buongiorno // niente // niente // lei e il padre se tu gli fai un discorso del genere loro lo;sai;come ti dice? // #e mic'' tenimm ru post'' ind'' a'' banc'' // cossì ti rispondono // #e mic'' e'' pigliat ru post'' ind'' a'' banc'' //;1;1;;;;;;;;;;;;;;;;;;;;;;;;;;;;;;;;
KPS022;#1739602;doc#232;2020;https://search.corpuskiparla.it/corpus/player/player.cgi?code=KPS022&begin=1861920&end=1865658;1861920;1865658;PKP129;KPS022;00:47:01;libero;https://search.corpuskiparla.it/corpus/conversations/KPS022.html;https://search.corpuskiparla.it/corpus/conversations/KPS022_jefferson.html;26-30;F;CE;comm;no;simmetrico;campania;dip_tec_prof;3;pasto;// resteranno sporchi pazienza // no // #eh veddiam'' eh e quand'' e po''? // #e cr~ carlo lì sto andando a sparecchià ess'';sai;com''è spo~ e quand'' po''? // così risponde // così fa // e tu devi stare zitta // poi vai vicino alla figlia // gli dici oh;1;1;;;;;;;;;;;;;;;;;;;;;;;;;;;;;;;;
KPS022;#1740540;doc#232;2020;https://search.corpuskiparla.it/corpus/player/player.cgi?code=KPS022&begin=2119053&end=2120340;2119053;2120340;PKP129;KPS022;00:47:01;libero;https://search.corpuskiparla.it/corpus/conversations/KPS022.html;https://search.corpuskiparla.it/corpus/conversations/KPS022_jefferson.html;26-30;F;CE;comm;no;simmetrico;campania;dip_tec_prof;3;pasto;chiama do voi lui delle consegne // no è tutto così là // ma è fuori di testa questo o è un anziano // ma è un deficiente // poi;sai;che fa? dice // non pren~ // #la tazzina iss xxx t'' vo ''nsegnà cumm s'' piglia ''a tazzina // la tazzina vena // dice non;1;;1;;;;;;;;;;;;;;;;;;;;;;;;;;;;;;;
PBA027;#1743698;doc#233;2024;https://search.corpuskiparla.it/corpus/player/player.cgi?code=PBA027&begin=231041&end=233052;231041;233052;BOI106;PBA027;00:52:21;fisso;https://search.corpuskiparla.it/corpus/conversations/PBA027.html;https://search.corpuskiparla.it/corpus/conversations/PBA027_jefferson.html;26-30;M;BO;tec;sì;asimmetrico;emilia-romagna;dip_tec_prof;3;intervista semistrutturata;al luogo di lavoro // si volevano avvicinare ecco esatto // si volevano avvicinare sono stati là sei anni e // però;sai;avanti e indietro // gli autobus e // è lunga eh // sì sì // non si muovevano molto con la macchina // e // gli spostamenti;;;;;1;;;;;;;;1;;;;;;;;;;;;;;;;;;;;Interazionale;Marcatura della conoscenza condivisa
PBA027;#1752807;doc#233;2024;https://search.corpuskiparla.it/corpus/player/player.cgi?code=PBA027&begin=3075210&end=3076970;3075210;3076970;BOR036;PBA027;00:52:21;fisso;https://search.corpuskiparla.it/corpus/conversations/PBA027.html;https://search.corpuskiparla.it/corpus/conversations/PBA027_jefferson.html;31-35;F;BO;intell;sì;asimmetrico;emilia-romagna;phd;3;intervista semistrutturata;spaziettino la sua fetta // eh beh // che ridere // è vero anche questo // e è una cosa fantastica // già // sì // dopo che lo;sai;sei abituato // sì e hanno più hanno molto più senso di comunità // ah di qua dici // mol~ // sì tantissimo // cioè del mondo;1;1;;;;;;;;;;;;;;;;;;;;;;;;;;;;;;;;
PBA012;#1757728;doc#235;2023;https://search.corpuskiparla.it/corpus/player/player.cgi?code=PBA012&begin=44590&end=45060;44590;45060;BOR018;PBA012;00:40:31;fisso;https://search.corpuskiparla.it/corpus/conversations/PBA012.html;https://search.corpuskiparla.it/corpus/conversations/PBA012_jefferson.html;21-25;F;BO;stud;sì;asimmetrico;calabria;laurea in corso;3;intervista semistrutturata;che non sono esatta~ esattamente la guidatrice più // ehm // sicura ehm // capace e convinta delle sue capacità // ma;sai;// ma sai che tipo // cioè eh secondo me è tipo un requisito // de~ dei bolognesi non saper guidare bene ma non perchè // io;1;;1;;;;;;;;;;;;;;;;;;;;;;;;;;;;;;;
PBC008;#1793510;doc#239;2022;https://search.corpuskiparla.it/corpus/player/player.cgi?code=PBC008&begin=1854917&end=1856340;1854917;1856340;===NONE===;PBC008;00:58:59;fisso;https://search.corpuskiparla.it/corpus/conversations/PBC008.html;https://search.corpuskiparla.it/corpus/conversations/PBC008_jefferson.html;===NONE===;===NONE===;BO;===NONE===;sì;asimmetrico;===NONE===;===NONE===;3;intervista semistrutturata;xx // i nerd della della riparazione abbiamo la sala piena // allora fa~ andiam su? // no curiosi no no adesso oh ve~ // eh //;sai;abbiamo già cominciato // ah ho capito eh oggi chissà perché so arrivati tutti presto // ma perché l''altra volta eran le;;;;;1;;;1;;;;;;;;;;;1;;;;;;;;;;;1;;;Interazionale & Metatestuale;Richiesta di accordo/conferma & Riformulazione
PBC022;#1801413;doc#240;2022;https://search.corpuskiparla.it/corpus/player/player.cgi?code=PBC022&begin=1350788&end=1353233;1350788;1353233;BOR014;PBC022;00:36:38;fisso;https://search.corpuskiparla.it/corpus/conversations/PBC022.html;https://search.corpuskiparla.it/corpus/conversations/PBC022_jefferson.html;21-25;F;BO;stud;sì;asimmetrico;emilia-romagna;laurea;2;intervista semistrutturata;un fratello o qualcuno // sì sì sì // di // o di xxxx non // di spagnola? // mh moh n''affar del genere // eh ma sai le epidemie;sai;quanto ce ne son state? // eh // il vaiolo magari sai quante ce ne son state appunto // mh // mh // comunque è così // prosegue;1;;;1;;;;;;;;;1;;;;;;;;;;;;;;;;;;;;;
PBC022;#1801425;doc#240;2022;https://search.corpuskiparla.it/corpus/player/player.cgi?code=PBC022&begin=1353286&end=1356664;1353286;1356664;BOR014;PBC022;00:36:38;fisso;https://search.corpuskiparla.it/corpus/conversations/PBC022.html;https://search.corpuskiparla.it/corpus/conversations/PBC022_jefferson.html;21-25;F;BO;stud;sì;asimmetrico;emilia-romagna;laurea;2;intervista semistrutturata;non // di spagnola? // mh moh n''affar del genere // eh ma sai le epidemie sai quanto ce ne son state? // eh // il vaiolo magari;sai;quante ce ne son state appunto // mh // mh // comunque è così // prosegue // senti un po'' nonna ma te // quand''è la prima volta;1;;;1;;;;;;;;;;;;;;;;;;;;;;;;;;;;;;
TOA3008;#1809628;doc#241;2017/18;https://search.corpuskiparla.it/corpus/player/player.cgi?code=TOA3008&begin=2877330&end=2879510;2877330;2879510;TO052;TOA3008;01:31:46;libero;https://search.corpuskiparla.it/corpus/conversations/TOA3008.html;https://search.corpuskiparla.it/corpus/conversations/TOA3008_jefferson.html;26-30;M;TO;stud;no;simmetrico;sicilia;laurea in corso;4;conversazione libera;fatta arancioni che secondo me era la persona più timida e insicura del mondo a diventare professore della xxx // ma tu lo;sai;che cosa ha fatto arancioni? // non te l'' ho raccontato? // xxxxxxx // me ne fotto il cazzo di queste cose // mi ha fatto;1;;1;;;;;;;;;;;;;;;;;;;;;;;;;;;;;;;
TOA3008;#1812622;doc#241;2017/18;https://search.corpuskiparla.it/corpus/player/player.cgi?code=TOA3008&begin=3822045&end=3823783;3822045;3823783;TO052;TOA3008;01:31:46;libero;https://search.corpuskiparla.it/corpus/conversations/TOA3008.html;https://search.corpuskiparla.it/corpus/conversations/TOA3008_jefferson.html;26-30;M;TO;stud;no;simmetrico;sicilia;laurea in corso;4;conversazione libera;di dislessia euxperie // invece exupéry // sì // e io non so perché non riesco a leggere exupéry ma leggo euxperi // ma l~ lo;sai;che anche io? // c'' ho un problema con questo nome è vero comun~ cazzo xx troppa ragione // comunque e quindi? // marina? //;1;;1;;;;;;;;;;;;;;;;;;;;;;;;;;;;;;;
PBC012;#1833239;doc#245;2022;https://search.corpuskiparla.it/corpus/player/player.cgi?code=PBC012&begin=732457&end=737252;732457;737252;BOI033;PBC012;00:48:29;fisso;https://search.corpuskiparla.it/corpus/conversations/PBC012.html;https://search.corpuskiparla.it/corpus/conversations/PBC012_jefferson.html;61-65;F;BO;pens;sì;asimmetrico;emilia-romagna;med;3;intervista semistrutturata;c''era la sede del di esse come quartiere navile qui // xx // dal duemilasette sì // mhmh // ah okay // poi a poco a poco;sai;una cosa poi svanisce // mhmh // ma era qui // // è stata qui era un''officina mi sembra // ma sì non lo so adesso cosa c''era;;;;;1;;;;;;;;1;;;;;;;;;;;;;;;;;;;;Interazionale;Marcatura della conoscenza condivisa
PBC012;#1834265;doc#245;2022;https://search.corpuskiparla.it/corpus/player/player.cgi?code=PBC012&begin=1020018&end=1025775;1020018;1025775;BOI033;PBC012;00:48:29;fisso;https://search.corpuskiparla.it/corpus/conversations/PBC012.html;https://search.corpuskiparla.it/corpus/conversations/PBC012_jefferson.html;61-65;F;BO;pens;sì;asimmetrico;emilia-romagna;med;3;intervista semistrutturata;siamo ma // ritirati noi ma vabbè // mh // ah okay ho capito e // perché le cucine popolari è cominciata qui // sì beh ma loro;sai;fanno un altro tipo di distribuzione invece noi dobbiamo mettere seduta la gente quindi // ah // e dopo // poi dopo hai;;;;;1;;;;;;;;1;;;;;;;;;;;;;;;;;;;;Interazionale;Marcatura della conoscenza condivisa
PBC012;#1835161;doc#245;2022;https://search.corpuskiparla.it/corpus/player/player.cgi?code=PBC012&begin=1250033&end=1254999;1250033;1254999;BOI033;PBC012;00:48:29;fisso;https://search.corpuskiparla.it/corpus/conversations/PBC012.html;https://search.corpuskiparla.it/corpus/conversations/PBC012_jefferson.html;61-65;F;BO;pens;sì;asimmetrico;emilia-romagna;med;3;intervista semistrutturata;più politiche ecco // ad esempio // poi magari coinvolgi anche le persone // mhmh // sempre che riesci perchè // mhmh //;sai;un conto è avvicinarsi a una struttura sociale un conto è avvicinarsi a un partito // mh // quindi // noi qui adesso // anni;;;;;1;;;;;;;;1;;;;;;;;;;;;;;;;;;;;Interazionale;Marcatura della conoscenza condivisa
