corpus	conv_id	token_id	token_span	audio	SegnDisc	Func:Interazionale	Func:Metatestuale	Func:Cognitiva	left	form	right
ParlaBO	PBB002	284-11	284-11	https://search.corpuskiparla.it/corpus/player/player.cgi?code=PBB002&begin=819685&end=824157	yes	_	Prolettico	_	coi sacchetti così per pulire tutto quanto // oppure mh // anche mh // c''è stato un periodo in cui in tutta via saragozza	praticamente	avevano chiuso tutti // i negozi sotto i portici quindi alla sera era molto buio // mhmh // era un po'' abbandonato invece
ParlaBO	PBB002	348-1	348-1	https://search.corpuskiparla.it/corpus/player/player.cgi?code=PBB002&begin=987593&end=993940	yes	_	Prolettico	_	diciamo di bologna // allora tante volte dico oddio spero che non diventi come firenze che praticame~ o venezia che // eh	praticamente	non puoi mh usufruire di niente perché ci sono sempre un sacco di turisti così // ehm e allora la vorrei tutta per me
ParlaBO	PBB002	434-2	434-2	https://search.corpuskiparla.it/corpus/player/player.cgi?code=PBB002&begin=1234967&end=1240900	yes	_	Prolettico	_	// p~ primi ricordi proprio in assoluto // sì // bello bel~ // // ehm e invece appunto tu // che hai vissuto // mh appunto	praticamente	tutta la tua vita qui anche l''adolescenza hai frequentato la città quali erano // ehm // le zone i luoghi che frequentavi
ParlaBO	PBB002	464-0	464-0	https://search.corpuskiparla.it/corpus/player/player.cgi?code=PBB002&begin=1331275&end=1335931	yes	_	_	Attenuazione	continui magari // ad andare coi tuoi amici che sia // mh ristorante un bar qual~ // sì eh ce n''è uno in particolare che //	praticamente	secondo me c''è sempre stato perché sin da quando ero bambina // eh si parlava eh il tavolaccio // sembra una cavolata è
ParlaTO	TOD2012	77-1	77-1	https://search.corpuskiparla.it/corpus/player/player.cgi?code=TOD2012&begin=179507&end=181384	yes	_	Prolettico	_	nella parte di sotto detersivi scopa straccio eccetera eccetera eccetera // ehmh // e la cosa che mi piaceva era c~ // che	praticamente	essendo sottotetto // in camera da letto il tetto appunto era spiovente // e c'' era la // il pozzo luce come lo chiamiamo
ParlaTO	TOD2012	111-2	111-2	https://search.corpuskiparla.it/corpus/player/player.cgi?code=TOD2012&begin=247998&end=250920	yes	_	Prolettico	_	abito in via sant'' anna dire abito cazzo in via foscolo // eh mi dava un senso di // intellettualismo pronunciato // eh	praticamente	non era una casa era un negozio // che naturalmente non aveva l'' abitabilità quindi piano strada // che però il
ParlaTO	TOD2012	116-2	116-2	https://search.corpuskiparla.it/corpus/player/player.cgi?code=TOD2012&begin=262414&end=265567	yes	_	Filler	_	strada // che però il proprietario di casa si era azzizzato // a casa // eh eh e quindi un avamo finestre neanche lì // cioè	praticamente	eh beh // entrava~ cioè allora la casa era m~ molto era arredata in maniera molto carina peccato che non fosse una casa // e
ParlaTO	TOD2012	118-3	118-3	https://search.corpuskiparla.it/corpus/player/player.cgi?code=TOD2012&begin=270690&end=272154	yes	_	Prolettico	_	entrava~ cioè allora la casa era m~ molto era arredata in maniera molto carina peccato che non fosse una casa // e perché	praticamente	// in soggiorno // per avere un po'' di luce dovevamo alzare la saracinesca su strada // col rischio che qualche
ParlaTO	TOD2012	137-10	137-10	https://search.corpuskiparla.it/corpus/player/player.cgi?code=TOD2012&begin=332715&end=338092	yes	_	Prolettico	_	con le panche in legno bellissimo mi piaceva molto // e il divano rosso // che per quanto c'' è stato seduto il mio fidanzato	praticamente	un cuscino aveva preso la forma del popò // eh // // eh e poi d~da una porta si andava al piano // seminterrato // che era una
ParlaTO	TOD2012	157-1	157-1	https://search.corpuskiparla.it/corpus/player/player.cgi?code=TOD2012&begin=389757&end=391122	yes	_	Filler	_	locali di cui ho parlato finora // ehmh // poi che altro di~ ah sì // beh quella casa mi piaceva molto anche perché // eh	praticamente	ineh // dieci secondi a piedi stavo // in via nizza // vicino tantissimi negozi e quindi la mia voglia di shoppingeh // a
ParlaTO	TOD2012	432-4	432-4	https://search.corpuskiparla.it/corpus/player/player.cgi?code=TOD2012&begin=1017675&end=1019986	yes	Richiesta di accordo/conferma	Prolettico	Specificazione	tuo ragazzo mi dicevi che che che era più che altro unehmh una un un porto aperto // sì // unmh unmh // eh un campo profughi	praticamente	// ecco // un campo profughi ehmh // sì difficile io mh son sempre stata male con coinquilini anche se // insomma con tutti
ParlaTO	TOD2012	646-0	646-0	https://search.corpuskiparla.it/corpus/player/player.cgi?code=TOD2012&begin=1523218&end=1526257	yes	_	Prolettico	_	vi~ hai vissuto in un bel po'' // sì // di amiche dieh s~ x // di amiche esatto ah sì di amiche // // chiaro // quindi lì allora //	praticamente	sono mia madre mi ha concepito in un quartiere // aspe'' a pale~ brava sì infatti a palermo facciamo così // fa~ facciam~ m~
ParlaTO	TOD2012	711-0	711-0	https://search.corpuskiparla.it/corpus/player/player.cgi?code=TOD2012&begin=1646082&end=1647737	yes	_	Prolettico	_	perché adoravo stare dai con mia nonna con mio nonno soprattutto con mio zio // ehmh // e poi lì mi piaceva molto perché //	praticamente	c'' erano questi tre condomini // cioè era un condominio unico però diviso in tre portoni // mh mh // eh sotto c'' era un
ParlaTO	TOD2012	1064-1	1064-1	https://search.corpuskiparla.it/corpus/player/player.cgi?code=TOD2012&begin=2297961&end=2300116	yes	_	Marca di generalizzazione	_	tutte le stanze avevano la finestra coi doppi vetri infissi nuovi vabbè comunque // eheh // ehmh // un periodo però // eh	praticamente	una un'' amica // eh sempre di questo ragazzo che io non conoscevo ha chies~ // cioè aveva una sua all'' università // mh //
KIP	BOA3004	180-1	180-1	https://search.corpuskiparla.it/corpus/player/player.cgi?code=BOA3004&begin=489052&end=493989	yes	_	Filler	_	io ero andata a studiare // allora io dovevo andare ad una cena con ad una cena organizzata dagli amici dei coinqui // e	praticamente	solo che dato che quando sono andata a studiare ho incontrato maria stuarda // e ho incontrato anche poi tutti i vari
KIP	BOA3004	218-2	218-2	https://search.corpuskiparla.it/corpus/player/player.cgi?code=BOA3004&begin=619872&end=624487	yes	_	Prolettico	_	che fosse casa nostra // e ho appurato che alina ha fatto la stessa serie di ragionamenti appena è arrivata // no e	praticamente	a me la cosa che faceva ridere io sono arrivata là che stavano tutti quanti ubriachi // oh ti pare che a una festa da
KIP	BOA3004	793-8	793-8	https://search.corpuskiparla.it/corpus/player/player.cgi?code=BOA3004&begin=2016494&end=2019697	yes	_	Prolettico	_	lì è interculturale // // uno scambio di culture // uno studio antropologico // no sì anche perché io questo weekend ho	praticamente	dormito tutto il tempo // quindi mi andrebbe di fare qualcosa un attimo di attivo // anche perché ho capito che più dormo
KIP	BOA3004	967-1	967-1	https://search.corpuskiparla.it/corpus/player/player.cgi?code=BOA3004&begin=2454293&end=2456256	yes	_	Filler	_	solo qui // e codice informante non lo devi scri~ non devi scrive un cazzo // solo nome e tutto il resto // comunque	praticamente	// perché allora hai presente che nei criteri redazionali il primo rigo del paragrafo deve essere rientrato di uno
KIP	BOA3004	973-9	973-9	https://search.corpuskiparla.it/corpus/player/player.cgi?code=BOA3004&begin=2468201&end=2472112	yes	_	Prolettico	_	essere rientrato di uno punto cinquanta? // ah sì? // sì // e lui però // che sbatta // questa cosa non l'' ha cioè l'' ha fatta	praticamente	ad ogni capoverso // eh no // solamente il primo rigo deve essere rientrato di uno punto cinquanta // tutto il resto deve
ParlaBO	PBC025	568-0	568-0	https://search.corpuskiparla.it/corpus/player/player.cgi?code=PBC025&begin=1202497&end=1203281	yes	Presa di turno	_	_	volta // in piazza maggiore una volta // due volte sono andata // uno il primo gennaio duemila venti // madonna proprio //	praticamente	// // e dopo non ci sono più andata perché ho detto aspetta che mi fermo // mai più // e poi ci sono andata una volta molti anni
ParlaBO	PBC025	1499-8	1499-8	https://search.corpuskiparla.it/corpus/player/player.cgi?code=PBC025&begin=3020290&end=3022087	yes	Cessione del turno	Chiusura del topic	_	è normale // ah sono uscita di casa che c''erano diciotto gradi // non è normale // cioè io non porto neanche più il cappotto	praticamente	// certo // no è impressionante cioè ventuno febbraio diciotto gradi // a me fa paura // poi dicono che adesso tornerà il
ParlaTO	PTB022	14-1	14-1	https://search.corpuskiparla.it/corpus/player/player.cgi?code=PTB022&begin=17114&end=22160	yes	_	Prolettico	_	// sì in effetti è un po'' // va bene allora // allora mi siedo qua // // // okay // lei ha sempre vissuto a torino? // sì	praticamente	sempre solo quando andavo in ferie ma // okay // in vacanza quindi // eh // // e in che quartiere ha vissuto? // ehm
ParlaTO	PTB022	20-1	20-1	https://search.corpuskiparla.it/corpus/player/player.cgi?code=PTB022&begin=27480&end=33423	yes	_	Prolettico	_	sempre solo quando andavo in ferie ma // okay // in vacanza quindi // eh // // e in che quartiere ha vissuto? // ehm	praticamente	sarebbe quartiere che adesso si chiama aurora // mh // okay // più o meno di lì // dalle parti dove ci sono gli spacciatori
ParlaTO	PTB022	83-0	83-0	https://search.corpuskiparla.it/corpus/player/player.cgi?code=PTB022&begin=163098&end=165109	yes	_	_	Approssimazione	dopo là quando è venuta la guerra ne trentanove mio padre ha ceduto questo negozio // e siamo di nuovo tornati a vivere //	praticamente	nella zona // qui con~ come dicevo prima zona aurora // okay // ma non so // // x // da da allora sono sempre vissuto più o meno
ParlaTO	PTB022	92-0	92-0	https://search.corpuskiparla.it/corpus/player/player.cgi?code=PTB022&begin=180802&end=183741	yes	_	_	Approssimazione	zona aurora // okay // ma non so // // x // da da allora sono sempre vissuto più o meno in questa zona // okay // cioè la zona //	praticamente	fra corso giulio cesare // e corso principe oddone allora c''era la stazione dora // e ora è stata eliminata // ecco e
ParlaTO	PTB022	193-2	193-2	https://search.corpuskiparla.it/corpus/player/player.cgi?code=PTB022&begin=420372&end=423560	yes	_	Prolettico	_	d~ si parlava di sfollamento // io beh ecco sono rimasto con mio padre // che lavorava qui aveva un''aziendina // e quindi	praticamente	siamo rimasti sempre // eh // cioè // cioè c''era stata qualche iniziativa privata cioè // si facevan dei rifugi
ParlaTO	PTB022	226-3	226-3	https://search.corpuskiparla.it/corpus/player/player.cgi?code=PTB022&begin=483894&end=487115	yes	_	Riformulazione	_	episodi magari // e poi c''è // dopo l''otto settembre c''è stata la guerra // dei partigiani quindi // mhmh // c''erano qui	praticamente	comandavano i tedeschi // c''erano anche i fa~ italiani ma erano così come i // dei servi dei dei // di cose di
ParlaTO	PTB022	247-0	247-0	https://search.corpuskiparla.it/corpus/player/player.cgi?code=PTB022&begin=530323&end=533655	yes	_	Prolettico	_	a parlarne // neanche a parlarne // in tutta la città // eh in tutta la città // era così // e x così siamo andati avanti //	praticamente	dal millenovecentosessantatrè // al sessantacinque // quando c''è stato poi la liberazione // mhmh // il venticinque
ParlaTO	PTB022	383-0	383-0	https://search.corpuskiparla.it/corpus/player/player.cgi?code=PTB022&begin=840873&end=845523	yes	_	Prolettico	Specificazione	con mio padre che aveva un''aziendina così // di materiali di %ricupero // mio padre era già un po'' anziano quindi //	praticamente	ero io che dovevo essere il sostegno della famiglia c''era // io avevo una sorella più anziana di me però poi // poi si è
ParlaTO	PTB022	561-16	561-16	https://search.corpuskiparla.it/corpus/player/player.cgi?code=PTB022&begin=1254985&end=1262571	yes	_	_	Intensificazione	è andato a vivere in aurora? // quartiere aurora // eh già già prim~ quando è iniziata la guerra ero già andato a vivere lì	praticamente	sempre // okay // okay // nella zona più o meno dov''ero nato poca distanza // mhmh mhmh // insomma // e e // in quel quartiere
ParlaTO	PTB022	648-1	648-1	https://search.corpuskiparla.it/corpus/player/player.cgi?code=PTB022&begin=1467582&end=1470163	yes	_	Filler	_	stato così // mhmhmh // e si ricorda poi nel corso degli anni // come è cambiata questa relazione cioè pian piano // eh	praticamente	// gli immigrati italiani sono // siamo diventati tutti italiani // // e quindi ci sentiamo abbastanza solidali // e
ParlaTO	PTB022	826-0	826-0	https://search.corpuskiparla.it/corpus/player/player.cgi?code=PTB022&begin=1916214&end=1917619	yes	_	Prolettico	_	ha bisogno // eh può darsi // che a qualcuno serva ma insomma // oltretutto // esprimono le opinioni su questo su quello //	praticamente	adesso // vorrebbero fare la democrazia su internet cioè invece // di fare le elezioni // fanno le votazioni su internet
KIP	BOC1001	76-4	76-4	https://search.corpuskiparla.it/corpus/player/player.cgi?code=BOC1001&begin=267046&end=273651	yes	_	Filler	_	medioevo // sì // eh perchè poi diventava // diventava insomma un po'' lunga // che cos'' è un graduale? // eh un graduale è	praticamente	èmh un co~ mh sì un codice nel quale sono riportati i canti // gregoriani // mhmh // e appunto è // si tratta di uno di questi
KIP	BOC1001	88-2	88-2	https://search.corpuskiparla.it/corpus/player/player.cgi?code=BOC1001&begin=309002&end=311627	yes	_	Filler	Modulazione del grado di confidenza	appunto sono sono riportati qui // e invece che cos'' è un evangelistario? che io ho conosciuto con un altro nome // ehm beh	praticamente	sono // qual è l'' altro nome lo sa? l'' altro nome più comune dell''evangelistario // eh bri~ no // evangeliario
KIP	BOC1001	94-1	94-1	https://search.corpuskiparla.it/corpus/player/player.cgi?code=BOC1001&begin=326611&end=328573	yes	_	Filler	_	lo sa? l'' altro nome più comune dell''evangelistario // eh bri~ no // evangeliario evangeliario // ah // che cos'' è? // ehm	praticamente	è // vi troviamo all'' interno eh numerose miniature cioè le miniature rappresentano ehm le tappe dell'' anno liturgico
ParlaTO	TOD2013	418-3	418-3	https://search.corpuskiparla.it/corpus/player/player.cgi?code=TOD2013&begin=1025931&end=1027385	yes	_	Introduzione o ripresa del topic	_	quindi fine giugno luglio adesso non so // e quindi cioè a s~ da settembre a novembre // due mesi e due case // sì // a torino	praticamente	// sì // sì // e perchè? // sì // perchè allora all'' inizio stavo in una stanza // eh però era verso barriera di milano // mhmh
ParlaTO	TOD2013	676-2	676-2	https://search.corpuskiparla.it/corpus/player/player.cgi?code=TOD2013&begin=1667431&end=1674400	yes	_	Filler	_	era una casa molto // eh // antica barra vecchia entrambe le cose // eh antica per l'' età e vecchia perchè mal tenuta // eh e	praticamente	prima di tutto olio di gomito per pulirla tutta e togliere la quasiasi // inabitata da tantissimo tempo // era anche
ParlaTO	TOD2013	1402-10	1402-10	https://search.corpuskiparla.it/corpus/player/player.cgi?code=TOD2013&begin=3501650&end=3505779	yes	_	Riformulazione	_	e tradotto // eh // una filastrocca // aha // no? // la il corrispettivo antico della nostra fiera dell'' est	praticamente	// esatto // e e quindi abbiamo traslitterato tradotto fatto analisi grammaticale e quant altro // che drovremmo
KIPasti	KPS002	606-3	606-3	https://search.corpuskiparla.it/corpus/player/player.cgi?code=KPS002&begin=1224171&end=1227176	yes	_	_	Intensificazione	cinque ho preso // sei e mezzo // io sono arrivata ho mangiato e sono andata dal dentista // x // è vero // a farmi scannare	praticamente	poi sono uscita con voi // che // che hai fatto dal dentista? // la pulizia dei denti che per me // è una tragedia // perchè un
KIPasti	KPS002	625-4	625-4	https://search.corpuskiparla.it/corpus/player/player.cgi?code=KPS002&begin=1266916&end=1269129	yes	_	_	Intensificazione	perchè altrimenti le sputo sta cosa in faccia capito // perchè // fai un colpo di risata // quella si ritrova bagnata	praticamente	// quindi devo iniziare a pensare cose tristi quindi ci sarà quella povera cristiana che vede me là sotto che faccio le
KIPasti	KPS002	925-0	925-0	https://search.corpuskiparla.it/corpus/player/player.cgi?code=KPS002&begin=1888025&end=1893598	yes	Presa di turno	_	Marcatura dell'inferenza	c''è sia letteratura traduzione poi c''è cinese // continuo con sto cinese // // boh // oddio non so se è una scelta buona //	praticamente	ti sei scelta questo corso di laurea perchè c''era cinese ed è la cosa che non ti piace fare // no // no scherzo te l~ n~ ne ne
KIPasti	KPS022	261-7	261-7	https://search.corpuskiparla.it/corpus/player/player.cgi?code=KPS022&begin=562584&end=565010	yes	_	_	Intensificazione	// mhmh // praticamente u~ uno // stava nella mia corsia // #accindvind // io stavo girando // la curva e me lo sono trovato	praticamente	nella macchina // madonna // stavo andando a lavoro cioè stava accompagnando a me a lavoro // cioè non so se hai capito la
KIPasti	KPS022	268-2	268-2	https://search.corpuskiparla.it/corpus/player/player.cgi?code=KPS022&begin=576679&end=578407	yes	_	Prolettico	_	// alle otto di mattina // io giravo la curva // lui veniva però non stava nella corsia sua stava nella mia // e quindi	praticamente	è stato un frontale // madonna // lui contromano senza assicurazione // ma s''è fatto male lui? // #n''s''è fatt'' niente //
KIPasti	KPS022	381-2	381-2	https://search.corpuskiparla.it/corpus/player/player.cgi?code=KPS022&begin=818864&end=823142	yes	_	Prolettico	_	lui mi l~ // andavo a abbassare la frizione e gina aveva il piede sotto all''altro pedale // subito ho imparato // e quindi	praticamente	non si abbassa e lei rimane col piede incastrato e io bestemmio // beh // questo ti può far fare un incidente eh xx // eh // ma
KIPasti	KPS022	941-22	941-22	https://search.corpuskiparla.it/corpus/player/player.cgi?code=KPS022&begin=2274690&end=2281272	yes	_	_	Specificazione	abbiamo un problema della pressione okay che se perché quella macchina se non sta a pressione giusta il caffé esce acqua	praticamente	// ma voi c''avete quella a pistone ancora? // ovviamente // esatto quindi praticamente non si riscalda l''acqua l~ il
KIPasti	KPS022	944-2	944-2	https://search.corpuskiparla.it/corpus/player/player.cgi?code=KPS022&begin=2283139&end=2289080	yes	_	Prolettico	_	giusta il caffé esce acqua praticamente // ma voi c''avete quella a pistone ancora? // ovviamente // esatto quindi	praticamente	non si riscalda l''acqua l~ il caffé è freddo esce acqua praticamente proprio // vomitevole insomma // mh // noi abbiamo
KIPasti	KPS022	991-5	991-5	https://search.corpuskiparla.it/corpus/player/player.cgi?code=KPS022&begin=2416722&end=2419535	yes	_	Prolettico	_	a tavolino e stiamo perlando di una perso~ e io ti giuro alberto // mi ha tartassato l''esistenza // che voleva lì perché io	praticamente	che cosa successe // avevo un problema di mh di personale e io dissi vicino a alberta io conosco una ragazza che può venire
KIPasti	KPS022	1061-0	1061-0	https://search.corpuskiparla.it/corpus/player/player.cgi?code=KPS022&begin=2620910&end=2628570	yes	_	Prolettico	_	dei ragazzi // ho detto albe'' // cioè per me non sta né in cielo né in terra che alla fine di tutto è gina // mo è vero //	praticamente	lei ha fatto coincidere quando siamo tornate a lavorare ci sono state due scadenze di contratto che lei non ha rinnovato
KIPasti	KPC007	55-2	55-2	https://search.corpuskiparla.it/corpus/player/player.cgi?code=KPC007&begin=108469&end=113000	yes	_	Prolettico|Esemplificazione	_	ha portato degli stecchini al posto della cannuccia ma a cosa serve secondo voi? // ma in che senso è del giro? // no perchè	praticamente	andiamo fuori ehm aspetta che devo vede'' la storia xxx // guarda che prendo la se~ seggiola eh // la // sì grazie // ah c''è
KIPasti	KPC007	65-4	65-4	https://search.corpuskiparla.it/corpus/player/player.cgi?code=KPC007&begin=121248&end=123400	yes	_	_	Specificazione	eh // la // sì grazie // ah c''è anche questa guarda // grazie // prego // ehm // mhmh // aspetta eh che vedo // okay è andata	praticamente	in una // tu l''hai saputa la storia de chicca? // no // // infatti stavo dove l''ha messa? // volevo la // ehm ca~ caffè ehm
KIPasti	KPC007	140-0	140-0	https://search.corpuskiparla.it/corpus/player/player.cgi?code=KPC007&begin=233350&end=237690	yes	Presa di turno	Prolettico	_	che siamo state da due romani? te l''ho detto? // no // praticamente siamo state da due hai capito qual è? quello no // no //	praticamente	è quello in fondo praticamente fai la vietta questa qua del duomo // mh mh // arrivi giù in fondo e sta sulla sinistra // mh
KIPasti	KPC007	140-5	140-5	https://search.corpuskiparla.it/corpus/player/player.cgi?code=KPC007&begin=233350&end=237690	yes	_	_	Approssimazione	te l''ho detto? // no // praticamente siamo state da due hai capito qual è? quello no // no // praticamente è quello in fondo	praticamente	fai la vietta questa qua del duomo // mh mh // arrivi giù in fondo e sta sulla sinistra // mh // e ho scoperto che lì vicino ce
KIPasti	KPC007	591-9	591-9	https://search.corpuskiparla.it/corpus/player/player.cgi?code=KPC007&begin=1202929&end=1206350	yes	_	Marca di generalizzazione	_	// è il monello che adesso ''st''anno è passato in reparto // già rido // abbiamo fatto tipo ''na gara de orienteering va beh	praticamente	così // xxxx no però è carinissimo // allora c''era un capo che faceva glie stava a spiega'' una cosa // e lui giocava tipo con
KIPasti	KPC007	631-1	631-1	https://search.corpuskiparla.it/corpus/player/player.cgi?code=KPC007&begin=1276311&end=1277313	yes	_	Prolettico	_	genitori è carini nel senso non è trascurato come bambino // non li conosco // diversi so'' trascurati // e però xxxxxx // e	praticamente	// ce viene lì da noi e ce fa // antonia aveva nascosto il telefono // xxx // #e noi gli famo // ma grazie ale che ce l''hai detto
KIPasti	KPC007	1192-7	1192-7	https://search.corpuskiparla.it/corpus/player/player.cgi?code=KPC007&begin=2135661&end=2139000	yes	_	_	Specificazione	in venti // ah ma voi ci siete andate? // certo amo pure lasciato trenta euro de compleanno // eh sì perchè ci siamo solo noi	praticamente	de scout // cioè m''ha costato sto compleanno due serate al xx // ah ma lui fa scout co'' voi? // sì // sì // adesso non fa più
ParlaTO	PTD007	754-5	754-5	https://search.corpuskiparla.it/corpus/player/player.cgi?code=PTD007&begin=1312950&end=1315030	yes	_	_	Specificazione	fanno molte cose in civica // ma in civica siamo già più spostati verso il centro // mh mh // perché siamo già via garibaldi	praticamente	// mh mh // eh sì // e so che lì // sì fanno un sacco di di attività // ehm // credo ci sia in via ehm // dovrebbe essere vigone //
ParlaTO	PTD007	819-1	819-1	https://search.corpuskiparla.it/corpus/player/player.cgi?code=PTD007&begin=1424746&end=1426315	yes	_	Prolettico	_	// in una scuola lì // per cui io mh // l''infanzia l''ho passata sì è vero abitavo // nel quartiere cit turin // però	praticamente	stavo tutto il giorno // nel quartiere san paolo perché stavo // con la nonna // e con la nonna andavamo spesso al mercato
ParlaTO	PTD007	966-8	966-8	https://search.corpuskiparla.it/corpus/player/player.cgi?code=PTD007&begin=1650861&end=1654346	yes	_	_	Intensificazione	da una parte // cioè da parte a parte // servita con la metro è fantastico // io la trovo meravigliosa e infatti mi muovo	praticamente	solo con la metropolitana // fantastico // da quando c''è la metropolitana io ho risolto tutti i miei problemi // di
KIP	TOA3013	147-0	147-0	https://search.corpuskiparla.it/corpus/player/player.cgi?code=TOA3013&begin=248899&end=250453	yes	_	Prolettico	_	ah // come si chiamava la spiaggia delle bionde // ah non lo sapevo // sì // che bello // sì // e e poi se costeggi vai dentro //	praticamente	passi in mezzo al lago // e io sapevo solo quella strada lì // adesso non se c'' è una strada turistica per arrivare // passi
KIP	TOA3013	295-4	295-4	https://search.corpuskiparla.it/corpus/player/player.cgi?code=TOA3013&begin=482650&end=486800	yes	_	Introduzione o ripresa del topic	_	// oh comunque ale // eh // quando stavo dicendo la serata // che vabbè sono andata in cavallerizza // non c'' era nessuno	praticamente	pochissima gente però la musica era bella // xxx // ah grazie // sì? // poi son stata lì a ballarmela proprio // che cos'' è
ParlaTO	PTD020	224-1	224-1	https://search.corpuskiparla.it/corpus/player/player.cgi?code=PTD020&begin=445510&end=450409	yes	Manifestazione di accordo	_	_	// e poi il liceo l''hai fatto qui // okay // e i tuoi amici vivono qui a torino? o // sì // sì la maggior parte sì // sì // ormai	praticamente	tutti quelli che vedo più frequentemente son tutti qua a torino sì // son tutti qua // ti piace la zona in cui vivi? // sì
KIPasti	KPN012	0-2	0-2	https://search.corpuskiparla.it/corpus/player/player.cgi?code=KPN012&begin=1900&end=2973	yes	_	Filler	_	si potevano ancora guardare // va bene a posto così grazie mille // adesso ti faccio io stesso una domanda che // e quindi	praticamente	// #quando ho scoperto che che stava passando la seconda volta mi sono preciato perché // ho scoperto che sta~ // ma su che
KIPasti	KPN012	56-6	56-6	https://search.corpuskiparla.it/corpus/player/player.cgi?code=KPN012&begin=131048&end=136035	yes	_	Filler	_	per questa cosa // producimi questa cosa qua e lo rivendi con il mio marchio // ah okay // e quindi niente ci ha fatto	praticamente	un un mega un mega coso con una carrozzina // che se avevi una maniera un tipo poca mobilità // allora la guidavi con le mani
