corpus	conv_id	token_id	token_span	audio	SegnDisc	Func:Interazionale	Func:Metatestuale	Func:Cognitiva	left	form	right
KIPasti	KPN024	1014-0	1014-0	https://search.corpuskiparla.it/corpus/player/player.cgi?code=KPN024&begin=2738270&end=2739300	yes	_	Filler	_	tutte scrivono tutte mettono mi piace // la media d''età // boomer // boomer okay // boomer inoltrato // okay // ehm //	praticamente	// la la // sta tipa scrive che lei fa ogni due settimane tipo il tampone // perchè lavora in una casa di cura // mhmh // e che
KIPasti	KPN005	1026-6	1026-6	https://search.corpuskiparla.it/corpus/player/player.cgi?code=KPN005&begin=1619290&end=1621540	yes	Marcatura della conoscenza condivisa	_	_	// vero anche il guacamole // che poi il guacamore io faccio avocado // xxx la guacamole // no io faccio solo avocado	praticamente	// ci metto tipo il limone e il pepe // sì // ci metti anche non so peperoni o pomodorini // sì poco di più perché alla fine se
KIPasti	KPN005	1211-4	1211-4	https://search.corpuskiparla.it/corpus/player/player.cgi?code=KPN005&begin=1968443&end=1970893	yes	_	Prolettico	_	lì // xxx // e han chiamato l''ambulanza // però di solito // però di solito // cioè devi st~ se eh // mh // solo che la pista	praticamente	dov''è successo // era tutta dentro alle rampe // è una conca // certo // quindi era dentro una conca // allora i suoi amici
ParlaBO	PBC008	580-3	580-3	https://search.corpuskiparla.it/corpus/player/player.cgi?code=PBC008&begin=1401268&end=1403790	yes	_	_	Approssimazione	cioè // in ordine ne // eh // poi eh l''orto è gestito dal centro sociale // in collaborazione con // l''urp // eh di quartiere	praticamente	insomma // per le // per i fatti burocratici ecco non // però è in realtà una delle attività del centro sociale // come dire
ParlaBO	PBC008	840-5	840-5	https://search.corpuskiparla.it/corpus/player/player.cgi?code=PBC008&begin=2021829&end=2026561	yes	_	Prolettico	_	così poi dopo // andrete a cercarvi su iper~ eh bilancio partecipativo e vedrete cos''è // mhmh // ehm mh // eh eh eh eh sono	praticamente	i cittadini che decidono // eh come dove spenderli // mh non è ancora proprio perfetta come formulazione secondo me è un
ParlaBO	PBC008	1350-4	1350-4	https://search.corpuskiparla.it/corpus/player/player.cgi?code=PBC008&begin=3225845&end=3230518	yes	_	_	Specificazione	mh // che poi adesso sono anche diventati patrimonio dell''unesco // certo // quindi ecco ci chiedevamo // visto che sono	praticamente	dappertutto se ha qualche anche qui qualche ricordo qualche aneddoto? // qualcosa che le è successo magari sotto i
ParlaBO	PBA021	135-0	135-0	https://search.corpuskiparla.it/corpus/player/player.cgi?code=PBA021&begin=372084&end=374519	yes	_	Prolettico	_	pellegrinaggio per il comune // che è fatto per la madonna // per per il nostro santo che // è san petronio anche qui //	praticamente	fanno scendere la madonna dalla chiesa // e poi la la portano in giro per osteria nuova per sala bolognese // e d è //
ParlaBO	PBA021	552-6	552-6	https://search.corpuskiparla.it/corpus/player/player.cgi?code=PBA021&begin=1464972&end=1469035	yes	_	Introduzione o ripresa del topic|Prolettico	_	noi il ragù lo facciamo sì sì // e come lo fate? // allora facciamo un mix di carne la nonna // prende tutta la carne di maiale	praticamente	mischia salsiccia // tu~ // tutto il maiale comunque la lonza // ovviamente non non lo vuole fare troppo pesante perché
ParlaBO	PBA021	573-3	573-3	https://search.corpuskiparla.it/corpus/player/player.cgi?code=PBA021&begin=1527432&end=1529996	yes	_	_	Specificazione	ma qua a bologna va tantissimo // che sono praticamente è un misto di uova formaggio e poco altro // e vengono schiacciati	praticamente	fatti in brodo // è un piatto molto povero ma in realtà va tantissimo // d''accordo // per quanto riguarda invece le
KIPasti	KPC005	613-11	613-11	https://search.corpuskiparla.it/corpus/player/player.cgi?code=KPC005&begin=1473339&end=1478471	yes	_	Prolettico	_	di essere un giovane eterno o un peter pan della situazione // xxxx // ma sai che a rosora successo un casino che son	praticamente	positivi // tutti sti poveri vecchietti ma tutt~ quasi tutti ricoverati? // c''è a rosora ci lavora la cugina de sara fa là
KIPasti	KPC004	66-1	66-1	https://search.corpuskiparla.it/corpus/player/player.cgi?code=KPC004&begin=121144&end=122259	yes	_	Prolettico	_	a bologna // buona sta frittata // come eh? // è buona sta frittata // piaciuta? // mh // bene so'' contenta // ehm // che	praticamente	// secondo le~ cioè in senso a lei piaceva le pagine della nostra vita // però parlando lei con dei suoi amici // che film è
KIPasti	KPC004	100-1	100-1	https://search.corpuskiparla.it/corpus/player/player.cgi?code=KPC004&begin=182890&end=184095	yes	_	Filler	_	pagine della nostra vita mo è amore tossico tutti amori tossici // perchè amore // e perchè amore tossico così? // perchè	praticamente	// nelle pagine della nostra vita // funziona così cioè loro s''innamorano da giovani // mhmh // mhmh // poi per motivi
KIPasti	KPC004	120-1	120-1	https://search.corpuskiparla.it/corpus/player/player.cgi?code=KPC004&begin=229402&end=231928	yes	_	Prolettico	_	arrivano mai a lei // mbeh il classico film // vabbe romantico sì in senso proprio // dell''amore impossi~ eh va beh // poi	praticamente	loro si erano promessi che faceva // tossico? // una faceva una casa per lei // mh mh // e quindi questo q~ // passa tutta la
KIPasti	KPC004	163-1	163-1	https://search.corpuskiparla.it/corpus/player/player.cgi?code=KPC004&begin=312207&end=314553	yes	_	Prolettico	_	boh non vedo niente di di xx drammatico // comunque abbiamo fatto un discorso un giorno a bologna su sta cosa // perchè	praticamente	invece per questi tipi // mhmh // quello rappresentava un amore tossico dice eh // non è possibile lui gli ha scritto per
KIPasti	KPC004	223-1	223-1	https://search.corpuskiparla.it/corpus/player/player.cgi?code=KPC004&begin=428316&end=431111	yes	_	Prolettico	_	lui sta nel dolore si strugge di questa // ma tu che fai xx // eh vabbè ho capito che deve fa'' // di questo amore // che	praticamente	vuole vivere e praticamente non eh // poi // poi loro s''attaccavano sul fatto che // mh // que~ in questo film questa
KIPasti	KPC004	223-5	223-5	https://search.corpuskiparla.it/corpus/player/player.cgi?code=KPC004&begin=428316&end=431111	yes	_	Prolettico	_	strugge di questa // ma tu che fai xx // eh vabbè ho capito che deve fa'' // di questo amore // che praticamente vuole vivere e	praticamente	non eh // poi // poi loro s''attaccavano sul fatto che // mh // que~ in questo film questa storia d''amore tra loro due dura
KIPasti	KPC004	674-22	674-22	https://search.corpuskiparla.it/corpus/player/player.cgi?code=KPC004&begin=1396149&end=1400764	yes	_	_	Attenuazione	e sotto // ah potrebbe essere // e quindi quando va a fare la cosa dice che da una parte le sta bene da una parte le sta male	praticamente	// mh // e quindi non lo so x // ma perchè lei però non mette costumi interi quindi // di solito no però voleva solo sto
KIPasti	KPC004	688-14	688-14	https://search.corpuskiparla.it/corpus/player/player.cgi?code=KPC004&begin=1425486&end=1428642	yes	_	Chiusura del topic	_	altro // perchè i corpi sono tutti diversi quindi // mhmh // ah quindi l''ha trovati ma non li ha trovati che gli stanno bene	praticamente	// non le piace molto come stanno perciò // ah // però li ha trovati // qualcosa l''ha trovato // ah okay // aveva trovato
ParlaTO	PTD009	538-0	538-0	https://search.corpuskiparla.it/corpus/player/player.cgi?code=PTD009&begin=1427607&end=1433349	yes	_	Prolettico	_	l''ho vista cambiare purtroppo non in meglio // mh mh // nel senso che eh na~ è sempre na~ comune piccolino // carino ehm //	praticamente	sulla collina io scherzando dico è un po'' come budapest no perché c''è san mauro da una parte san mauro dall''altra // // ed è
ParlaTO	PTD009	597-2	597-2	https://search.corpuskiparla.it/corpus/player/player.cgi?code=PTD009&begin=1602225&end=1604978	yes	_	Prolettico	_	scuola media e una scuola elementare // da una parte una scuola media e una scuola elementare dall''altra // // e quindi	praticamente	con i ragazzini ti conoscevano e tutto // la cosa bella di san mauro dell''epoca e che c''è ancora adesso è che fanno sempre
ParlaTO	PTD009	603-0	603-0	https://search.corpuskiparla.it/corpus/player/player.cgi?code=PTD009&begin=1623009&end=1624375	yes	_	Introduzione o ripresa del topic	_	anni ottanta ovviamente finivano iniziavano le feste c''era la festa de l''unità la festa del dei vari partiti e tutto //	praticamente	era sempre festa // // e e per un ragazzino appunto che // si spostava a torino ma fino a un certo punto perché ah noi che a
ParlaTO	PTD009	726-7	726-7	https://search.corpuskiparla.it/corpus/player/player.cgi?code=PTD009&begin=1942140&end=1948369	yes	_	Riformulazione	_	è una zona tranquilla dico la sera // ehm non è che passano tante macchine // mh mh // quindi un conto è avere p~ essere	praticamente	sul viale che vie~ che viene tartassato di macchine poi t''abitui // perché poi ti abitui // però l''ho vista l''ho vista
KIP	BOD2018	187-1	187-1	https://search.corpuskiparla.it/corpus/player/player.cgi?code=BOD2018&begin=760460&end=767620	yes	_	Prolettico	_	ero arrivata alla fine che non ce la facevo più stavo impazzendo // anche perché anche noi avevamo sala e cucina // che	praticamente	no~ non avevano un~ una porta divisoria c'' avevano solamente una specie di arco tra le due stanze e quindi //
KIP	TOC1004	22-1	22-1	https://search.corpuskiparla.it/corpus/player/player.cgi?code=TOC1004&begin=35940&end=41100	yes	_	Introduzione o ripresa del topic	_	// allora // con questo lei manda avanti // okay // e la presentazione torniamo indietro prego // okay // allora // e	praticamente	l'' argomento che eh porto oggi in esame eh riguarda appunto la gestione dei suini // e nel periodo del periparto ehmh // e
KIP	TOC1004	31-3	31-3	https://search.corpuskiparla.it/corpus/player/player.cgi?code=TOC1004&begin=68366&end=74638	yes	_	Prolettico	_	di eh igiene a livello diciamo eh delle sale parto // eh e quindi eh diciamo che saranno poi ehmh // ehmh // in cui saranno	praticamente	presenti i suinetti e tendenzialmenteche tendenzialmente nelle prime fasi sono molto eh sensibili // ehmhai
KIP	TOC1004	36-6	36-6	https://search.corpuskiparla.it/corpus/player/player.cgi?code=TOC1004&begin=87213&end=89708	yes	_	Filler	_	immesse in sala parto sette giorni prima del parto // eh ehmh all'' interno // all'' interno delle sale parto abbiamo	praticamente	ehmh // delle gabbie parto all'' i~ che si trovano all'' interno di box parto // allora // i box parto praticamente eh
KIP	TOC1004	39-3	39-3	https://search.corpuskiparla.it/corpus/player/player.cgi?code=TOC1004&begin=94996&end=100280	yes	_	Filler	_	abbiamo praticamente ehmh // delle gabbie parto all'' i~ che si trovano all'' interno di box parto // allora // i box parto	praticamente	eh presentano una superficie di suolo intorno ai cinque virgola cinque metri quadrati // e un settore di riposo intorno
KIP	TOC1004	56-2	56-2	https://search.corpuskiparla.it/corpus/player/player.cgi?code=TOC1004&begin=152756&end=157296	yes	_	Filler	_	// la scrofa eh per esempio è una primipara // viene alimentata con una razione intorno ai due chili e cinque // e poi	praticamente	ehmh man mano che si avvicina il parto comunque negli ultimi giorni prepartum // la razione ehmh viene diminuita
KIP	TOC1004	66-4	66-4	https://search.corpuskiparla.it/corpus/player/player.cgi?code=TOC1004&begin=182951&end=187380	yes	_	Prolettico	_	// comunque al di sotto delle lampade abbiamo una sorta di temperatura intorno ai trentacinque gradi // e e nei nidi	praticamente	viene posta della carta per ehmh diciamo // ehper i piccoli // per eh favorire quindi la formazione del nido e quindi eh
KIP	TOC1004	78-8	78-8	https://search.corpuskiparla.it/corpus/player/player.cgi?code=TOC1004&begin=213500&end=216580	yes	_	Filler	_	// comunque ehmh // per quanto riguarda l'' ambiente invece abbiamo // eh la temperatura e l'' umidità che sono	praticamente	// ehmh controllati da una ventilazione // ehmh artificiale per estrazione // l'' umidità in questo caso diciamo deve
KIP	TOC1004	94-2	94-2	https://search.corpuskiparla.it/corpus/player/player.cgi?code=TOC1004&begin=249621&end=255601	yes	_	Prolettico	_	lesioni a livello dei capezzoli // durante diciamo // ehmhdurante diciamo la la stabulazione in sala parto // eh perché	praticamente	il peso troppo elevato della scrofa può determinare queste lesioni ai capezzoli e quindi è opportuno mh // andare a //
KIP	TOC1004	142-0	142-0	https://search.corpuskiparla.it/corpus/player/player.cgi?code=TOC1004&begin=348403&end=351680	yes	Presa di turno	_	_	di // che ha partorito più volte potrebbe anche ingerire una quantità di alimento // sui tre chili e due tre chili e tre //	praticamente	io vado a eh ridurre la quantità di alimento // proprio perché comunque la eh la scrofa praticamente è più affaticata //
KIP	TOC1004	143-7	143-7	https://search.corpuskiparla.it/corpus/player/player.cgi?code=TOC1004&begin=351921&end=355196	yes	_	Prolettico	_	due tre chili e tre // praticamente io vado a eh ridurre la quantità di alimento // proprio perché comunque la eh la scrofa	praticamente	è più affaticata // in questa fase // e ha eh praticamente diciamo la // si ha una diminuzione dell'' appetito inoltre // eh
KIP	TOC1004	145-3	145-3	https://search.corpuskiparla.it/corpus/player/player.cgi?code=TOC1004&begin=356588&end=358495	yes	_	Filler	_	quantità di alimento // proprio perché comunque la eh la scrofa praticamente è più affaticata // in questa fase // e ha eh	praticamente	diciamo la // si ha una diminuzione dell'' appetito inoltre // eh questa diminuzione dell'' alimentaz~ diciamo della
KIP	TOC1004	215-2	215-2	https://search.corpuskiparla.it/corpus/player/player.cgi?code=TOC1004&begin=570281&end=576393	yes	_	Filler	_	sì massima // però ha una produzione lattea continua come possiamo riscontrare nei ruminanti // ehmh // no // perchémh	praticamente	diciamo lamh l'' espulsione diciamo del latte avviene in più fasi // cioè nel senso per esempio durante la suzione // e
KIP	TOC1004	252-5	252-5	https://search.corpuskiparla.it/corpus/player/player.cgi?code=TOC1004&begin=662170&end=668141	yes	_	Prolettico	_	anche il pomeriggio // e sempre di prosta~ una iniezione di prostaglandina // e poi al centoquindicesimo giorno	praticamente	vado a somministrare nelle prime ore diciamo del mattino ossitocina // eh quindi allora // questo è uno dei protocolli
KIP	TOC1004	261-7	261-7	https://search.corpuskiparla.it/corpus/player/player.cgi?code=TOC1004&begin=690386&end=697275	yes	_	Filler	_	del parto // ehmh // ho bloccato // perfett~ // beh adesso riparte va // pers~ okay // allora quindi eh avvenuto il parto	praticamente	ehmh le le prime manovre diciamo da effettuare sono // per prima cosa eh verificare la completa espulsione degli
KIP	TOC1004	272-16	272-16	https://search.corpuskiparla.it/corpus/player/player.cgi?code=TOC1004&begin=746573&end=755724	yes	_	Prolettico	_	assunzione di colostro // eh il colostro inoltre è ricco diciamo ehmh di immunoglobuline gi e immunoglobuline a che	praticamente	hanno il compito di ehmh conferire ai piccoli diciamo // ehmhuna certa diciamo difesa a livello immunitario // ehil
KIP	TOC1004	315-2	315-2	https://search.corpuskiparla.it/corpus/player/player.cgi?code=TOC1004&begin=853131&end=855348	yes	_	Prolettico	_	// esatto // sì sì sì // fondmentali da questo punto di vista // quindi allora eh successivamente // eh effettuiamo	praticamente	il pareggioamento // eheffettuiamo la pesatura dei piccoli // è opportuno quindi eh ottenere una nidiata // ehmh in cui
KIP	TOC1004	424-1	424-1	https://search.corpuskiparla.it/corpus/player/player.cgi?code=TOC1004&begin=1155998&end=1157480	yes	_	Filler	_	di contenimento che cosa serve anche // che venga fatto // ehmh // per quanto riguarda per esempio la castrazione // e	praticamente	eh // posso farla così oppure // no vabbè eh nel senso // eh per prima cosa vado a separare quindi i piccoli dalla madre // e
KIP	TOC1004	434-3	434-3	https://search.corpuskiparla.it/corpus/player/player.cgi?code=TOC1004&begin=1174258&end=1177015	yes	_	Filler	_	i maschi e le femmine // e eh // sì no castrano solo più i maschi e le femmine per fortuna non più sì // sì // sì vabbè // e e poi	praticamente	emh // posso essere in presenza del medico veterinario ad esempio // e e vado amh // a an~ anestetizzare diciamo l'' aria //
KIP	TOC1004	448-3	448-3	https://search.corpuskiparla.it/corpus/player/player.cgi?code=TOC1004&begin=1215866&end=1217996	yes	_	Filler	_	// okay // okay andiamo avanti // eh // okay e a questo punto abbiamo quindi la produzione del latte // eh la scrofa	praticamente	èmh // produce il latte in base al numero dei suinetti ovvero // e praticamente la eh percentuale diciamo ehmh di latte
KIP	TOC1004	450-1	450-1	https://search.corpuskiparla.it/corpus/player/player.cgi?code=TOC1004&begin=1221446&end=1229995	yes	_	Filler	_	la produzione del latte // eh la scrofa praticamente èmh // produce il latte in base al numero dei suinetti ovvero // e	praticamente	la eh percentuale diciamo ehmh di latte prodotta dalla scrofa aumenta all'' aumentare del numero dei piccoli presenti
KIP	TOC1004	541-2	541-2	https://search.corpuskiparla.it/corpus/player/player.cgi?code=TOC1004&begin=1465581&end=1469798	yes	_	Prolettico	_	ci sono dei lucidi ci sono una serie di di di fotografie ci sono una serie di commenti // su questi aspetti // non tutti	praticamente	possono cioè nel senso hanno libero accesso alle mammelle // e quindi questo che cosa succede diciamo non tutti
KIP	TOC1004	670-1	670-1	https://search.corpuskiparla.it/corpus/player/player.cgi?code=TOC1004&begin=1805173&end=1812913	yes	_	Filler	_	secondo un certo tipo di schema la laa metrite in questo caso è una metrite per via // ascendente // ascendente // perché	praticamente	eh risale attraverso diciamo arriva fino all'' utero dove poi porta diciamo le infezioni e quindi eh comporta l'' emme
KIP	TOC1004	740-0	740-0	https://search.corpuskiparla.it/corpus/player/player.cgi?code=TOC1004&begin=1991881&end=1992910	yes	_	Introduzione o ripresa del topic	_	tanti piccoli come lele come le scrofe // abbiamo solo la coniglia // ad uso zootecnico ah beh i cani volendo //	praticamente	// ogni piccolo che viene espulso ab~ viene espulso in teoria l~ diciamo gli invogli fetali // d'' accordo // ehmh // ehcon
KIP	TOC1004	789-0	789-0	https://search.corpuskiparla.it/corpus/player/player.cgi?code=TOC1004&begin=2100921&end=2102354	yes	_	Introduzione o ripresa del topic	_	per esempio in francia // prevedono la somministrazione di probiotici eh co~ contenenti bacillus secerius //	praticamente	tale studio // ehesaminato diciamo effettuato su animali di razza xxx e andreis // praticamente ehmh ha alimentato dei
KIP	TOC1004	791-0	791-0	https://search.corpuskiparla.it/corpus/player/player.cgi?code=TOC1004&begin=2107166&end=2114559	yes	_	Filler	_	bacillus secerius // praticamente tale studio // ehesaminato diciamo effettuato su animali di razza xxx e andreis //	praticamente	ehmh ha alimentato dei gruppi eh un gruppo diciamo con paciflor e quindi contenente probiotici eh e quindi probiotici
KIP	TOC1004	793-8	793-8	https://search.corpuskiparla.it/corpus/player/player.cgi?code=TOC1004&begin=2117805&end=2121091	yes	_	Prolettico	_	eh e quindi probiotici // mentre un gruppo eh con alimentazione normale // ed è stato rilevato proprio che ehmh	praticamente	le scrofe // alimentate con probiotici eh presentavano diciamo in minor percentuale le metriti // eh un un un altro
KIP	TOC1004	798-6	798-6	https://search.corpuskiparla.it/corpus/player/player.cgi?code=TOC1004&begin=2140721&end=2155005	yes	_	Filler	_	effettuato innegli stati uniti // eh in cui ehmh gli animali sono stati divisi in tre gruppi // eh ehmh a ciascun gruppo	praticamente	eh a ciascun gruppo veniva somministrata un valore diciamo di vitamina e diverso per esempio al primo gruppo avevamo un
KIP	TOC1004	811-9	811-9	https://search.corpuskiparla.it/corpus/player/player.cgi?code=TOC1004&begin=2199863&end=2204374	yes	_	Prolettico	_	// eh la selezione di scrove di moderno tipo e vecchio tipo // per esempio uno studio effettuato in francia ha rilevato	praticamente	che le scrove di vecchio tipo erano diciamo // eh più attente quindi con maggiore attitudine a~ // che cosa intende per
KIP	TOC1004	819-4	819-4	https://search.corpuskiparla.it/corpus/player/player.cgi?code=TOC1004&begin=2216440&end=2218331	yes	_	Prolettico	_	per vecchio tipo? // ehmh // e nuovo tipo ovviamente // che non siano ibridi // cioè nel senso // ehmh // eh nel nello studio	praticamente	// le scrofe di moderno tipo vengono eh vengono diciamo considerate le scrofe ibride // mentre ehmh le vecc~ // quindi
KIP	TOC1004	841-4	841-4	https://search.corpuskiparla.it/corpus/player/player.cgi?code=TOC1004&begin=2273751&end=2278376	yes	_	_	Approssimazione	di butadine tendeva // che cos'' è il butadine // eh praticamentemh // unamh // eh loro la somministravano	praticamente	intorno al quattro percento della della nazione // xx dice somministrazione di butadiene però mi deve dire che cos'' è a
KIP	TOC1004	903-3	903-3	https://search.corpuskiparla.it/corpus/player/player.cgi?code=TOC1004&begin=2479836&end=2483868	yes	_	Prolettico	_	in pratica le gabbie sperimentali // eherano eh costituite da dei pannelli coibentati // eh questi pannelli	praticamente	erano costituiti in poli~ i~in polistirene // ed erano rivestiti da vetroresina in pratica eh la funzione diciamo di
KIP	TOC1004	914-1	914-1	https://search.corpuskiparla.it/corpus/player/player.cgi?code=TOC1004&begin=2517058&end=2519140	yes	_	Introduzione o ripresa del topic	_	// essenzialment~ // è giusto è questa la riflessione che // sì // sì sì // okay ed è perché perché è così? // perché	praticamente	quando per esempio // in condizioni di eh temperatura diciamo omh non ottimale e quindi diciamo al di sotto della
KIP	TOC1004	916-4	916-4	https://search.corpuskiparla.it/corpus/player/player.cgi?code=TOC1004&begin=2525386&end=2530885	yes	_	Prolettico	_	temperatura diciamo omh non ottimale e quindi diciamo al di sotto della temperatura ottimale // cosa succede i piccoli	praticamente	risultano essere ipovitali perché tendono diciamo ad assumere meno latte ad esempio // e quindi questo comporta eh
KIP	TOC1004	1083-0	1083-0	https://search.corpuskiparla.it/corpus/player/player.cgi?code=TOC1004&begin=3024711&end=3033511	yes	Manifestazione di accordo	_	_	// e sopra? // ehil numero di scrofe pre~ // o meglio scusi è il contrario no // trecentosessantacinque sotto e sopra //	praticamente	so~ diciamo mhrientra nel numero delle scrofe diciamo presenti nell'' allevamento e il numero di di parti diciamo all''
KIP	TOC1004	1150-2	1150-2	https://search.corpuskiparla.it/corpus/player/player.cgi?code=TOC1004&begin=3182726&end=3187220	yes	Manifestazione di accordo	_	_	diciamo uh coda ehmh a forma di ruota // ehmh // il le~ // fanno la ruota i maschi // a forma di sì esatto fanno la ruota // ehmh	praticamente	eh i maschi raggiungono uh circa ventuno chili // mentre le femmine intorno ai dodici chili // ehnel tacchino viene
KIP	TOC1004	1165-2	1165-2	https://search.corpuskiparla.it/corpus/player/player.cgi?code=TOC1004&begin=3215395&end=3218131	yes	_	Prolettico	_	ce ne sono // ehmh inoltre // inoltre ehmh // la caratteristica proprio diciamo delle // eh dei dei tacchini // è quella	praticamente	di ehmheh // di effettuare l'' inseminazione strumentale // e e l'' inseminazione strumentale viene effettuata a
KIP	TOC1004	1168-7	1168-7	https://search.corpuskiparla.it/corpus/player/player.cgi?code=TOC1004&begin=3226928&end=3231431	yes	_	Prolettico	_	viene effettuata a partire dalla trentaduesima settimana di di vita più o meno // ehin allevamento che cosa succede io	praticamente	ho ehle diciamo le femmine // che vengono poste i~ in nidi // e abbiamo o~ pe~ ogni nido per cinque femmine // eh all''
KIP	TOC1004	1244-6	1244-6	https://search.corpuskiparla.it/corpus/player/player.cgi?code=TOC1004&begin=3428918&end=3433779	yes	_	Introduzione o ripresa del topic|Prolettico	_	un po'' più mh diciamo utilizzata // e e la lettiera inoltre diciamo deve essere morbida // ehdeve ehmh deve garantire	praticamente	ehmh deve essere coibentan~ // mh deve esserere assorbente // ehmh non deve essere tossica non deve essere polverosa //
KIP	TOC1004	1249-2	1249-2	https://search.corpuskiparla.it/corpus/player/player.cgi?code=TOC1004&begin=3449530&end=3452895	yes	_	Introduzione o ripresa del topic|Prolettico	_	nella nella lettiera // ehmh inoltre eh un'' altra diciamo caratteristica per esempio delle ehdelle femmine // è quella	praticamente	diciamo chemh nel caso in cui no~non fossero // eh propense // ad entrare praticamente nei nidi trappola // devono
KIP	TOC1004	1251-2	1251-2	https://search.corpuskiparla.it/corpus/player/player.cgi?code=TOC1004&begin=3454315&end=3456628	yes	_	Prolettico	_	delle ehdelle femmine // è quella praticamente diciamo chemh nel caso in cui no~non fossero // eh propense // ad entrare	praticamente	nei nidi trappola // devono essere forzate // e emh diciamo le uova prodotte durante la settimana sono di all'' incirca
KIP	TOC1004	1256-3	1256-3	https://search.corpuskiparla.it/corpus/player/player.cgi?code=TOC1004&begin=3467656&end=3469286	yes	_	Filler	_	sono di all'' incirca tre // ch~ con un peso di maggiore di settantaduegrammi più o meno // ehmh // che cosa succede	praticamente	// ehmh // eh // abbiamo uhmh per quanto riguarda l'' alimentazione // ehl'' alimentazione dei tacchini eh vengono
KIP	TOC1004	1262-2	1262-2	https://search.corpuskiparla.it/corpus/player/player.cgi?code=TOC1004&begin=3488730&end=3494001	yes	_	Filler	_	mangimi prestarter starter eh uno starter due // ehgrovor uno grovor due e poi finisher uno e finisher due // che sono	praticamente	diciamo le fasi di avviamento ehmh ehmh // accrescimento ingrasso e poi finissaggio // ehimpr~ diciamo chemh la fase di
