corpus	conv_id	token_id	token_span	audio	SegnDisc	Func:Interazionale	Func:Metatestuale	Func:Cognitiva	left	form	right
KIPasti	KPS023	921-7	921-7	https://search.corpuskiparla.it/corpus/player/player.cgi?code=KPS023&begin=1954968&end=1961185	yes	_	Riformulazione	_	c'' è no di cultura un libro di storia // questo libro di storia mh // questo libro di storia mh // che parla di tutta la c''è	praticamente	la storia coloniale inglese eh mh britannica in africa jà // com''è partita com''è cominciata e così via // mh // capì? // mh
KIP	BOD2016	100-12	100-12	https://search.corpuskiparla.it/corpus/player/player.cgi?code=BOD2016&begin=332128&end=337700	yes	_	_	Attenuazione	sì tre coinquilini // maschi // eh il primo anno c'' era una ragazza // e il secondo anno un un ragazzo che si sono scambiata	praticamente	sì // ah // ma invece la tua casa giù è vivi~ cioè eh insomma ci sono i tuoi e? // casa mi~ casa mia giù è un palazzo familiare
KIP	BOD2016	127-6	127-6	https://search.corpuskiparla.it/corpus/player/player.cgi?code=BOD2016&begin=414338&end=422768	yes	_	Prolettico	_	andata è tornata giù // perehm // per voglia d~ di tornare a casa e di lasciare milano // okay // ehm beh vabbè mi hai parlato	praticamente	delle tutte le case in cui sei stato no? se dovessi invece immaginare // una casa ideale // sì // diciamo // una casa ideale
KIP	BOD1004	302-12	302-12	https://search.corpuskiparla.it/corpus/player/player.cgi?code=BOD1004&begin=1703784&end=1710445	yes	_	_	Intensificazione	approcci teraputici // per prevenire // eh il danno perché curarlo quando si è arrivati alla neurodegenerazione è	praticamente	impossibile // se non con la sostituzione neuronale che // come vedremo è un approccio che si sta contestando per quelle
ParlaTO	PTA017	352-2	352-2	https://search.corpuskiparla.it/corpus/player/player.cgi?code=PTA017&begin=841307&end=844320	yes	_	_	Attenuazione	lei intanto dormiva e comunque stava all''aria aperta protetta // mhmh quindi cioé // le hai fatto da mamma quasi // sì	praticamente	sì non c''ero solo la notte ma // okay // fino che si addormentava e quando si svegliava io c''ero // oka~ // wow // che bello //
ParlaTO	PTA017	732-1	732-1	https://search.corpuskiparla.it/corpus/player/player.cgi?code=PTA017&begin=1637900&end=1639010	yes	_	_	Attenuazione	non sei andata al cinema? // ultimamente nell''ultimo mese no // oka~ // qui~ prima è già un problema // sei come dory // sì	praticamente	sì // mi ricordo tante cose ch~di cui non mi serve cioè non mi serve ricordare e tante altre invece le rimuovo // tipo una
KIP	TOC1003	302-35	302-35	https://search.corpuskiparla.it/corpus/player/player.cgi?code=TOC1003&begin=1045949&end=1059678	yes	_	_	Approssimazione	sono state corrette ehmh dell'' institore non ha saputo solo quel dettaglio delle obbligazioni alla fine abbiamo detto	praticamente	tutto // mah io penso di poterle dare non tenendo conto diciamo di questo vizio // allora // mhmh // ehm // ti inizio a
ParlaBO	PBA012	676-1	676-1	https://search.corpuskiparla.it/corpus/player/player.cgi?code=PBA012&begin=1503840&end=1506550	yes	_	Prolettico	_	quel kit del dna che tra l''altro storia assurda perchè // ho fatto sto kit e dovevo spedirlo no // ma come si fa // allora	praticamente	tu e lo compri su su amazon // per tipo ottanta euro una roba così // ti arriva il kit // tu tipo fai la lava della saliva tutto
ParlaBO	PBA012	750-11	750-11	https://search.corpuskiparla.it/corpus/player/player.cgi?code=PBA012&begin=1648730&end=1653630	yes	_	_	Attenuazione	padre che anche lui doveva mandare un // un pacco // e dopo tipo cinquantta minuti di attesa in cui stavamo svalvolando	praticamente	finalmente tocca a noi // le poste magiche // e portiamo sto pacco sti due pacchi e tipo fanno // prendono il mio io tipo
ParlaBO	PBA012	808-5	808-5	https://search.corpuskiparla.it/corpus/player/player.cgi?code=PBA012&begin=1762290&end=1764510	yes	_	Prolettico	_	punto entro lo // // questa informazione // entro nella mail // t m i // // too much information // ehm // mi arriva la mail e	praticamente	dico // cazzo è arrivato le campane // // sento gli angeli ah che sollievo // ma non con il risultato // o sì non ho capito //
ParlaBO	PBA012	1014-6	1014-6	https://search.corpuskiparla.it/corpus/player/player.cgi?code=PBA012&begin=2117050&end=2119510	yes	_	Filler	_	// scherma medievale come // scherma medievale ippica preistorica // // ippica preis~ // no ques~ // no è una cosa che	praticamente	c''era questa // eh la conosce amo è roberta // roberta // mhmh // la famosa roberta // mh che prima era mia amica // che in
ParlaBO	PBA012	1049-4	1049-4	https://search.corpuskiparla.it/corpus/player/player.cgi?code=PBA012&begin=2178680&end=2184100	yes	_	Prolettico	_	bello // non volevo // tipo // se io // a casa mia non c''è // per cui dovrei prendere la macchina // ehm // questo vuol dire che	praticamente	se vado in centro magari vedo i miei amici oppure // faccio tipo i lavoretti per cui // adesso tipo // ho fatto un colloquio
ParlaBO	PBA011	962-1	962-1	https://search.corpuskiparla.it/corpus/player/player.cgi?code=PBA011&begin=1766880&end=1769169	yes	_	Prolettico	_	distruggi no alle lauree // cioè è quello l''obiettivo spesso // è distruzione no totale // eh mi ricordo sta scena // che	praticamente	c''era la ragazza che aveva perso il telefono // mh // lo cerca a tutti chiede a tutti dov''è il telefono dov''è il telefono //
KIP	BOD1005	382-1	382-1	https://search.corpuskiparla.it/corpus/player/player.cgi?code=BOD1005&begin=1546063&end=1549110	yes	_	_	Approssimazione	trovare una soluzione equa per tutti // dunque la distanza fra il dicio~ diciannove dicembre e il diciotto gennaio // è	praticamente	di due settimane lavorative // visto che c'' è pasqua nel m~ // // natale nel mezzo // va bene // eh allora noi correggermo
KIP	BOD1005	881-2	881-2	https://search.corpuskiparla.it/corpus/player/player.cgi?code=BOD1005&begin=3631526&end=3634016	yes	_	Filler	_	pari oppure esiste un numero dispari // va bene // allora come procedo eh procedo nel modo ovvio // posso scegliere	praticamente	// eh qualsiasi quantificatore però iniziamo dai più ingenui // allora qui ho // eh questo quantificatore va bene? che è
KIP	BOD1005	1008-16	1008-16	https://search.corpuskiparla.it/corpus/player/player.cgi?code=BOD1005&begin=4392699&end=4403660	yes	_	Prolettico	_	// eh // quale da quale quantificatore volete cominciare qui capite questi non sono quantificatori uno dentro l'' altro	praticamente	son tutti qualificatori indipendenti no? // lei ha fatto // sì // allora venga su // bene bene dai mettila a contatto
KIP	BOD1010	149-7	149-7	https://search.corpuskiparla.it/corpus/player/player.cgi?code=BOD1010&begin=688838&end=693598	yes	_	Filler	_	sulame~ solamente sulle otto battute della a // quindi due volte essendo a bi a ci sulle due a // che co~ le le bi le lascia	praticamente	identiche a come le ha scritte gershwin // ora // come sapete ne~ vedete nel primo rigo gli accordi della a di but not for me
KIP	BOD1010	211-2	211-2	https://search.corpuskiparla.it/corpus/player/player.cgi?code=BOD1010&begin=919381&end=921150	yes	_	Introduzione o ripresa del topic	_	sorprendervi // per chi era alla lezione della della della lezione scorsa fattelo spiegare magari // ah perfetto // c'' è	praticamente	se tu colleghi // ah guarda lo vedi qui se tu colleghi // fai i quinti primi col basso // ti viene una scala esatonale // se tu
KIP	BOD1010	265-8	265-8	https://search.corpuskiparla.it/corpus/player/player.cgi?code=BOD1010&begin=1214468&end=1223885	yes	_	Introduzione o ripresa del topic	_	quella linea esatonale capito? // suona sulle sigle normalmente // ci sei? // sì sì sì cioè mi sembrava che raddoppiasse	praticamente	facesse in quarti quelle le note della scala esatonale anche nei nei chorus di improvvisazione // na non è così // m
KIP	BOD1010	296-5	296-5	https://search.corpuskiparla.it/corpus/player/player.cgi?code=BOD1010&begin=1438520&end=1440450	yes	_	_	Specificazione	paul chambers art taylor e // ehm il ba~ il ba~ il pianista che suonava all'' epoca winton kelly // era la ritmica di davis	praticamente	// questo m pezzo fu registrato quando coltrane suonava ancora con davis quindi utilizza quella ritmica // quando si
KIP	BOD1010	398-1	398-1	https://search.corpuskiparla.it/corpus/player/player.cgi?code=BOD1010&begin=1823393&end=1828605	yes	_	Prolettico	_	delle terze // quello di si bemolle // per le ultime quattro battute bontà sua lascia gli accordi di cole porter // quindi	praticamente	sostituisce tre quarti degli accordi del pezzo // inserendo tre assi di terze // quello di fa quello di do e quello di si
KIP	BOD1010	401-1	401-1	https://search.corpuskiparla.it/corpus/player/player.cgi?code=BOD1010&begin=1835680&end=1837210	yes	_	Prolettico	_	tre quarti degli accordi del pezzo // inserendo tre assi di terze // quello di fa quello di do e quello di si bemolle // e	praticamente	tocca tutte le tonalità // posso fare una domanda ma // prego // nell'' improvvisazione che è venuta diciamo dopo
KIP	BOD1010	785-0	785-0	https://search.corpuskiparla.it/corpus/player/player.cgi?code=BOD1010&begin=3631894&end=3633826	yes	_	Introduzione o ripresa del topic	_	sul pedale // dove invece qui c'' era il sax // // cioè in pratica fa nell'' intro il tema da solo e poi lo fa col coi fiati //	praticamente	che cosa fa rovescia // cioè non solo parte dalla fine // ma rovescia la posizione del sax e dei fiati // quindi ci
KIP	BOD2013	139-12	139-12	https://search.corpuskiparla.it/corpus/player/player.cgi?code=BOD2013&begin=424716&end=429318	yes	_	_	Specificazione	che non era disposta a mettersi in gioco nella relazione // e quindi ci siam divisi le camere ci siamo separati in casa	praticamente	// come una coppia di coniugi // in che senso divisi // nel senso che avevamo una camera singola molto grande // il salotto
KIP	BOD2013	175-6	175-6	https://search.corpuskiparla.it/corpus/player/player.cgi?code=BOD2013&begin=511115&end=517550	yes	_	_	Specificazione	questi questi // mh pacchetti di cibo stivati nel frigo ognuno con su scritto // eh // gli ingredienti // e la data e ~l	praticamente	anche l'' ora in cui mangiarli perchè sua madre gli preparava tutto // dio // // sì aveva mh // era un po'' malato non lo so //
KIP	BOD2013	195-0	195-0	https://search.corpuskiparla.it/corpus/player/player.cgi?code=BOD2013&begin=570930&end=576270	yes	_	Prolettico	_	dava un certo equilibrio // e ognuno poi aveva delle passioni diverse // ehm carattere diverso // tutte persone che //	praticamente	non non ci conoscevamo tra di noi solo le ragazze si conoscevano che abitavano già qua // per cui eravamo tutti con gli
KIPasti	KPS024	124-1	124-1	https://search.corpuskiparla.it/corpus/player/player.cgi?code=KPS024&begin=214965&end=215758	yes	_	Filler	_	vuole // sì // si vuole truccare si vuole fare le unghie // ma non è // cioè l''ultimo episodio è stato devastante // cioè	praticamente	// // addirittura? // ti giuro // cioè senti // venne un''amica a casa // mh // e allora disse // ce ne possiamo andare giù in
KIPasti	KPS024	267-0	267-0	https://search.corpuskiparla.it/corpus/player/player.cgi?code=KPS024&begin=462497&end=463753	yes	_	Prolettico	_	dei soldi // il bonus bebè // vuoi il salame? // dammi quì // non mi ricordo bene la faccenda comunque // ancora? // eh //	praticamente	non gliel''hanno dati // perchè gli è uscito // #vuoi u xx ? // eh un attimo // cioè piano // sta iniziando // perchè non
KIPasti	KPS024	1102-0	1102-0	https://search.corpuskiparla.it/corpus/player/player.cgi?code=KPS024&begin=1865731&end=1866852	yes	_	Riformulazione	_	no queste storie qua non le so neanch''io // // non le so neanch''io // #vabbuò i // i retroscena proprio // in poche parole //	praticamente	questo ave~ av~ // faceva il prendi e lascia // ah eh sì // questo si sapeva questo già da anni // e poi // tipo // due giorni
KIPasti	KPS024	1334-3	1334-3	https://search.corpuskiparla.it/corpus/player/player.cgi?code=KPS024&begin=2187182&end=2188593	yes	_	Filler	_	ci stavo anche io // mi ha fatto leggere le conversazioni // cose // e chiara ha fatto una cosa plateale // che ho adorato	praticamente	// si è // x // bellissimo da serie tv // eh // l''ha chiamato e ha detto oh vediamoci // ho voglia così // // stava facendo pure
KIPasti	KPS024	1542-5	1542-5	https://search.corpuskiparla.it/corpus/player/player.cgi?code=KPS024&begin=2504604&end=2506394	yes	_	_	Intensificazione	d~ tu fai un bando // sopra il booster // // xxx // // #fai u bando // e de~ che devi vincere // ti dev~ ti devono raccomandare	praticamente	// perchè non vinci mai // se non c''hai // cioè chiunque ho parlato che ha fatto il // il servizio civile ha avuto la buttata
KIPasti	KPS024	1600-0	1600-0	https://search.corpuskiparla.it/corpus/player/player.cgi?code=KPS024&begin=2580457&end=2582763	yes	_	Filler	_	// così xx li chiamavano // di io immagino i co~ i conigli che impastano // dolci di qua~ // no sono dei conigli di //	praticamente	hai presente quella pasta di riso? // il pane di riso sai? // quel tipo pane scu~ // ah eccoli // che hai scritto dolci dei
ParlaTO	PTD015	285-9	285-9	https://search.corpuskiparla.it/corpus/player/player.cgi?code=PTD015&begin=566993&end=571000	yes	_	Introduzione o ripresa del topic	_	è su via balbo // // okay // che affa~ s''affaccia su piazza santa giulia // // e eravamo lì abbiam sentito rompere dei vetri	praticamente	// // i gli gli spaccini in termine tecnico // gli spaccini // si sono azzuffati rompendo una bottiglia con tanto di collo
ParlaTO	PTD015	309-4	309-4	https://search.corpuskiparla.it/corpus/player/player.cgi?code=PTD015&begin=609496&end=611703	yes	_	_	Specificazione	che si son spostati dal lato sinistro della piazza al lato destro // nel far west // esatto // esatto sotto le poste	praticamente	// un''invasione territoriale quindi // sì // sì // // sì // quindi c''é stato un un regolamento di spazi e di conti
ParlaTO	PTD015	357-2	357-2	https://search.corpuskiparla.it/corpus/player/player.cgi?code=PTD015&begin=710896&end=712110	yes	_	Introduzione o ripresa del topic	_	é una zona abbastanza residenziale poi c''é la caserma // eh sempre su corso bramante per cui é tutto un // mh mh // un rione	praticamente	// utilizzato dalla vita di chi la vive insomma di chi abita lì // ehm invece via castelgomberto é una é é decisame~ perché
KIPasti	KPC008	7-1	7-1	https://search.corpuskiparla.it/corpus/player/player.cgi?code=KPC008&begin=14480&end=20603	yes	_	Introduzione o ripresa del topic	_	che erano le mie coinquiline all''università // grazie // da~ a trieste // a gorizia esattamente // ah a gorizia // e	praticamente	loro di queste due monica e beatrice si chiamano no una vive a milano // mhmh // eh vabbè più o meno è facile l''altra vive a
KIPasti	KPN022	7-2	7-2	https://search.corpuskiparla.it/corpus/player/player.cgi?code=KPN022&begin=26402&end=34366	yes	_	Introduzione o ripresa del topic	_	arrivate in bici fino al capitello quello qua vicino alla cooperativa // poi c''e~ lì c''era un indizio // ehm dovevamo	praticamente	andare dal campetto quello di cemento dove giocano a calcio // ciao marco grazie ciao // ehm perchè c''erano vari indizi e
KIPasti	KPN022	27-1	27-1	https://search.corpuskiparla.it/corpus/player/player.cgi?code=KPN022&begin=76657&end=78337	yes	_	Filler	_	a vabbè sì // maria rossi // vabbè e c''è sta cosa che ha il filo spinato sopra // eh // non ho la più pallida idea di cosa sia // e	praticamente	// lì siamo state dieci minuti a cercare sto biglietto // perchè non sapevamo dove fosse // e c''era anche una macchina in
KIPasti	KPN022	243-1	243-1	https://search.corpuskiparla.it/corpus/player/player.cgi?code=KPN022&begin=483494&end=488510	yes	_	Introduzione o ripresa del topic	_	posto // e quindi adesso cioè nel senso ha una posizione migliore // che figo // sempre // dentro a quell''azienda // sì // e	praticamente	si ve~ si dev~ si occupa delle vendite m // per al~ sì // m per altre varie az~ altre varie aziende eh di facebook // che figo
KIPasti	KPN022	374-5	374-5	https://search.corpuskiparla.it/corpus/player/player.cgi?code=KPN022&begin=711390&end=715100	yes	_	_	Approssimazione	paola na volta // no~ dove ti fermi davanti // dalla l''altra p~ lato della strada // #so mama so mama // sì dove ci sono tipo	praticamente	case popolari perchè ok // sì sì quelle quelle // sì sì // eh // è ancora // è lì // là abitava // dove andavo io quando // // //
KIPasti	KPS017	785-2	785-2	https://search.corpuskiparla.it/corpus/player/player.cgi?code=KPS017&begin=825090&end=826450	yes	_	Prolettico	_	al tegamino? // eh ma quella al tegamino quanti spicchi la tagli? // quella al tegami~ otto // è la la pizza torinese // è è	praticamente	è alta // è minuscola // è piccolina // eh // ah è piccola // x // ah ma è pronta? // è stranissima // no no no no praticamente si
KIPasti	KPS017	793-4	793-4	https://search.corpuskiparla.it/corpus/player/player.cgi?code=KPS017&begin=830560&end=833260	yes	_	Prolettico	_	è è praticamente è alta // è minuscola // è piccolina // eh // ah è piccola // x // ah ma è pronta? // è stranissima // no no no no	praticamente	si fa si fa adesso cerco una foto // no // cioè è gro~ // e allora? // è alta // tipo una tort~ cioè // è una pizza che si fa eh eh //
KIPasti	KPS017	1505-2	1505-2	https://search.corpuskiparla.it/corpus/player/player.cgi?code=KPS017&begin=1562070&end=1563190	yes	_	Prolettico	_	fatto lui tutto questo pia~ // la pasta l''ho l''ho l''ho finit~ // ma e questa pasta? // sono paccheri // cosa sono? // però	praticamente	ho fatto così // ho fatto // eh ho messo il guanciale in padella così suda bene e esce tutto il grasso // il guanciale
KIP	BOA3001	39-2	39-2	https://search.corpuskiparla.it/corpus/player/player.cgi?code=BOA3001&begin=86057&end=88798	yes	_	Prolettico	_	// lui era quello che si scriveva // con quella // che poi si è messa co un altro e l'' ha trattato malissimo // ah sì // cioè lei	praticamente	l'' ha illuso poi // l'' ha mollato // sì // quindi secondo me lui sarebbe anche capace di mantenere una relazione anche a
KIP	BOA3001	961-2	961-2	https://search.corpuskiparla.it/corpus/player/player.cgi?code=BOA3001&begin=2124207&end=2129983	yes	_	Prolettico	_	un altro ier sera nun ce la facevo però son rimasta a metà // no sì sì // // lì lì // che c'' è aragon bellissimo // cioè	praticamente	frodo sta sv~ tipo muoren~ morendo no però svenendo // sì // sì // e invece e vede aragon uscire dall'' ombra con il fuoco in
KIP	TOD1005	1029-1	1029-1	https://search.corpuskiparla.it/corpus/player/player.cgi?code=TOD1005&begin=2472943&end=2474193	yes	_	_	Intensificazione	perché ovviamente fare un atlante con // questo grado di precisione // su un'' area enorme come il mondo arabo // è	praticamente	impossibile // okay // ehmh // ci si può lavorare è stato fatto su alcune zone ci sono a~ aree // più dettagliate però // è un
ParlaBO	PBB004	605-4	605-4	https://search.corpuskiparla.it/corpus/player/player.cgi?code=PBB004&begin=1143822&end=1148152	yes	_	Prolettico	_	i cavalli e i carri quelle cose lì // mh // anche secondo te gina // penso di sì non c''ho mai pensato // per eh ci dividere	praticamente	la gente a piedi da dal traffico // coi carri gli animali quelle cose lì // e secondo voi a che periodo risalgono i portici
KIPasti	KPN013	572-2	572-2	https://search.corpuskiparla.it/corpus/player/player.cgi?code=KPN013&begin=1023773&end=1031020	yes	_	Introduzione o ripresa del topic	_	capito io // xxx // era così brutta che nessuno ci poteva pensare // sto male // e // è buono? // è buonissimo raga // e niente	praticamente	lei ha pubblicato nel novantotto una serie di racconti che però non sono mai stati trovati in altre lingue no? //
KIPasti	KPN013	574-2	574-2	https://search.corpuskiparla.it/corpus/player/player.cgi?code=KPN013&begin=1034940&end=1038090	yes	_	Introduzione o ripresa del topic	_	di racconti che però non sono mai stati trovati in altre lingue no? // racconti brevi allora hanno scelto uno // che io	praticamente	devo tradurre in italiano // e poi commentare la mia traduzione // bello // faccio la tesi su x cioè è un racconto di da
ParlaTO	PTB008	89-4	89-4	https://search.corpuskiparla.it/corpus/player/player.cgi?code=PTB008&begin=123278&end=129830	yes	_	Introduzione o ripresa del topic	_	i dialetti // come mh con i suoi genitori quando era piccola fratelli // eh // ma eh diciamo mh // in famiglia eh piemontese	praticamente	solo che c''era mio nonno che abitavamo insieme // che era calabrese // ah // papà di mia mamma // e quindi lui parlava
ParlaBO	PBA026	16-2	16-2	https://search.corpuskiparla.it/corpus/player/player.cgi?code=PBA026&begin=29530&end=31758	yes	_	_	Approssimazione	che abito a bologna // perché prima ho vissuto a san lazzaro // cioè prima alla ponticella poi a san lazzaro // mhmh // per	praticamente	tutta la mia vita // e a settembre duemilaventitré mi son trasferito qui // quindi bologna bologna // ci sono nato e ci sto
ParlaBO	PBA026	168-2	168-2	https://search.corpuskiparla.it/corpus/player/player.cgi?code=PBA026&begin=399984&end=403100	yes	_	Prolettico	_	ha mh la sede a modena quindi dove lavora // eh e quindi dovendo uscire // praticament~ prima del covid // dovendo uscire	praticamente	ogni giorno per andare a modena // ci portava alla fermata del bus già diciamo in in città // in città // sì sì certo ha senso
ParlaBO	PBA026	391-0	391-0	https://search.corpuskiparla.it/corpus/player/player.cgi?code=PBA026&begin=988391&end=991100	yes	_	Introduzione o ripresa del topic	_	che prendon sempre voti alti // tutta la classe con lei in matematica e in elettrotecnica aveva sempre sei // o meno //	praticamente	nessuno riusciva a prender più di sei // e lei si lamentava con noi diceva eh non studiate non studiate // ma dopo tre anni
ParlaBO	PBA026	428-0	428-0	https://search.corpuskiparla.it/corpus/player/player.cgi?code=PBA026&begin=1089462&end=1090621	yes	_	Chiusura del topic	_	niente // mhmh // e questo atteggiamento poi // allora non ce l''aveva mica solo lui ce l''avevano tutti i professori //	praticamente	quindi // anche lì è stato è stato molto difficile // ehm se c''eran dei problemi metterli a posto // perché // eh
ParlaBO	PBA026	755-1	755-1	https://search.corpuskiparla.it/corpus/player/player.cgi?code=PBA026&begin=1880887&end=1882480	yes	_	Filler	_	quattro metri e cinquanta // quindi fatta per saltare oltre i cinque metri // stavo stavo provando quest''asta qui // e	praticamente	// più l''asta è lunga // più // tu ci devi mettere forza e più devi correre veloce // per riuscire a piegare quest''asta // io
ParlaBO	PBA026	866-1	866-1	https://search.corpuskiparla.it/corpus/player/player.cgi?code=PBA026&begin=2196317&end=2199391	yes	_	Prolettico	_	non seppe darmi una risposta // ehm // due settimane dopo i campionati italiani di squadra // il il mio allenatore // eh	praticamente	non riuscì più a seguirmi // perché e il presidente // gli aveva mandato un sacco di ragazzi aveva formato un gruppo
ParlaBO	PBA026	917-1	917-1	https://search.corpuskiparla.it/corpus/player/player.cgi?code=PBA026&begin=2343787&end=2348259	yes	_	_	Intensificazione	cavallo // ehm sbarra e parallele // io faccio sbarra e parallele // c''ho le mani aperte // aperte // sì // e quindi // sono	praticamente	fermo adesso perché no~ posso fare solo potenziamento // mhmh // ah beh dai ma t~ guarirai subito // penso // mah eh // cioè
ParlaBO	PBA026	991-6	991-6	https://search.corpuskiparla.it/corpus/player/player.cgi?code=PBA026&begin=2515234&end=2520840	yes	_	Prolettico	_	però i~ natale lo passi in famiglia comunque? // x xx // natale in famiglia sempre passato in famiglia // e la sera mi sono	praticamente	sempre visto con con i miei amici quindi // la la mia tradizione a natale è il pranzo // alla mattina e pranzo con la
KIPasti	KPC003	127-0	127-0	https://search.corpuskiparla.it/corpus/player/player.cgi?code=KPC003&begin=385026&end=391752	yes	_	Riformulazione	_	// ma te io vedo un cerchio // no ma ve~ le luci che fanno tipo a~ e h asterisco // no io vedo un cerchio // no il cerc~ cioè //	praticamente	il cerchio è diciamo tipo il il il faro da cui parte la luce ma poi dopo c''è una specie di asterisco // forse sei astigmatico
KIPasti	KPC003	261-2	261-2	https://search.corpuskiparla.it/corpus/player/player.cgi?code=KPC003&begin=854484&end=858050	yes	_	_	Approssimazione	è il mio nonno paterno e mh // mh mh // e poi n''ha avuto un altro di questi macchinari non so se era per la pressione // però era	praticamente	per il coso che che ti buchi un dito // quello è per mh la glicemia il diabete // eh sì per la glicemia sì perchè div~ mh mh ci ha
ParlaBO	PBB011	422-1	422-1	https://search.corpuskiparla.it/corpus/player/player.cgi?code=PBB011&begin=868038&end=869807	yes	_	Prolettico	_	sotto questo aspetto // non riescono più ad avere // senso civico ecco // mhmh // sì // sì // ehm // essendo // i portici // mh	praticamente	ovunque a bologna no? // cioè magari quando vai ne~ in un''altra città oppure nella tua città natale // cioè che effetto f~
ParlaBO	PBA018	244-4	244-4	https://search.corpuskiparla.it/corpus/player/player.cgi?code=PBA018&begin=629281&end=632883	yes	_	Riformulazione	_	// sì no dicevo che i lati positivi di sto lavoro // che mh // cioè non è un lavoro fisso // mh // quindi ti permette cioè	praticamente	da contratto sarebbe che // okay // tu devi farti minimo ottanta giornate // massimo centottanta // mh nell''arco di // di
ParlaBO	PBA018	324-2	324-2	https://search.corpuskiparla.it/corpus/player/player.cgi?code=PBA018&begin=799158&end=801874	yes	_	Prolettico	_	in eh // quaranta persone più o meno // okay // quindi sia~ siamo in un po'' // e ogni giorno sei con gente diversa // cioè te	praticamente	arrivi in magazzino c''hai un foglio // in cui stanno scritte tutte le squadre // okay // con i mezzi che devi portarti i
