PBA010;#603809;doc#93;2023;https://search.corpuskiparla.it/corpus/player/player.cgi?code=PBA010&begin=455503&end=460813;455503;460813;BOI069;PBA010;00:31:17;fisso;https://search.corpuskiparla.it/corpus/conversations/PBA010.html;https://search.corpuskiparla.it/corpus/conversations/PBA010_jefferson.html;21-25;M;BO;2;artig;sì;asimmetrico;emilia-romagna;intervista semistrutturata;med;a ferrara // ah // però a essere sinceri tra bologna e ferrara // un po'' gli mo~ i bolognesi mi odieranno per questo però;direi;che preferisco ferrara perché è un po'' più piccola // // mhmh certo // però è mh un po'' più tranquilla nel senso viv~ ~ssuta;1;;;;;;;;;;;;;;;;;;;;;;;0
PBA010;#606752;doc#93;2023;https://search.corpuskiparla.it/corpus/player/player.cgi?code=PBA010&begin=1559872&end=1562518;1559872;1562518;BOI069;PBA010;00:31:17;fisso;https://search.corpuskiparla.it/corpus/conversations/PBA010.html;https://search.corpuskiparla.it/corpus/conversations/PBA010_jefferson.html;21-25;M;BO;2;artig;sì;asimmetrico;emilia-romagna;intervista semistrutturata;med;o di età diverse? // giovani // il più vecchio ha quartanta due anni // giovani? // ah okay // siete // siamo mh età media;direi;// trenta? trentadue? // siamo molto giovani e comunque è un qualcosa di // molto attuale // mhmh // l~ l''ag~ il più;;;;;1;;;;;;;;;;;;;;;;;1;;0
PTA006;#609622;doc#94;2019;https://search.corpuskiparla.it/corpus/player/player.cgi?code=PTA006&begin=643011&end=648647;643011;648647;TOI006;PTA006;01:05:12;fisso;https://search.corpuskiparla.it/corpus/conversations/PTA006.html;https://search.corpuskiparla.it/corpus/conversations/PTA006_jefferson.html;26-30;M;TO;4;comm;sì;asimmetrico;piemonte;intervista semistrutturata;dip_tec_prof;novità alle tecnologie a quello che è // ehmh no alle tecnologie no alle alle opportunità nuove mettiamola perché poi;direi;una cosa che non so // mh mh mh // però cioè nel senso che c''è un politecnico non posso dire che per le tecnologie non siamo;1;;;;;;;;;;;;;;;;;;;;;;;0
PTA006;#613114;doc#94;2019;https://search.corpuskiparla.it/corpus/player/player.cgi?code=PTA006&begin=1724912&end=1731878;1724912;1731878;TOI006;PTA006;01:05:12;fisso;https://search.corpuskiparla.it/corpus/conversations/PTA006.html;https://search.corpuskiparla.it/corpus/conversations/PTA006_jefferson.html;26-30;M;TO;4;comm;sì;asimmetrico;piemonte;intervista semistrutturata;dip_tec_prof;sono problemi nella tua zona? ci sono cose che miglioreresti? // s~ migliorerei probabilmente la viabilità ma non non;direi;questa via bisogna farla in un senso unico // e che continuano a costruire // mh // anche dove è già stracostruito;1;;;;;;;;;;;;;;;;;;;;;;;0
BOD1011;#628363;doc#96;2017/18;https://search.corpuskiparla.it/corpus/player/player.cgi?code=BOD1011&begin=2329840&end=2333981;2329840;2333981;===NONE===;BOD1011;01:26:29;fisso;https://search.corpuskiparla.it/corpus/conversations/BOD1011.html;https://search.corpuskiparla.it/corpus/conversations/BOD1011_jefferson.html;===NONE===;===NONE===;BO;1;===NONE===;no;asimmetrico;===NONE===;lezione;===NONE===;// successive non mi ricevono // quindi devono essere di casta alta così posso entrare ovunque // e // prego // quindi;direi;è della casta più alta quindi xxx xxx // sì la casta la casta più alta pe quella dei brakmani // ma non basta // deve essere //;;;;;1;1;;;;;;;;;;;;;;;1;1;;1
KPN021;#639071;doc#97;2020;https://search.corpuskiparla.it/corpus/player/player.cgi?code=KPN021&begin=882479&end=885739;882479;885739;PKP070;KPN021;01:00:29;libero;https://search.corpuskiparla.it/corpus/conversations/KPN021.html;https://search.corpuskiparla.it/corpus/conversations/KPN021_jefferson.html;21-25;M;TV;4;stud;no;simmetrico;veneto;pasto;laurea in corso;// mh mare tipo bora bora // sì però posti freddi tipo in svezia o in finlandia io la vorrei una casa // ma casa proprio io;direi;tipo andiamo in vacanza con il nostro jet privato e fine // anche o tipo ma no casa che dev''essere per forza casa // cioè il;1;;;;;;;;;;;;;;;;;;;;;;;0
KPN021;#639923;doc#97;2020;https://search.corpuskiparla.it/corpus/player/player.cgi?code=KPN021&begin=1146289&end=1148879;1146289;1148879;PKP072;KPN021;01:00:29;libero;https://search.corpuskiparla.it/corpus/conversations/KPN021.html;https://search.corpuskiparla.it/corpus/conversations/KPN021_jefferson.html;21-25;F;TV;4;N/A;no;simmetrico;veneto;pasto;N/A;sta qua fa tipo tutte le grafiche con il no~ i nomi // ah ah // tipo // okay // ma è stra figo // sì sì // tipo stra logo // sì // io;direi;che questo lo spegniamo perchè se no moriamo // eh // ah beh sì l''altra volta a casa mia tipo // // era un po'' // cioè è stra;1;;;;;;;;;;;;;;;;;;;;;;;0
TOD2014;#662074;doc#100;2019;https://search.corpuskiparla.it/corpus/player/player.cgi?code=TOD2014&begin=614210&end=615118;614210;615118;TO059;TOD2014;00:27:40;fisso;https://search.corpuskiparla.it/corpus/conversations/TOD2014.html;https://search.corpuskiparla.it/corpus/conversations/TOD2014_jefferson.html;21-25;F;TO;3;stud;sì;simmetrico;umbria;intervista semistrutturata;laurea in corso;no che mo siete vecchie insomma in in adolescenza okay forse adolescenti non lo siete // // più forse non lo so // madonna;direi;di no // okay // da un po'' anche // la casa delle superiori raccontatemi quando facevate le superiori dove stavate più o;;;;;1;;;;;;;;;;;;;;;;;;1;0
TOD2014;#665466;doc#100;2019;https://search.corpuskiparla.it/corpus/player/player.cgi?code=TOD2014&begin=1649663&end=1654200;1649663;1654200;TO071;TOD2014;00:27:40;fisso;https://search.corpuskiparla.it/corpus/conversations/TOD2014.html;https://search.corpuskiparla.it/corpus/conversations/TOD2014_jefferson.html;31-35;M;TO;3;stud;sì;simmetrico;abruzzo;intervista semistrutturata;laurea in corso;bruciato niente cioè // s~ c'' aveva le sue fisime diciamo // sì // un tantinello sì era molto particolare // okay // ma io;direi;che boh che ventisette minuti li abbiamo fatti vi posso liberare vi posso // xxx // eh no sì anche perchè devo andare io //;1;;;;;;;;;;;;;;;;;;;;;;;0
PTD012;#678303;doc#103;2019;https://search.corpuskiparla.it/corpus/player/player.cgi?code=PTD012&begin=348136&end=351920;348136;351920;TOI068;PTD012;01:55:04;fisso;https://search.corpuskiparla.it/corpus/conversations/PTD012.html;https://search.corpuskiparla.it/corpus/conversations/PTD012_jefferson.html;46-50;M;TO;2;intell;sì;asimmetrico;lazio;intervista semistrutturata;laurea;una roba che potevi fare così legalmente e normalmente quindi // quello c''è sempre stato // qui con questa affluenza io;direi;che sarà un paio di anni buoni // perchèbah // banalmente forse c''hanno messo un po'' a scoprirlo nel senso che // il grosso;1;;;;;;;;;;;;;;;;;;;;;;;0
PTD012;#678481;doc#103;2019;https://search.corpuskiparla.it/corpus/player/player.cgi?code=PTD012&begin=398706&end=405255;398706;405255;TOI068;PTD012;01:55:04;fisso;https://search.corpuskiparla.it/corpus/conversations/PTD012.html;https://search.corpuskiparla.it/corpus/conversations/PTD012_jefferson.html;46-50;M;TO;2;intell;sì;asimmetrico;lazio;intervista semistrutturata;laurea;quello è un treno forse più caro no? un''alta vel~ un tgv // mhmh // quindi forse quello ha indotto a metterci di meno // io;direi;diciamo dall''estate del duemiladiciassette abbiamo cominciato a vedere gente in giro anche in montagna x qua;;;;;1;1;;;;;;;;;;;;;;;;1;;0
PTD012;#687546;doc#103;2019;https://search.corpuskiparla.it/corpus/player/player.cgi?code=PTD012&begin=3228272&end=3230715;3228272;3230715;TOI068;PTD012;01:55:04;fisso;https://search.corpuskiparla.it/corpus/conversations/PTD012.html;https://search.corpuskiparla.it/corpus/conversations/PTD012_jefferson.html;46-50;M;TO;2;intell;sì;asimmetrico;lazio;intervista semistrutturata;laurea;duemiladiciassette a maggio duemiladiciannove // han calcolato circa dodicimila persone // madonna // eh // sì;direi;verosimilmente il dieci per cento minori // mh paesi più diffusi // allora l''anno scorso passavano quasi tutti al primo;;;;;1;;;;;;;;;;;;;;;;;1;;0
PBB033;#698548;doc#105;2024;https://search.corpuskiparla.it/corpus/player/player.cgi?code=PBB033&begin=2596054&end=2598699;2596054;2598699;BOR037;PBB033;00:48:35;fisso;https://search.corpuskiparla.it/corpus/conversations/PBB033.html;https://search.corpuskiparla.it/corpus/conversations/PBB033_jefferson.html;21-25;F;BO;2;stud;sì;asimmetrico;emilia-romagna;intervista semistrutturata;laurea in corso;capito // sì // // tu vai in piazza maggiore e li conti sono nove i gradini di san petronio // #è vero ro~ anche in modenese;direi;che sed nov? // hai capito? e loro // avevano questo modo delle volte di incontrarsi così per un pochino // #ironico per;1;;;;;;;;;;;;;;;;;;;;;;;0
PBB033;#699427;doc#105;2024;https://search.corpuskiparla.it/corpus/player/player.cgi?code=PBB033&begin=2889694&end=2893735;2889694;2893735;BOR037;PBB033;00:48:35;fisso;https://search.corpuskiparla.it/corpus/conversations/PBB033.html;https://search.corpuskiparla.it/corpus/conversations/PBB033_jefferson.html;21-25;F;BO;2;stud;sì;asimmetrico;emilia-romagna;intervista semistrutturata;laurea in corso;anni settanta anni di piombo eh stati un po'' difficili in sè // sì sì sì // erano anni un po'' memorabili // eh // beh allora;direi;che possiamo concludere l''intervista // ah sì // xsto un po'' di dom~ insomma ho fatto molte domande // no ah beh vabbè per;1;;;;;;;;;;;;;;;;;;;;;;;0
PBB013;#715225;doc#109;2022;https://search.corpuskiparla.it/corpus/player/player.cgi?code=PBB013&begin=1007671&end=1008847;1007671;1008847;BOI040;PBB013;00:29:04;fisso;https://search.corpuskiparla.it/corpus/conversations/PBB013.html;https://search.corpuskiparla.it/corpus/conversations/PBB013_jefferson.html;46-50;F;BO;2;oper;sì;asimmetrico;emilia-romagna;intervista semistrutturata;dip_tec_prof;// // un po'' in balia degli eventi // si // e il trasporto pubblico a bologna nel bacino di bologna funziona bene? // ma io;direi;di si // io direi di si // insomma le zone // nonostante tutto nonostante il casino nonostante i tempi un po'' // e // e //;1;;;;;;;;;;;;;;;;;;;;;;;0
PBB013;#715230;doc#109;2022;https://search.corpuskiparla.it/corpus/player/player.cgi?code=PBB013&begin=1009392&end=1010267;1009392;1010267;BOI040;PBB013;00:29:04;fisso;https://search.corpuskiparla.it/corpus/conversations/PBB013.html;https://search.corpuskiparla.it/corpus/conversations/PBB013_jefferson.html;46-50;F;BO;2;oper;sì;asimmetrico;emilia-romagna;intervista semistrutturata;dip_tec_prof;balia degli eventi // si // e il trasporto pubblico a bologna nel bacino di bologna funziona bene? // ma io direi di si // io;direi;di si // insomma le zone // nonostante tutto nonostante il casino nonostante i tempi un po'' // e // e // lunghi e da di;1;;;;;;;;;;;;;;;;;;;;;;;0
KPS004;#718361;doc#110;2022;https://search.corpuskiparla.it/corpus/player/player.cgi?code=KPS004&begin=293021&end=294050;293021;294050;PKP033;KPS004;02:02:15;libero;https://search.corpuskiparla.it/corpus/conversations/KPS004.html;https://search.corpuskiparla.it/corpus/conversations/KPS004_jefferson.html;26-30;F;LE;3;intell;no;simmetrico;emilia-romagna;pasto;laurea;caldo // pigliati quello che vuoi che io mo me piglio l''altre // i cuori pigliali belli cuoricini eh // // // no ma non mh //;direi;basta // io non ne voglio più // finché ti regoli // sì // okay // sono cotte // mh mh // mh // mh mh // è comodo sto coso per fare;;;;;1;;;;;;;;;;;;;;;;;;1;0
PTB022;#746410;doc#111;2019;https://search.corpuskiparla.it/corpus/player/player.cgi?code=PTB022&begin=1660722&end=1665128;1660722;1665128;TOI075;PTB022;00:33:31;fisso;https://search.corpuskiparla.it/corpus/conversations/PTB022.html;https://search.corpuskiparla.it/corpus/conversations/PTB022_jefferson.html;over 85;M;TO;3;pens;sì;asimmetrico;piemonte;intervista semistrutturata;dip_tec_prof;tendono a // pensare che una volta si stava bene // poi tutti hanno nostalgia // del passato ma // in linea di massima non;direi;che la situazione sia migliorata // mhmhmh // secondo il mio modesto parere // tutto è relativo eh // quello che sta bene;1;;;;;;;;;;;;;;;;;;;;;;;0
BOC1005;#750131;doc#112;2017/18;https://search.corpuskiparla.it/corpus/player/player.cgi?code=BOC1005&begin=1130943&end=1132695;1130943;1132695;BO105;BOC1005;00:26:22;fisso;https://search.corpuskiparla.it/corpus/conversations/BOC1005.html;https://search.corpuskiparla.it/corpus/conversations/BOC1005_jefferson.html;21-25;F;BO;2;stud;sì;asimmetrico;emilia-romagna;esame;laurea in corso;magari in classi più ridotte si riesce // ad andare incontro al metodo di studio ti tutti // ehm // come fattori interni //;direi;che c'' è eh // sì sulla biografia linguistica magari ci sono alcuni aspetti legati alla biografia linguistica // non mi;1;;;;;;;;;;;;;;;;;;;;;;;0
BOC1005;#751053;doc#112;2017/18;https://search.corpuskiparla.it/corpus/player/player.cgi?code=BOC1005&begin=1479221&end=1483370;1479221;1483370;BO104;BOC1005;00:26:22;fisso;https://search.corpuskiparla.it/corpus/conversations/BOC1005.html;https://search.corpuskiparla.it/corpus/conversations/BOC1005_jefferson.html;36-40;F;BO;2;intell;sì;asimmetrico;emilia-romagna;esame;phd;della progettazione colaborativa eccetera quindi molto piú olistica // diminuita sì // va bene senti allora io;direi;che per questa parte ci possiamo fermare // ehm // sicuramente ecco si percepisce che non hai studiato le slide perchè //;1;;;;;;;;;;;;;;;;;;;;;;;0
PBC015;#751403;doc#113;2022;https://search.corpuskiparla.it/corpus/player/player.cgi?code=PBC015&begin=36050&end=38277;36050;38277;BOI037;PBC015;00:32:24;fisso;https://search.corpuskiparla.it/corpus/conversations/PBC015.html;https://search.corpuskiparla.it/corpus/conversations/PBC015_jefferson.html;61-65;M;BO;2;pens;sì;asimmetrico;emilia-romagna;intervista semistrutturata;laurea;x // // eh vabbè insomma // poi son rimasto sempre qui quindi // quindi comunque la conosci abbastanza bene // la città;direi;di sì // vabbè dai almeno quello // eh // comunque non so eh eh è una buona città cioè come si trova? // ma io l''ho scelta devo;;;;;1;;;;;;;;;;;;;;;;;1;;0
PBC015;#754374;doc#113;2022;https://search.corpuskiparla.it/corpus/player/player.cgi?code=PBC015&begin=1179952&end=1183910;1179952;1183910;BOI037;PBC015;00:32:24;fisso;https://search.corpuskiparla.it/corpus/conversations/PBC015.html;https://search.corpuskiparla.it/corpus/conversations/PBC015_jefferson.html;61-65;M;BO;2;pens;sì;asimmetrico;emilia-romagna;intervista semistrutturata;laurea;po'' d''attenzione // li riconosci insomma ecco il // devo dire che ormai almeno per me eh sì il centro storico di bologna //;direi;che non non mi crea più problemi da nessuna parte insomma ecco // meno male // cosa un po'' diversa ovviamente sono le zone;1;;;;;;;;;;;;;;;;;;;;;;;0
PBC015;#754584;doc#113;2022;https://search.corpuskiparla.it/corpus/player/player.cgi?code=PBC015&begin=1258540&end=1259330;1258540;1259330;BOI037;PBC015;00:32:24;fisso;https://search.corpuskiparla.it/corpus/conversations/PBC015.html;https://search.corpuskiparla.it/corpus/conversations/PBC015_jefferson.html;61-65;M;BO;2;pens;sì;asimmetrico;emilia-romagna;intervista semistrutturata;laurea;sempre tutto però dai // io ripeto // eh // con l''esperienza che ho // e con gli anni che che che ho vissuto qui //;direi;che // mi sono sempre trovato abbasta~ poi ovviamente come tutti ho avuto i miei problemi ho avuto le mie difficoltà // eh;1;;;;;;;;;;;;;;;;;;;;;;;0
PBC015;#756257;doc#113;2022;https://search.corpuskiparla.it/corpus/player/player.cgi?code=PBC015&begin=1924470&end=1926070;1924470;1926070;BOR010;PBC015;00:32:24;fisso;https://search.corpuskiparla.it/corpus/conversations/PBC015.html;https://search.corpuskiparla.it/corpus/conversations/PBC015_jefferson.html;21-25;F;BO;2;stud;sì;asimmetrico;emilia-romagna;intervista semistrutturata;laurea in corso;soluzione usa questo eh // eh // vedo che non è utile per niente e quindi // no no eh ma infatti purtroppo // // aiuta sempre;direi;// // andare avanti // eh // bene // va bene direi che // intanto grazie ancora perchè // niente figurati // ascolta eh sono;;;;;1;;;;;;;;;;;;;;;;;1;;0
PBC015;#756269;doc#113;2022;https://search.corpuskiparla.it/corpus/player/player.cgi?code=PBC015&begin=1930890&end=1932203;1930890;1932203;BOR010;PBC015;00:32:24;fisso;https://search.corpuskiparla.it/corpus/conversations/PBC015.html;https://search.corpuskiparla.it/corpus/conversations/PBC015_jefferson.html;21-25;F;BO;2;stud;sì;asimmetrico;emilia-romagna;intervista semistrutturata;laurea in corso;per niente e quindi // no no eh ma infatti purtroppo // // aiuta sempre direi // // andare avanti // eh // bene // va bene;direi;che // intanto grazie ancora perchè // niente figurati // ascolta eh sono le quattro quindi cosa ti accompagno da rossi?;1;;;;;;;;;;;;;;;;;;;;;;;0
BOD1001;#770525;doc#114;2017/18;https://search.corpuskiparla.it/corpus/player/player.cgi?code=BOD1001&begin=5489782&end=5494078;5489782;5494078;BO013;BOD1001;01:36:24;fisso;https://search.corpuskiparla.it/corpus/conversations/BOD1001.html;https://search.corpuskiparla.it/corpus/conversations/BOD1001_jefferson.html;51-55;M;BO;2;intell;no;asimmetrico;emilia-romagna;lezione;phd;di tutto quello che dovrebbe avere un bambino // ci fermiamo qua // per oggi ehm // dunque lunedì // è l'' ultima lezione;direi;almeno dai miei conti dovrebbe essere l'' ultima lezione // eh rimangono // in ballo alcune cose eh il film // eh vedo se;;;;;1;;;;;;;;;;;;;;;;;1;;0
BOD1001;#771063;doc#114;2017/18;https://search.corpuskiparla.it/corpus/player/player.cgi?code=BOD1001&begin=5709091&end=5711582;5709091;5711582;BO013;BOD1001;01:36:24;fisso;https://search.corpuskiparla.it/corpus/conversations/BOD1001.html;https://search.corpuskiparla.it/corpus/conversations/BOD1001_jefferson.html;51-55;M;BO;2;intell;no;asimmetrico;emilia-romagna;lezione;phd;// eh che giorno è della settimana aspetta // allora l'' undici è mercoledì // il dodici sarebbe un giovedì // bah sì;direi;di sì comunque ci sentiamo eh? // dobbiamo scrivere un'' email o? // sì mh mandatemi un'' email eh // quella settimana lì;;;;;1;1;;;;;;;;;;;;;;;;1;;0
KPS007;#777789;doc#115;2020;https://search.corpuskiparla.it/corpus/player/player.cgi?code=KPS007&begin=2090749&end=2094593;2090749;2094593;PKP134;KPS007;00:37:21;libero;https://search.corpuskiparla.it/corpus/conversations/KPS007.html;https://search.corpuskiparla.it/corpus/conversations/KPS007_jefferson.html;26-30;F;PE;2;intell;no;simmetrico;abruzzo;pasto;laurea;provarle // allora io mo devo assolutamente scrivere // eh certo // mhmh // finire e inoltrare al prof // okay // ehm // poi;direi;che x volendo faccio qualche prova di outfit // ehm // e poi cioè i~ vorrei fare attività fisica visto che alle otto;1;;;;;;;;;;;;;;;;;;;;;;;0
BOD2013;#780224;doc#116;2017/18;https://search.corpuskiparla.it/corpus/player/player.cgi?code=BOD2013&begin=888445&end=890725;888445;890725;BO098;BOD2013;00:18:28;fisso;https://search.corpuskiparla.it/corpus/conversations/BOD2013.html;https://search.corpuskiparla.it/corpus/conversations/BOD2013_jefferson.html;21-25;M;BO;2;stud;sì;simmetrico;emilia-romagna;intervista semistrutturata;laurea in corso;po'' del rossi // mh il rossi? // // il rossi è un bellissimo soggetto // è un ragazzo molto vivace // e estremamente vivace;direi;// canta si sveglia la mattina canta lava i piatti canta a squarciagola // che a volte ti viene da tirargli una scarpa in;;;;;1;;;;;;;;;;;;;;;;;1;;0
PBC024;#784373;doc#117;2024;https://search.corpuskiparla.it/corpus/player/player.cgi?code=PBC024&begin=1638230&end=1639050;1638230;1639050;BOI104;PBC024;01:10:00;fisso;https://search.corpuskiparla.it/corpus/conversations/PBC024.html;https://search.corpuskiparla.it/corpus/conversations/PBC024_jefferson.html;66-70;F;BO;3;pens;sì;asimmetrico;emilia-romagna;intervista semistrutturata;laurea;accendi la luce // la mortadella // la mortadella? // mh // metto la mortadella e poi cosa ci mettiamo cosa ci mettiamo //;direi;basta // beh insomma // ma il ripieno lo comprate fatto // uova // eh il ripieno quando è fatto si fa la sfoglia // lo fate;;;;;1;;;;;;;;;;;;;;;;;;1;0
PBC024;#787293;doc#117;2024;https://search.corpuskiparla.it/corpus/player/player.cgi?code=PBC024&begin=2931740&end=2935530;2931740;2935530;BOR036;PBC024;01:10:00;fisso;https://search.corpuskiparla.it/corpus/conversations/PBC024.html;https://search.corpuskiparla.it/corpus/conversations/PBC024_jefferson.html;31-35;F;BO;3;intell;sì;asimmetrico;emilia-romagna;intervista semistrutturata;phd;capito queste cose qua ti racconto io di cesare // beh giusto va bene giusto giusto // e poi cosa volete ancora? // no ma no;direi;che gua~ guardami un attimo // sì guardo sì // per non dire anche quando che magari andavamo alla biblioteca // ehm // qui;1;;;;;;;;;;;;;;;;;;;;;;;0
BOD2006;#791739;doc#118;2017/18;https://search.corpuskiparla.it/corpus/player/player.cgi?code=BOD2006&begin=466961&end=467811;466961;467811;BO051;BOD2006;00:18:57;fisso;https://search.corpuskiparla.it/corpus/conversations/BOD2006.html;https://search.corpuskiparla.it/corpus/conversations/BOD2006_jefferson.html;26-30;M;BO;2;stud;sì;simmetrico;emilia-romagna;intervista semistrutturata;laurea in corso;// assolutamente sí assolutamente sí // un'' esperienza meravigliosa sotto tutti i punti di vista // sí //;direi;sí // ti ha c''é q~ c''é q~ un qualche episodio in particolare m magari divertente che puoi raccontare o // beh e // anche;1;;;;;;;;;;;;;;;;;;;;;1;;0
BOD2006;#791981;doc#118;2017/18;https://search.corpuskiparla.it/corpus/player/player.cgi?code=BOD2006&begin=552671&end=556011;552671;556011;BO051;BOD2006;00:18:57;fisso;https://search.corpuskiparla.it/corpus/conversations/BOD2006.html;https://search.corpuskiparla.it/corpus/conversations/BOD2006_jefferson.html;26-30;M;BO;2;stud;sì;simmetrico;emilia-romagna;intervista semistrutturata;laurea in corso;o a parigi avevi dei coinquilini con cui passavi del tempo? oppure // sí peró anche lí ho mantenuto lo stesso regime;direi;// sí? // sí grosso modo sí // lupo solitario // sí in casa sí in casa sí // bene // ehm vediamo // puoi parlarmi un po'' del dei;;;;;1;;;;;;;;;;;;;;;;;1;;0
BOD2006;#792952;doc#118;2017/18;https://search.corpuskiparla.it/corpus/player/player.cgi?code=BOD2006&begin=911700&end=917130;911700;917130;BO051;BOD2006;00:18:57;fisso;https://search.corpuskiparla.it/corpus/conversations/BOD2006.html;https://search.corpuskiparla.it/corpus/conversations/BOD2006_jefferson.html;26-30;M;BO;2;stud;sì;simmetrico;emilia-romagna;intervista semistrutturata;laurea in corso;visitato grosso modo tutto il vietnam del sud // che però ci è piaciuto meno della cambogia sì // ah meno come mai? // mah;direi;forse anche la stanchezza dopo dopo tanto tempo in viaggio // ah // e anche perché diciamo che le persone in vietnam hanno;;;;;1;1;;;;;;;;;;;;;;;;1;;0
BOD2006;#793540;doc#118;2017/18;https://search.corpuskiparla.it/corpus/player/player.cgi?code=BOD2006&begin=1127270&end=1132260;1127270;1132260;BO049;BOD2006;00:18:57;fisso;https://search.corpuskiparla.it/corpus/conversations/BOD2006.html;https://search.corpuskiparla.it/corpus/conversations/BOD2006_jefferson.html;21-25;F;BO;2;stud;sì;simmetrico;emilia-romagna;intervista semistrutturata;laurea in corso;m'' ha regalato i biglietti // bella bella // eh ma che bello // sì sì // bello // per me e per leisì // bene dai // sì // dai io;direi;siamo a posto così non ti disturbooltre // okay // ti ringrazio // buona giornata // buona giornata // okay // allora //;;;;;1;;;;;;;;;;;;;;;;;1;;0
TOC1002;#801762;doc#120;2017/18;https://search.corpuskiparla.it/corpus/player/player.cgi?code=TOC1002&begin=1126870&end=1134501;1126870;1134501;TO006;TOC1002;00:20:06;fisso;https://search.corpuskiparla.it/corpus/conversations/TOC1002.html;https://search.corpuskiparla.it/corpus/conversations/TOC1002_jefferson.html;56-60;M;TO;2;intell;sì;asimmetrico;piemonte;esame;phd;lo sanziona ma non può comandarlo // mh mh // ehm // dunque abbiamo detto tutto sul rapporto sugli amministratori;direi;di sì abbiamo chiarito la nomina la revoca una cosa ci resta da dire // un dato mnemonico se se lo ricorda lei mi ha detto che;;;;;1;;;;;;;;;;;;;;;;;1;;0
BOD2016;#802197;doc#121;2017/18;https://search.corpuskiparla.it/corpus/player/player.cgi?code=BOD2016&begin=76368&end=81020;76368;81020;BO120;BOD2016;00:09:52;fisso;https://search.corpuskiparla.it/corpus/conversations/BOD2016.html;https://search.corpuskiparla.it/corpus/conversations/BOD2016_jefferson.html;26-30;M;BO;2;stud;sì;simmetrico;puglia;intervista semistrutturata;laurea in corso;la cucina è diciamo è cucina è poco vivibile // quindi cioè non ci sono gli spazi umani per vivercela assieme // quindi;direi;piuttosto che cioè non si vivono molto gli spazi comuni ma piuttosto // che una persona cucina e poi magari o mangia in in;1;;;;;;;;;;;;;;;;;;;;;;;0
BOD2016;#802334;doc#121;2017/18;https://search.corpuskiparla.it/corpus/player/player.cgi?code=BOD2016&begin=121061&end=122817;121061;122817;BO120;BOD2016;00:09:52;fisso;https://search.corpuskiparla.it/corpus/conversations/BOD2016.html;https://search.corpuskiparla.it/corpus/conversations/BOD2016_jefferson.html;26-30;M;BO;2;stud;sì;simmetrico;puglia;intervista semistrutturata;laurea in corso;una convivenza non convivenza perché comunque ci si vede poco e quindi cioè // più convivenza che amicizia magari // sì;direi;di sì sì // ehm tu sei stato anche in erasmus comunque quindi hai fatto anche un'' altra esperienza con~ sempre con;;;;;1;;;;;;;;;;;;;;;;;1;;0
